platform,stock_symbol,stock_name,date,year_month,full_content,content_length,sentiment_compound,sentiment_positive,sentiment_neutral,sentiment_negative,sentiment_category,positive_word_count,negative_word_count,word_sentiment_score,word_sentiment
Reddit,GOOGL,Alphabet,3/9/2025 4:28:35,2025-03,"GOOGL is the most bullish ""safe"" stock for long investors My arguments are the following: \- Alphabet has consecutively beat the earnings estimates demonstrating good management. \- Waymo could grow to generate 200-400 billion of additional revenue in the upcoming years \- google cloud will contribute to the revenue expansion \- PE of 21 for a company of this profitability and size is amazing and unparalleled \- currently trading at the 52 week average \-the steady increase in research and development costs (currently >50 billion) is what creates value in the long term through innovation My 2 cents: you can check again this tread in 2027, and the stock price will be >400 USD by then. Disclosure: not intended as a financial advice, I personally own a significant position in Alphabet, and would be happy to discuss the topic further.",842,0.96,0.158,0.824,0.018,Positive,7,0,1,Positive
Reddit,GOOGL,Alphabet,2/27/2025 18:56:30,2025-02,"Is Google ($GOOGL) a great long-term buy after the recent drop Google (GOOGL) has been dropping quite a bit recently, and I’m wondering if this presents a great long-term buying opportunity. Do you think it’s a solid investment for the next 10 years? I’d love to hear your thoughts on their business model, search dominance, AI potential, and any risks you see (e.g., competition, regulation, or ad revenue slowdown). Would you be buying at these levels or waiting for a better entry point?",490,0.9563,0.23,0.726,0.044,Positive,8,1,0.7777777778,Positive
Reddit,GOOGL,Alphabet,3/18/2025 8:03:22,2025-03,$GOOG & $GOOGL buy WIZ start up $32 Billion $GOOG & $GOOGL buy WIZ start up $32 Billion [https://finance.yahoo.com/news/google-agrees-buy-cybersecurity-startup-114156877.html](https://finance.yahoo.com/news/google-agrees-buy-cybersecurity-startup-114156877.html),262,0,0,1,0,Neutral,2,0,1,Positive
Reddit,GOOGL,Alphabet,3/4/2025 17:47:50,2025-03,Waiting to be stimulated GOOGL Let's wait for the next move What's going to happen https://preview.redd.it/edkpc2ku4rme1.png?width=763&format=png&auto=webp&s=57f88ca916d03f34a57237bbad8466869fcaaf34,198,0.2263,0.112,0.888,0,Positive,0,0,0,Neutral
Reddit,GOOGL,Alphabet,11/21/2024 17:52:06,2024-11,"Why is nobody talking about GOOGL? Yesterday I was thinking about GOOGL as a safe bet since I felt it is undervalued and then today it tanked 7%! I still cant believe we were awarded with such a discount. Seriously, Alphabet is super undervalued now! Its average LOW target is $170. With crushing the last earnings my target is 190, and analysts target is 200. If you dont have idea where to throw money with a very low risk, buy GOOGL while you can as minimum 10% uprise comes soon. It can go up to 20%. Took call option: 190 shares at 166.89",543,0.3569,0.104,0.785,0.111,Positive,1,1,0,Neutral
Reddit,GOOGL,Alphabet,7/28/2024 11:03:33,2024-07,"$GOOGL Google is in a big trouble in the long run - here is why Let's do the math directly and take a look at Google ads results in 2023: - The revenue generated by Google ads in 2023 is $237 billion. - The revenue portion from Google search engine is around 60%!!! That means out of the $237 billion, around $142 billion revenue is generated from the search engine or search ads. - Google's total revenue for 2023 was $305 billion, that means the revenue from the search engine only (not entire Google ads) makes around 45% of Google's total revenue. Now the second search engine behind Google is Microsoft Bing, Microsoft generated in 2023 only $12 Billion from Bing ads. Google by far is the dominant as for now, and Microsoft although in the second place behind them, won't be able to reach even a quarter of Google's revenue, they had many failed attempts to promote Bing. Now some of you probably heared about the upcoming releases of SearchGPT, whoever tried ChatGPT will know it's by far better than Gemini and the other AI models, if Openai released their SearchGPT and people switched from Google search to SearchGPT (which I personally think will happen), Google in this case will keep 45% of its total revenue vulnerable by SearchGPT. TL;DR Google have strong exposure to its search engine, the revenue generated from the search engine is around 45% of its total revenue, with the upcoming release of SearchGPT, Google may lose its dominance in the long term which may cause their revenue growth to stop or decline. Not a finacial advice",1549,0.3348,0.054,0.9,0.046,Positive,3,2,0.2,Positive
Reddit,GOOGL,Alphabet,3/13/2025 15:28:08,2025-03,GOOGL - do you think I will make money on this play? -$20k down GOOGL: - Sep 19 2025 200 Call - May 16 2025 189 Call - April 17 2025 210 Call,141,0.4118,0.092,0.908,0,Positive,0,0,0,Neutral
Reddit,GOOGL,Alphabet,5/6/2021 5:09:01,2021-05,"I bought into GOOG instead of GOOGL. Did I make a mistake here? I was trying to buy some Google shares and picked up GOOG instead of GOOGL without checking. ( I simply assumed the more expensive one had voting rights , not that I care about the vote at all ) But since GOOGL is Cheaper & has Voting rights. Would I be better off selling GOOG and repurchasing GOOGL instead?",373,0.51,0.088,0.859,0.053,Positive,2,1,0.3333333333,Positive
Reddit,GOOGL,Alphabet,2/27/2025 19:13:21,2025-02,"The market is testing my trust in Nancy https://preview.redd.it/ix3rv84purle1.png?width=1223&format=png&auto=webp&s=0aa19900667e08920348e44629a761c01c48f883 https://preview.redd.it/qlndx2mwurle1.png?width=686&format=png&auto=webp&s=76b7e82bf6c2d4dc07cf10cfd2ada817e60ddb80 Bought most of the GOOGL when it was at 185, 182 and 180, and AMZN at 222, 215 and 212 around last week. I did expect the market to pull back but did not expect a big on on GOOGL and then AMZN. I still believe GOOGL and AMZN will make a run back up after weathering this selloff, and I do have some times on my side. But multiple selloff days definitely trickering a little doubts in the play right now. My plan is to hold until at least breakeven for most of GOOGL call and start revising based on the economy at the time. But I still believe Nancy holding big portions of GOOGL and AMZN for certain reasons.",882,0.7905,0.088,0.877,0.036,Positive,0,0,0,Neutral
Reddit,GOOGL,Alphabet,2/28/2025 16:49:50,2025-02,Google's Sergey Brin Says Engineers Should Work 60-Hour Weeks in Office to Build AI That Could Replace Them,107,0,0,1,0,Neutral,0,0,0,Neutral
Reddit,GOOGL,Alphabet,2/13/2025 11:59:58,2025-02,"Nancy Pelosi NEW $GOOGL Position 🗞️ Nancy Pelosi’s financial disclosure report shows she purchased 50 call options on Alphabet Inc. (GOOGL) with a $150 strike price, expiring in January 2026. The transaction, valued between $250,001 and $500,000, suggests a bullish stance on Google’s stock price. Possible Short-Term Impact on GOOGL: 1. Increased Market Attention: Large trades by high-profile figures, especially politicians, often attract retail and institutional investors. This could lead to short-term buying pressure on GOOGL. 2. Speculation on Future Catalysts: Pelosi’s stock trades have historically sparked speculation about potential government policies or insider knowledge. Investors might anticipate upcoming favorable developments for Google (e.g., regulatory decisions, AI advancements). 3. Momentum Effect: If traders interpret this move as a signal of confidence in Google’s future performance, the stock price could experience short-term upward momentum.",974,0.8876,0.101,0.873,0.026,Positive,4,0,1,Positive
Reddit,GOOGL,Alphabet,3/18/2024 14:57:24,2024-03,Google +900k gain Started buying Google calls after it decided it wanted to tag the 200 day(the greatest buy signal ever for big caps). Hammered some 138’s expiring 3/22 last Friday after we spent an hour around the 140 mark. Something told me it wants to continue its momo. Got lucky with that Apple/Google news. Sold everything during the morning pop around 151. Hit a new milestone in the ol’ Robinhood this morning as well. Sold the Apple as well.,451,0.9274,0.165,0.835,0,Positive,3,2,0.2,Positive
Reddit,GOOGL,Alphabet,1/23/2023 14:04:40,2023-01,Google is doing layoffs,23,0,0,1,0,Neutral,0,0,0,Neutral
Reddit,GOOGL,Alphabet,1/20/2025 12:13:21,2025-01,New trades from our lady and leader $GOOGL $AMZN $NVDA $PANW $TEM $VST. Sold $APPL. What does this mean? 🤔 bear fukt 🏳️‍🌈🐻🖕🏻🤡🖕🏻,127,0,0,1,0,Neutral,1,1,0,Neutral
Reddit,GOOGL,Alphabet,10/29/2024 18:07:08,2024-10,"Russian court fines Google $20,000,000,000,000,000,000,000,000,000,000,000",74,0,0,1,0,Neutral,0,0,0,Neutral
Reddit,GOOGL,Alphabet,2/5/2025 19:52:40,2025-02,$Googl - Only sell if Pelosi sells.,35,0,0,1,0,Neutral,0,1,-1,Negative
Reddit,GOOGL,Alphabet,2/12/2024 12:07:05,2024-02,Nvidia Is Now More Valuable Than Amazon And Google So more calls? 😂😜,68,0.6549,0.327,0.673,0,Positive,0,0,0,Neutral
Reddit,GOOGL,Alphabet,8/13/2024 17:03:15,2024-08,"Bloomberg: US Considers a Rare Antitrust Move: Breaking Up Google A rare bid to break up Alphabet Inc.’s Google is one of the options being considered by the Justice Department after a landmark court ruling found that the company monopolized the online search market, according to people with knowledge of the deliberations. The move would be Washington’s first push to dismantle a company for illegal monopolization since unsuccessful efforts to break up Microsoft Corp. two decades ago. Less severe options include forcing Google to share more data with competitors and measures to prevent it from gaining an unfair advantage in AI products, said the people, who asked not to be identified discussing private conversations. Regardless, the government will likely seek a ban on the type of exclusive contracts that were at the center of its case against Google. If the Justice Department pushes ahead with a breakup plan, the most likely units for divestment are the Android operating system and Google’s web browser Chrome, said the people. Officials are also looking at trying to force a possible sale of AdWords, the platform the company uses to sell text advertising, one of the people said. The Justice Department discussions have intensified in the wake of Judge Amit Mehta’s Aug. 5 ruling that Google illegally monopolized the markets of online search and search text ads. Google has said it will appeal that decision, but Mehta has ordered both sides to begin plans for the second phase of the case, which will involve the government’s proposals for restoring competition, including a possible breakup request. Alphabet shares fell as much as 2.5% to $160.11 in after-hours trading before erasing some losses. A Google spokesman declined to comment on the possible remedy. A Justice Department spokeswoman also declined to comment. The US plan will need to be accepted by Mehta, who would direct the company to comply. A forced breakup of Google would be the biggest of a US company since AT&T was dismantled in the 1980s. Justice Department attorneys, who have been consulting with companies affected by Google’s practices, have raised concerns in their discussions that the company’s search dominance gives it advantages in developing artificial intelligence technology, the people said. As part of a remedy, the government might seek to stop the company from forcing websites to allow their content to be used for some of Google’s AI products in order to appear in search results. **Breakup** Divesting the Android operating system, used on about 2.5 billion devices worldwide, is one of the remedies that’s been most frequently discussed by Justice Department attorneys, according to the people. In his decision, Mehta found that Google requires device makers to sign agreements to gain access to its apps like Gmail and the Google Play Store. Those agreements also require that Google’s search widget and Chrome browser be installed on devices in such a way they can’t be deleted, effectively preventing other search engines from competing, he found. Mehta’s decision follows a verdict by a California jury in December that found the company monopolized Android app distribution. A judge in that case hasn’t yet decided on relief. The Federal Trade Commission, which also enforces antitrust laws, filed a brief in that case this week and said in a statement that Google shouldn’t be allowed “to reap the rewards of illegal monopolization.” Google paid as much as $26 billion to companies to make its search engine the default on devices and in web browsers, with $20 billion of that going to Apple Inc. Mehta’s ruling also found Google monopolized the advertisements that appear at the top of a search results page to draw users to websites, known as search text ads. Those are sold via Google Ads, which was rebranded from AdWords in 2018 and offers marketers a way to run ads against certain search keywords related to their business. About two-thirds of Google’s total revenue comes from search ads, amounting to more than $100 billion in 2020, according to testimony from last year’s trial. If the Justice Department doesn’t call for Google to sell off AdWords, it could ask for interoperability requirements that would make it work seamlessly on other search engines, the people said. **Data Access** Another option would require Google to divest or license its data to rivals, such as Microsoft’s Bing or DuckDuckGo. Mehta’s ruling found that Google’s contracts ensure not only that its search engine gets the most user data – 16 times as much as its next closest competitor — but that data stream also keeps its rivals from improving their search results and competing effectively. Europe’s recently enacted digital gatekeeper rules imposed a similar requirement that Google make available some of its data to third-party search engines. The company has said publicly that sharing data can pose user privacy concerns, so it only makes available information on searches that meet certain thresholds. Requiring monopolists to allow rivals to have some access to technology has been a remedy in previous cases. In the Justice Department’s first case against AT&T in 1956, the company was required to provide royalty-free licenses to its patents. In the antitrust case against Microsoft, the settlement required the Redmond, Washington, tech giant to make some of its so-called application programming interfaces, or APIs, available to third-parties for free. APIs are used to ensure that software programs can effectively communicate and exchange data with each other. **AI Products** For years, websites have allowed Google’s web crawler access to ensure they appear in the company’s search results. But more recently some of that data has been used to help Google develop its AI. Last fall, Google created a tool to allow websites to block scraping for AI, after companies complained. But that opt-out doesn’t apply to everything. In May, Google announced that some searches will now come with “AI Overviews,” narrative responses that spare people the task of clicking through various links. The AI-powered panel appears underneath queries, presenting summarized information drawn from Google search results from across the web. Google doesn’t allow website publishers to opt-out of appearing in AI Overviews, since those are a “feature” of search, not a separate product. Websites can block Google from using snippets, but that applies to both search and the AI Overviews. While AI Overviews only appear on a fraction of searches, the feature’s roll-out has been rocky after some excerpts offered embarrassing suggestions, like advising people to eat rocks or to put glue on pizza. https://www.bloomberg.com/news/articles/2024-08-13/doj-considers-seeking-google-goog-breakup-after-major-antitrust-win",6821,0.9981,0.121,0.834,0.044,Positive,2,8,-0.6,Negative
Reddit,GOOGL,Alphabet,2/5/2025 11:26:19,2025-02,Google opens its most powerful AI model to the public,53,0.4754,0.256,0.744,0,Positive,0,0,0,Neutral
Reddit,GOOGL,Alphabet,10/30/2022 21:40:11,2022-10,Burry is a fan of Musk - Google and Meta next?,46,0.3182,0.223,0.777,0,Positive,0,0,0,Neutral
Reddit,GOOGL,Alphabet,4/24/2024 3:04:16,2024-04,"GOOG: The Guy Who Killed Yahoo Search is Now Running Google's So I was digging around and found out that Prabhakar Raghavan, the head of Google Search, used to be the head of search at Yahoo from 2005 to 2012. And let me tell you, it's not a pretty story. During his time at Yahoo, the company's search market share PLUMMETED from 30.4% to 13.4%. Yeah, you read that right - it was a FREE FALL. And it's not like he was just a bystander, he was in charge of research and development for Yahoo's search and ads products. But wait, it gets better. Under his leadership, Yahoo's search market share DECLINED FOR 9 CONSECUTIVE MONTHS. And to top it all off, Yahoo had its LARGEST LAYOFFS IN CORPORATE HISTORY at the time, cutting nearly 2,000 jobs. Is this a risk to GOOG long-term healthy growth? Have they started prioritizing short-term ad revenue over user experience, flooding search results with spam and ads to inflate earnings? Are we seeing a repeat of Yahoo's mistakes?",975,0.6833,0.116,0.793,0.092,Positive,3,2,0.2,Positive
Reddit,GOOGL,Alphabet,10/14/2023 18:35:17,2023-10,Puts on $GOOGL I put meme as the flair because Youtube / $GOOGL is such a meme.,79,0,0,1,0,Neutral,0,0,0,Neutral
Reddit,GOOGL,Alphabet,2/8/2023 10:54:58,2023-02,Google AI chatbot Bard offers inaccurate information in company ad; stock down -7.5%,84,0,0,1,0,Neutral,0,0,0,Neutral
Reddit,GOOGL,Alphabet,5/10/2023 18:14:25,2023-05,Here's why $GOOGL was up today,30,0,0,1,0,Neutral,0,0,0,Neutral
Reddit,GOOGL,Alphabet,2/9/2025 13:20:35,2025-02,"Deepseek’s AI model is ‘the best work’ out of China but the hype is ‘exaggerated,’ Google Deepmind CEO says",107,0.3818,0.126,0.874,0,Positive,1,0,1,Positive
Reddit,GOOGL,Alphabet,12/20/2024 12:44:59,2024-12,Google cut manager and VP roles by 10% in its efficiency push.,62,0.1027,0.171,0.685,0.144,Positive,0,0,0,Neutral
Reddit,GOOGL,Alphabet,1/30/2021 9:27:29,2021-01,Google helps Robinhood after swarm of negative reviews drops company to 1-star rating. Fuck Google and Robinhood,112,-0.6808,0.109,0.588,0.303,Negative,0,1,-1,Negative
Reddit,GOOGL,Alphabet,2/4/2025 16:09:04,2025-02,Google shares are trading lower after mixed Q4 results Alphabet (NASDAQ:GOOG) reported quarterly earnings of $2.15 per share which beat the analyst consensus estimate of $2.12 by 1.42 percent. This is a 31.1 percent increase over earnings of $1.64 per share from the same period last year. The company reported quarterly sales of $96.469 billion which missed the analyst consensus estimate of $96.649 billion by 0.19 percent. This is a 11.77 percent increase over sales of $86.310 billion the same period last year.,515,0.7003,0.125,0.826,0.049,Positive,3,2,0.2,Positive
Reddit,GOOGL,Alphabet,7/22/2024 22:45:27,2024-07,"Wiz walks away from $23 billion deal with Google, will pursue IPO Wiz walks away from $23 billion deal with Google, will pursue IPO https://www.cnbc.com/2024/07/23/google-wiz-deal-dead.html?__source=iosappshare%7Ccom.apple.UIKit.activity.CopyToPasteboard",254,0,0,1,0,Neutral,0,0,0,Neutral
Reddit,GOOGL,Alphabet,10/25/2023 22:01:24,2023-10,Google is done for.... This quarter they only made 19.7 Billion USD in net income which is abysmally low for a company it's size. Despite their AI efforts and initiatives the past 6 months Microsoft is clearly eating their lunch with bing gaining ground on Google when it comes to search and overall ad revenue. The 9.67% down day is completely justified due to Google cloud's dreadful growth which will be Google's unbecoming. Google ONLY made 8.42 billion dollars compared to 8.64 billion dollars expectation which can result into a going concern for bankruptcy. AI is not Google's strong suit and they have overpaid for YouTube sports which will net them no profits. Overall tiktok and Microsoft will make Google obsolete as AI advanced and tiktok becomes the new YouTube for content creators and seekers of entertainment.,825,0.7711,0.123,0.798,0.079,Positive,3,1,0.5,Positive
Reddit,GOOGL,Alphabet,4/29/2024 5:05:20,2024-04,"Is it too late to hold Alphabet (Google) for long term? So Alphabet announced its 1st ever dividend, it has a lot of cash in hand despite the slip with Gemini. I came to the party late and got the GOOGL at $172 (trading US stocks had expensive costs in my country until the recent years) In this scenario, would you still hold it for long term?",344,0.7399,0.09,0.91,0,Positive,0,0,0,Neutral
Reddit,GOOGL,Alphabet,3/17/2025 18:53:10,2025-03,"Alphabet in Talks to Buy Cloud Security Firm Wiz for $33 Billion [https://www.bloomberg.com/news/articles/2025-03-17/alphabet-in-talks-to-buy-cloud-security-firm-wiz-for-33-billion](https://www.bloomberg.com/news/articles/2025-03-17/alphabet-in-talks-to-buy-cloud-security-firm-wiz-for-33-billion) > Alphabet Inc. is in talks to purchase the cloud security company Wiz for $33 billion, restarting deal discussions that were called off last summer after extended negotiations, according to people familiar with the matter. > The deal, which could be announced as soon as Tuesday, would bolster the cybersecurity offerings for Alphabet’s Google Cloud and provide it with a crucial marketing boost to compete against its larger cloud competitors, Amazon.com Inc.’s Amazon Web Services and Microsoft Corp.’s Azure. > For Wiz, the deal represents a reversal after the company turned down Alphabet’s $23 billion offer last July, sticking instead with a plan to remain independent and eventually pursue an initial public offering. Wiz and its investors balked at the deal in part because of worries of a protracted regulatory approval process, with competition authorities in the US and Europe focusing on the tech sector for its economic sway and market power. > Chief Executive Officer Assaf Rappaport, who described last year’s offer as “humbling,” also said he relished the idea of growing Wiz into an independent cybersecurity giant, to compete against the likes of CrowdStrike Holdings Inc. and Palo Alto Networks. > Started by Israelis and based in New York, Wiz’s investors include Sequoia Capital, Index Ventures, Insight Partners and Cyberstarts. Last year, the company was valued at $12 billion in a funding round.",1718,0.9325,0.086,0.902,0.012,Positive,2,0,1,Positive
Reddit,GOOGL,Alphabet,2/4/2025 16:17:07,2025-02,"Alphabet shares drop on company revenue miss [https://www.cnbc.com/2025/02/04/alphabet-q4-earnings-report-2024.html](https://www.cnbc.com/2025/02/04/alphabet-q4-earnings-report-2024.html) Here are the numbers: * **Revenue:** $96.47 vs. $96.56 billion expected by LSEG * **Earnings per share:** $2.15 vs. $2.13 expected by LSEG * **YouTube advertising revenue**: $10.47 billion vs. $10.23 billion, according to StreetAccount * **Google Cloud revenue:** $11.96 billion vs. $12.19 billion, according to StreetAccount * **Traffic acquisition costs (TAC)**: $14.89 billion vs. $15.01 billion, according to StreetAccount",614,-0.128,0.033,0.91,0.056,Negative,0,1,-1,Negative
Reddit,GOOGL,Alphabet,2/14/2024 19:14:14,2024-02,"Nvidia passes Alphabet in market cap, now the third most valuable U.S. company Nvidia surpassed Google parent Alphabet in market capitalization on Wednesday. It’s the latest example of how the artificial intelligence boom has sent the chipmaker’s stock soaring. Nvidia rose over 2% to close at $739.00 per share, giving it a market value of $1.83 trillion to Google’s $1.82 trillion market cap. The move comes one day after Nvidia surpassed Amazon in terms of market value. The symbolic milestone is more confirmation that Nvidia has become a Wall Street darling on the back of elevated AI chip sales, valued even more highly than some of the large software companies and cloud providers that develop and integrate AI technology into their products. Nvidia shares are up over 221% over the past 12 months on robust demand for its AI server chips that can cost more than $20,000 each. Companies like Google and Amazon need thousands of them for their cloud services. Before the recent AI boom, Nvidia was best known for consumer graphics processors it sold to PC makers to build gaming computers, a less lucrative market. Google was largely expected to benefit from AI, especially since employees at the company pioneered many of the techniques — such as transformer architecture — used in cutting-edge models like ChatGPT. Google shares are still up 55% in the past 12 months, though the company has grappled with layoffs and culture issues after it declared a “code red” situation to build AI services into its products. Google announced a $20 per month AI subscription called Gemini Advanced earlier this week, one of its first paid generative AI products. Nvidia is now the third largest U.S. company, only behind Apple and Microsoft. Nvidia reports quarterly earnings on Feb. 21. Analysts expect 118% annual growth in sales to $59.04 billion. Source: https://www.cnbc.com/2024/02/14/nvidia-passes-alphabet-market-cap-now-third-most-valuable-us-firm.html",1957,0.9918,0.15,0.846,0.005,Positive,3,2,0.2,Positive
Reddit,GOOGL,Alphabet,11/5/2022 23:55:07,2022-11,"Apple is now worth more than Alphabet, Amazon and Meta combined",63,0.4336,0.3,0.7,0,Positive,0,0,0,Neutral
