platform,stock_symbol,stock_name,date,year_month,full_content,content_length,sentiment_compound,sentiment_positive,sentiment_neutral,sentiment_negative,sentiment_category,positive_word_count,negative_word_count,word_sentiment_score,word_sentiment
Reddit,META,Meta Platforms,12/5/2023 19:19:25,2023-12,I bet my entire life saving on Meta calls that expire in 3 days,63,0,0,1,0,Neutral,0,0,0,Neutral
Reddit,META,Meta Platforms,7/25/2024 20:05:02,2024-07,"I spend $4m a year facebook ads and I'm shorting $META earnings This is a play based purely on anecdotal experience in the ecommerce space. Here's the anecdotal take: I started my ecom business 7 years ago and have built it on the back of the meta ads platform. Year over year we were able to grow and increase our spend. Last year we did around 9m, with 4m spend on Meta. This year, we're down about 30% on revenue and the efficiency of our META spend is down 10%. I'm in groups with hundreds of other founders, and this is the same situation for about 80% of the members in these groups. Just head on over to r/facebookads and look at all the depressing posts lol. Ask anyone you know who works in ecom how their company is doing this year. The internal reality at Meta is that the ads platform is totally fucked up right now, more so than after the iOS update that sent the stock to $100, and barely anyone is talking about it. Google the stock and all you'll find is that 100% of analysts agree that it's a strong BUY, talking about AI and literally not mentioning the ad business (which effectively drives 100% of META revenue). In November 2022, when facebook was at $100, all the same analysts said META was dead and to stay away. Also, I'm not a TA guy, but just look at that fuckin chart. Straight up for like 20 months. Looks toppy as hell. In the 7 years of owning my business, all of my biggest pay days have come from anecdotal meta earnings call plays. This is nearly an identical situation to when the iOS update broke the ads platform while they were simultaneously blowing money on the metaverse, except nobody knows exactly what broke the ads platform (including facebook) and the multi billion dollar pit is their AI investment currently driving 0 revenue. I'm confident at the very least META EPS will be an underwhelming beat like google or a miss. They'll do damage control by saying ""AI"" 250+ times on the earnings call but that didn't work for Google so I don't see it working for them either. I've got 15k worth of options, positions below. This is some purely anecdotal gambling, do with it what you will. Not financial advice Positions [https://i.imgur.com/f1acBVy.jpeg](https://i.imgur.com/f1acBVy.jpeg) EDIT: Wow this blew up. Some clarifications: 1) I'M GAMBLING YALL. Anecdotal evidence does not paint a full picture, obviosuly. But each of the massive multi year moves up and down by Meta over the last few years were felt first by advertisers. General advertising performance has worked as a leading indicator multiple times before, and the ads platform has had loads of issues this year. 2) I think META is a great long term investment. I very much plan to continue spending my money on it, it's the dominant platform in the ad space by a long shot. But I also think its in a really good spot to take a fat shit in the short term. That's the play guys, I dont think Meta is going to die, I think its going to dip. 3) My business did 9m last year, but as I stated, I spent half of that shit on fucking facebook ads. Considering we have to also, ya know, purchase the products, pay for shipping, staff, software subscriptions, hosting, etc. Net income generally lands between 7-10% of total revenue, and much of that get's reinvested back into the business. I make good money, but I'm not just rolling in cash. It's money I can afford to lose, but lol at everyone calling 15k on weeklies for an earnings play peanuts. Playing earnings is risky no matter your conviction levels. There's so many factors that can play into an earnings call. Anyone with aggressive certainty going into an earnings call is an idiot, you can be right and get reamed by a stock buy back. But I personally feel strongly enough about the information to make a bet, and I'm sharing that insight with you guys cuz I haven't seen many people talking about it. If I'm right, this could easily be a 5-10x play. If I'm wrong, I lose. That's gambling you pussies. Edit: I am, in fact, cooked.",3993,0.8143,0.103,0.81,0.086,Positive,10,4,0.4285714286,Positive
Reddit,META,Meta Platforms,2/2/2023 10:11:25,2023-02,"META Yolo, up $75k so far, gunna keep holding.",46,0.2732,0.208,0.792,0,Positive,0,0,0,Neutral
Reddit,META,Meta Platforms,4/24/2024 21:22:58,2024-04,Meta's metaverse has lost $46 billion,37,-0.3182,0,0.685,0.315,Negative,0,0,0,Neutral
Reddit,META,Meta Platforms,4/25/2024 19:09:49,2024-04,$Meta dip buying +455k I truly believe some of the best money made can be on a algo overreaction sell off. This only applies on good companies where it was a slight miss but at the end of the day it’s still a cash cow Meta is one of those companies. Entered this morning on 2 different strikes once at 416 and again at 428.,323,0.1531,0.098,0.813,0.089,Positive,3,2,0.2,Positive
Reddit,META,Meta Platforms,11/3/2023 18:42:57,2023-11,Do I short or long META on this news?,37,0,0,1,0,Neutral,0,1,-1,Negative
Reddit,META,Meta Platforms,10/29/2022 9:51:23,2022-10,Puts on $meta,13,0,0,1,0,Neutral,0,0,0,Neutral
Reddit,META,Meta Platforms,10/27/2022 9:25:54,2022-10,“What did I get wrong? I trusted them and not myself” Jim Cramer after Meta implosion,85,0,0.17,0.659,0.17,Neutral,0,0,0,Neutral
Reddit,META,Meta Platforms,4/21/2022 8:12:15,2022-04,Meta is next,12,0,0,1,0,Neutral,0,0,0,Neutral
Reddit,META,Meta Platforms,11/21/2023 21:07:35,2023-11,"Zuck has dumped 28K shares of Meta, every day this November. But you buy the dip!",81,-0.1386,0.09,0.789,0.121,Negative,1,0,1,Positive
Reddit,META,Meta Platforms,10/26/2022 18:30:24,2022-10,$META price sink explained in 30 seconds.,41,0,0,1,0,Neutral,0,0,0,Neutral
Reddit,META,Meta Platforms,1/21/2025 9:17:44,2025-01,"Meta: this sub seems dead and I think both users and mods are at fault This will most likely get removed as well. But as a long time contributor on this sub I want to vent a little. What’s the purpose of this sub? The mod team says we shouldn’t post financial news by itself since they are “low effort posts”, so they are encouraging personal opinions being shared. But then you have people just asking simple questions, and most of the answers are “just buy index funds” regardless of what the questions are. Any long-form opinions are either met with dismissive “you have no idea what you are talking about, just by $VOO” or no response at all. So we can’t post financial news by themselves, and this isn’t the sub for single stock discussions, and any generic investment discussion just leads to “buy index funds”. Btw mods, I understand that you guys don’t want “low-effort posts”, but if a post received 300+ upvotes and 200 comments within 3 hours (and many of those comments had efforts put into them), maybe it’s ok to leave it up? It’s not like the front page is full anyway. It’s frustrating to see a thread heating up only for you guys to remove the entire thing. Edit: Honestly I’ll just say it: I think the mods are more at fault because their vision of a high quality, high engagement discussion forum with high barrier of entry is simply not achievable on a platform like Reddit without making the sub semi-private with individual vetting process, which takes a ton of work that I’m not sure the mods are willing to spend time on. I’ve been a mod on a couple super large subs and i fully understand how difficult and thankless the job can be. But my philosophy is that moderators of large subs should be the caretakers instead of gatekeepers. There are better places than Reddit for small, closed off communities with high barrier of entry. Let Reddit be Reddit, for better or worse.",1898,0.4486,0.102,0.79,0.107,Positive,4,1,0.6,Positive
Reddit,META,Meta Platforms,6/5/2023 14:44:00,2023-06,I see investors are real happy about Apple pulling a Meta,57,0.5719,0.316,0.684,0,Positive,0,0,0,Neutral
Reddit,META,Meta Platforms,2/5/2025 10:29:20,2025-02,"Meta going to surpass GOOG in market cap by EOY even though it makes no sense Given current trajectories in both share price and valuation, i think META will pass GOOG in market cap by EOY or mid 2026. I'm trying to rationalize it to myself but I can't - META doesn't even make 70% as much money (net income, if we go by revenue its about 55-65%) as GOOG and their ad business is like 2/3 the size (again, going off net income). Meta makes 98% of revenues from Ads, Google made around 73% last quarter. I understand that Meta is growing faster, but its advertising business is still not even 2/3 the size of Google and they have 0 diversification outside of ads, so i don't quite understand how meta is poised to surpass google despite being a smaller player in the advertising market and also being a one trick pony. The key difference with these two stocks imo is that GOOG trades at a discount with the p/e in terminal decline since 2022 (its at 21 today and has been monotonically decreasing for almost 3 years now), while Meta enjoys a valuation expansion on top of its increasing earnings (goog increases earnings but valuation keeps contracting). The stock market is about telling a story. The story around Google has been completely shit for three years now (AI is eating their lunch despite net income over $100b in 2024 - more than Apple and every other company on the market!) and I don't see what will cause that narrative to improve. In fact it will probably get worse. I can see Google tripling profits between now and 2030 while the p/e is cut in half, tbh Imagine telling a Google bear on the eve of November 2022 after the release of ChatGPT that Google will make 100b in net income in 2024. They'd laugh in your face - search will be obsolete by then. The jury is out on this one, generative AI is not taking marker share and not causing a growth slowdown. We've been asking this question for almost 3 years now, the answer has remained the same, yet bears keep on thinking that will change. When do you bears lose credibility? We've been hearing about the demise of Search for almost 30 months. At what point do you just admit that you're wrong and realize that LLM is orthogonal to search? what are peoples thoughts? EDIT: A commentor posted this: ""google will never have half the PE of now, it cannot trade at average SPY PE, it has too much moat to be valued like any other SPY company"" Yet look at the facts today: Current p/e ratio of the SPY: 27.71 current p/e ratio of GOOG: 21 - so google already trades at a STEEP discount to the market. I'm looking at the P/E chart and it seems that the discount is poised to just get worse over time? Pull up the chart of GOOG P/E over time, its in terminal decline for years now. It started the decade around ~30, halfway through the decade in 2025 its at ~21, it will be 10-15 by end of the decade at this rate why is GOOG considered ""magnificent"" (the market thinks the business is lackluster considering the steep discount it trades at)?",3005,0.9008,0.076,0.869,0.055,Positive,4,4,0,Neutral
Reddit,META,Meta Platforms,1/11/2025 11:59:32,2025-01,"Meta CEO Mark Zuckerberg trash talks Apple in interview https://www.theverge.com/2025/1/10/24341039/meta-apple-mark-zuckerberg-trash-talks-joe-rogan-interview > Meta CEO Mark Zuckerberg thinks Apple “[hasn’t] really invented anything great in a while” and that it has been coasting off of its past success. “Steve Jobs invented the iPhone and now they’re just kind of sitting on it 20 years later,” he said this week. Zuckerberg made the statements during a nearly three-hour long podcast with Joe Rogan where, along with discussing Meta’s moderation policy changes and turn against diversity and inclusion policies, they got into Meta’s beef with Apple and its policies. > The conversation actually started with Rogan’s issues with Apple. Rogan said he’s moving “from Apple to Android” in part because he doesn’t “like being attached to one company.” He also isn’t a fan of Apple’s App Store policies. “The way they do that Apple store, where they charge people 30 percent,” he said. “That seems so insane that they can get away with doing that.” “I have some opinions about this,” Zuckerberg said. While he gives credit to the iPhone as “obviously one of the most important inventions probably of all time,” he argued that Apple has put rules in place that “feel arbitrary.” Zuckerberg said that Apple has “thoroughly hamstrung the ability for anyone else to build something that can connect to the iPhone in the same way” as Apple’s own products, like the AirPods. If Apple let other people use its protocol, “there would probably be much better competitors to AirPods out there,” Zuckerberg said. > Down the line, Zuckerberg envisions a world where you’ll be able to use the neural interface wristband and the glasses to text a friend or an AI and have the glasses give you the answer. He also believes that as smart glasses or even contact lenses as a computing platform become more developed, the internet will be “overlaid” on the physical world. “I think we’ll basically be in this wild world where most of the world will be physical, but there will be this increasing amount of virtual objects or people who are beaming in or hologramming into different things to interact in different ways,” he said. “There isn’t a physical world and a digital world anymore,” he added. “We’re in 2025. It’s one world.”",2313,0.8842,0.051,0.939,0.011,Positive,3,1,0.5,Positive
Reddit,META,Meta Platforms,2/2/2022 16:08:51,2022-02,"Meta/Facebook stock crashes -15% AH after earnings release Facebook reported earnings after the bell. Here are the results. Earnings per share: **$3.67 vs $3.84 expected**, according to a Refinitiv survey of analysts Revenue: $33.67 billion vs $33.4 billion expected, according to Refinitiv Daily Active Users (DAUs): **1.93B** vs. 1.95 billion expected by analysts, according to StreetAccount More here: https://www.cnbc.com/2022/02/02/facebook-parent-meta-fb-q4-2021-earnings.html",482,0.5994,0.08,0.92,0,Positive,0,0,0,Neutral
Reddit,META,Meta Platforms,10/31/2021 14:55:45,2021-10,The new and improved META logo,30,0.4767,0.383,0.617,0,Positive,0,0,0,Neutral
Reddit,META,Meta Platforms,7/12/2023 15:59:57,2023-07,"META $235C $39k --> $2.6M. Next up, PYPL!!",42,0,0,1,0,Neutral,0,0,0,Neutral
Reddit,META,Meta Platforms,4/15/2024 15:21:10,2024-04,Zuckerberg Sold Nearly Half a Billion Dollars of Meta Stock In Last Two Months,78,0,0,1,0,Neutral,0,1,-1,Negative
Reddit,META,Meta Platforms,10/28/2022 11:21:58,2022-10,There goes all my money. Thanks $META,37,0.4404,0.326,0.674,0,Positive,0,0,0,Neutral
Reddit,META,Meta Platforms,11/6/2022 15:57:56,2022-11,"Meta Is Preparing to Notify Employees of Large-Scale Layoffs This Week Meta [US:META] Platforms Inc. is planning to begin large-scale layoffs this week, according to people familiar with the matter, in what could be among the largest round in a recent spate of tech job cuts after the industry’s rapid growth during the pandemic. The layoffs are expected to affect many thousands of employees and an announcement is planned to come as soon as Wednesday, according to the people. Meta reported more than 87,000 employees at the end of September. Company officials already told employees to cancel nonessential travel beginning this week, the people said. The planned layoffs would be the first broad headcount reductions to occur in the company’s 18-year history. While smaller on a percentage basis than the cuts at Twitter Inc. this past week, which hit about half of that company’s staff, the number of Meta employees expected to lose their jobs could be the largest to date at a major technology corporation in a year that has seen a tech industry retrenchment. A spokesman for Meta declined to comment, referring The Wall Street Journal to Chief Executive Mark Zuckerberg’s recent statement that the company would “focus our investments on a small number of high priority growth areas.” “So that means some teams will grow meaningfully, but most other teams will stay flat or shrink over the next year,” he said on the company’s third-quarter earnings call on Oct. 26. “In aggregate, we expect to end 2023 as either roughly the same size, or even a slightly smaller organization than we are today.” The Journal reported in September that Meta was planning to cut expenses by at least 10% in the coming months, in part through staff reductions. https://www.wsj.com/articles/meta-is-preparing-to-notify-employees-of-large-scale-layoffs-this-week-11667767794?mod=hp_lead_pos1",1876,-0.5023,0.024,0.944,0.032,Negative,3,0,1,Positive
Reddit,META,Meta Platforms,2/16/2022 13:24:31,2022-02,"Who the fuck is Meta marketing to? Based on zero data or facts, I’m going to assume that Meta’s average user is like 60 years old. Is Karen really dying to strap on that VR headset and go fly around space and grope a cartoon panda or whatever happens in the metaverse? When is she going to get herself all set up for her metaverse explorations? After she learns how to rotate a PDF? On the other hand, if this is their play to try and get young people back on board with them…good luck, the younger generations absolutely loathe you. I’m going to go out on a limb here and say there will be much better experiences offered by companies that aren’t hated by the demographic that they’re relying on.",697,0.4708,0.111,0.813,0.076,Positive,1,0,1,Positive
Reddit,META,Meta Platforms,2/12/2023 12:54:32,2023-02,Meta salaries are finally keeping up with inflation,51,0,0,1,0,Neutral,0,0,0,Neutral
Reddit,META,Meta Platforms,1/7/2024 15:30:10,2024-01,How do you interpret Zuckerberg selling 428$million in Meta stocks? Source of the news : https://www.bloomberg.com/news/articles/2024-01-03/zuckerberg-sold-nearly-half-a-billion-dollars-of-meta-stock-in-last-two-months,218,0,0,1,0,Neutral,0,1,-1,Negative
Reddit,META,Meta Platforms,6/27/2024 9:46:49,2024-06,Ain’t nuthin betta then meta Entered into some cheap itm calls a couple days ago for a quick scalp. It ain’t much but it’s honest work. I’m getting better at listening to the gut and pulling profit. Now off to go start my 100k a year farming job.,246,0.9209,0.224,0.776,0,Positive,2,0,1,Positive
Reddit,META,Meta Platforms,12/6/2023 18:32:05,2023-12,"UPDATE: YESTERDAYS META YOLO For those of you unfamiliar, yesterday I YOLOed my entire life savings on META options that expire this Friday. Why? Because I thought META would go up but apparently stocks can fall too. Well, today the stock opened high at 9:30 then fell for the rest of the day, so right now I’m sitting at around a 10k loss after selling in the afternoon. Apparently I’m not allowed to post a certain ticker on this sub, but here’s a screenshot of dumping my remaining money into a *cough* certain stock who had their earnings call today (and it’s not looking good)",581,0.4527,0.091,0.855,0.054,Positive,1,4,-0.6,Negative
Reddit,META,Meta Platforms,11/19/2022 8:31:42,2022-11,Can go back in time to when META was $364 and experience your losses all over again,83,-0.4019,0,0.856,0.144,Negative,0,1,-1,Negative
Reddit,META,Meta Platforms,2/17/2022 19:55:48,2022-02,"Meta Platforms drops out of top 10 companies by value, with new 4% dip Meta Platforms' (NASDAQ:FB) worst month ever continues: The stock tacked on another 4.1% loss Thursday, another $24 billion in market capitalization out the window as the stock dropped out of the top 10 most valuable companies. At a value of $565 billion, Facebook fell to the No. 11 spot, a ways behind Tencent Holdings at No. 10. During the fall, Meta has stumbled past companies including Tesla, Berkshire Hathaway, Nvidia, and Taiwan Semiconductor. When it was Facebook, Meta had been among the top five or six most valuable companies in the world for the past few years. Meta's now near a two-year low, at its lowest point since May 2020. Thursday's move accelerated a staggering loss of value that amounts to a 46% decline from an all-time high of $382.96 on Sept. 7. The amount of market value it's lost is bigger than nearly every company in the S&P 500. Earlier Thursday, MoffettNathanson mounted something of a defense of the stock, suggesting that the company's story is more complicated than it appears and the stock is trading at a discount.",1125,0.2928,0.11,0.796,0.095,Positive,3,7,-0.4,Negative
Reddit,META,Meta Platforms,4/22/2024 23:41:37,2024-04,Meta Platforms gets billions from China without headaches many U.S. companies face there How will this affect it's stock price?,127,0,0,1,0,Neutral,0,0,0,Neutral
Reddit,META,Meta Platforms,10/26/2024 16:22:45,2024-10,"The absolute madness of Tesla https://preview.redd.it/51seuul3t5xd1.png?width=661&format=png&auto=webp&s=5a39dd7589604d09f90ae935399ac1160fa49ebc Just the sheer madness, i know its just a multiple and future growth and all that. Still, you gotta take a moment to contemplate this. The funny thing is that Elon has outright lied/being wrong with predictions like dates for models and stuff, most recently the shenanigans with the robot at his events. BUT 2 weeks later he says 20-30 revenue growth next year and everyone believes him lol. Thanks god im not a bear",562,0.9209,0.21,0.725,0.065,Positive,2,0,1,Positive
Reddit,META,Meta Platforms,1/28/2025 22:16:58,2025-01,"Microsoft and OpenAI Probing If DeepSeek-Linked Group Improperly Obtained OpenAI Data > Microsoft Corp. and OpenAI are investigating whether data output from OpenAI’s technology was obtained in an unauthorized manner by a group linked to Chinese artificial intelligence startup DeepSeek, according to people familiar with the matter. > Microsoft’s security researchers in the fall observed individuals they believe may be linked to DeepSeek exfiltrating a large amount of data using the OpenAI application programming interface, or API, said the people, who asked not to be identified because the matter is confidential. Software developers can pay for a license to use the API to integrate OpenAI’s proprietary artificial intelligence models into their own applications. > Microsoft, an OpenAI technology partner and its largest investor, notified OpenAI of the activity, the people said. Such activity could violate OpenAI’s terms of service or could indicate the group acted to remove OpenAI’s restrictions on how much data they could obtain, the people said. > DeepSeek earlier this month released a new open-source artificial intelligence model called R1 that can mimic the way humans reason, upending a market dominated by OpenAI and US rivals such as Google and Meta Platforms Inc. The Chinese upstart said R1 rivaled or outperformed leading US developers’ products on a range of industry benchmarks, including for mathematical tasks and general knowledge — and was built for a fraction of the cost. The potential threat to the US firms’ edge in the industry sent technology stocks tied to AI, including Microsoft, Nvidia Corp., Oracle Corp. and Google parent Alphabet Inc., tumbling on Monday, erasing a total of almost $1 trillion in market value. > David Sacks, President Donald Trump’s artificial intelligence czar, said Tuesday there’s “substantial evidence” that DeepSeek leaned on the output of OpenAI’s models to help develop its own technology. In an interview with Fox News, Sacks described a technique called distillation whereby one AI model uses the outputs of another for training purposes to develop similar capabilities. > “There’s substantial evidence that what DeepSeek did here is they distilled knowledge out of OpenAI models and I don’t think OpenAI is very happy about this,” Sacks said, without detailing the evidence. > In a statement responding to Sacks’ comments, OpenAI didn’t directly address his comments about DeepSeek. “We know PRC based companies — and others — are constantly trying to distill the models of leading US AI companies,” an OpenAI spokesperson said in the statement, referring to the People’s Republic of China. “As the leading builder of AI, we engage in countermeasures to protect our IP, including a careful process for which frontier capabilities to include in released models, and believe as we go forward that it is critically important that we are working closely with the US government to best protect the most capable models from efforts by adversaries and competitors to take US technology.”",3054,0.9848,0.094,0.886,0.02,Positive,5,1,0.6666666667,Positive
Reddit,META,Meta Platforms,2/25/2022 9:12:28,2022-02,"Meta Platforms (FB) Dissolves Team Developing New AR and VR Operating System https://www.streetinsider.com/dr/news.php?id=19679372 Facebook just dissolves team developing AR and VR operating systems, Could this mean the end for the metaverse? How can the metaverse exist without proper AR & VR technology? What could this signal for $FB’s future? And all the hype around the metaverse?",385,0,0,1,0,Neutral,0,0,0,Neutral
Reddit,META,Meta Platforms,10/22/2022 11:24:31,2022-10,"If META ad revenue is expected to decline, why do I feel like I am seeing more ads on its platforms? After SNAP’s earnings, META stock price fell in sympathy and it has a low P/E because earnings expected to slow down. But I keep seeing more and more ads on instagram and Facebook (and I personally even click more as it is usually good deals). Is my personal experience just different from the average user?",408,0.7319,0.101,0.879,0.02,Positive,1,2,-0.3333333333,Negative
