platform,stock_symbol,stock_name,date,year_month,full_content,content_length,sentiment_compound,sentiment_positive,sentiment_neutral,sentiment_negative,sentiment_category,positive_word_count,negative_word_count,word_sentiment_score,word_sentiment
NewsAPI,AAPL,Apple,9/17/2024 16:48:19,2024-09,"Morgan Stanley Cuts the Price Target on Apple Stock stock forecast took a hit as Morgan Stanley (MS) cut its price target. Analyst Erik Woodring of Morgan Stanley reduced the price target on AAPL stock to $252 from $275 yesterday, citing weak iPhone demand due to delays in advanced Siri upgrades. Despite the c… Youve Read the News - Now Find the ExpertClick to discover leading experts on 50,000+ topics for media, events &amp; more. Discover Experts on 50,000+ TopicsConnect for media, speaking, expert witne… [+95 chars]",524,-0.6908,0.022,0.882,0.096,Negative,1,1,0,Neutral
NewsAPI,AAPL,Apple,7/7/2024 12:32:11,2024-07,"Sunday links: reduced resilience Markets Sam Ro, ""The stock market does not price in what’s going on today. It’s pricing in what’s expected in the weeks, months, and years ahead."" (tker.co) Ben Carlson, ""The stock market doesn’t care what you say or how you feel."" (awealthofcommonsense.com) … Youve Read the News - Now Find the ExpertClick to discover leading experts on 50,000+ topics for media, events &amp; more. Discover Experts on 50,000+ TopicsConnect for media, speaking, expert witne… [+95 chars]",505,0.4939,0.04,0.96,0,Positive,1,0,1,Positive
NewsAPI,AAPL,Apple,11/30/2024 17:53:17,2024-11,"Here's How Much You Would Have Made Owning Apple Stock In The Last 10 Years Apple (NASDAQ:AAPL) has outperformed the market over the past 10 years by 10.59% on an annualized basis producing an average annual return of 20.98%. Currently, Apple has a market capitalization of $3.19 trillion. Buying $100 In AAPL: If an ... Full story av… Apple (NASDAQ:AAPL) has outperformed the market over the past 10 years by 10.59% on an annualized basis producing an average annual return of 20.98%. Currently, Apple has a market capitalization of $… [+139 chars]",549,0,0,1,0,Neutral,1,0,1,Positive
NewsAPI,AAPL,Apple,1/25/2025 2:06:52,2025-01,"Lincoln Capital Corp Reduces Stock Holdings in Apple Inc. (NASDAQ:AAPL) Lincoln Capital Corp trimmed its position in Apple Inc. (NASDAQ:AAPL – Free Report) by 0.3% in the fourth quarter, HoldingsChannel reports. The firm owned 60,548 shares of the iPhone maker’s stock after selling 175 shares during the quarter. Apple accounts fo… Lincoln Capital Corp trimmed its position in Apple Inc. (NASDAQ:AAPL – Free Report) by 0.3% in the fourth quarter, HoldingsChannel reports. The firm owned 60,548 shares of the iPhone maker’s stock af… [+5286 chars]",547,0.9042,0.145,0.855,0,Positive,0,1,-1,Negative
NewsAPI,AAPL,Apple,7/2/2024 2:38:48,2024-07,"Sound Income Strategies LLC Boosts Stock Position in Apple Inc. (NASDAQ:AAPL) Sound Income Strategies LLC increased its holdings in shares of Apple Inc. (NASDAQ:AAPL – Free Report) by 0.2% during the fourth quarter, according to its most recent filing with the Securities and Exchange Commission (SEC). The institutional investor owned 8… Sound Income Strategies LLC increased its holdings in shares of Apple Inc. (NASDAQ:AAPL – Free Report) by 0.2% during the fourth quarter, according to its most recent filing with the Securities and E… [+5742 chars]",553,0.9578,0.226,0.774,0,Positive,2,0,1,Positive
NewsAPI,AAPL,Apple,1/24/2024 2:50:54,2024-01,"Apple Inc. (NASDAQ:AAPL) is Bennett Selby Investments LP’s Largest Position Bennett Selby Investments LP lessened its stake in Apple Inc. (NASDAQ:AAPL – Free Report) by 0.4% in the 4th quarter, Holdings Channel.com reports. The fund owned 149,194 shares of the iPhone maker’s stock after selling 672 shares during the quarter. Apple co… Bennett Selby Investments LP lessened its stake in Apple Inc. (NASDAQ:AAPL – Free Report) by 0.4% in the 4th quarter, Holdings Channel.com reports. The fund owned 149,194 shares of the iPhone maker’s… [+4681 chars]",551,0.9042,0.143,0.857,0,Positive,0,1,-1,Negative
NewsAPI,AAPL,Apple,11/23/2024 2:04:46,2024-11,"Phoenix Wealth Advisors Has $8.25 Million Holdings in Apple Inc. (NASDAQ:AAPL) Phoenix Wealth Advisors grew its position in shares of Apple Inc. (NASDAQ:AAPL – Free Report) by 7.4% in the 4th quarter, HoldingsChannel reports. The firm owned 32,938 shares of the iPhone maker’s stock after acquiring an additional 2,281 shares during the q… Phoenix Wealth Advisors grew its position in shares of Apple Inc. (NASDAQ:AAPL – Free Report) by 7.4% in the 4th quarter, HoldingsChannel reports. The firm owned 32,938 shares of the iPhone maker’s s… [+5233 chars]",554,0.9756,0.264,0.736,0,Positive,0,0,0,Neutral
NewsAPI,AAPL,Apple,8/30/2024 2:06:55,2024-08,"Apple Inc. (NASDAQ:AAPL) Shares Sold by Veracity Capital LLC Veracity Capital LLC reduced its position in shares of Apple Inc. (NASDAQ:AAPL – Free Report) by 1.2% in the 4th quarter, HoldingsChannel reports. The firm owned 36,173 shares of the iPhone maker’s stock after selling 456 shares during the period. Apple accou… Veracity Capital LLC reduced its position in shares of Apple Inc. (NASDAQ:AAPL – Free Report) by 1.2% in the 4th quarter, HoldingsChannel reports. The firm owned 36,173 shares of the iPhone maker’s s… [+5215 chars]",536,0.9501,0.207,0.793,0,Positive,0,2,-1,Negative
NewsAPI,AAPL,Apple,1/30/2024 2:38:48,2024-01,"Apple Inc. (NASDAQ:AAPL) Shares Sold by Rappaport Reiches Capital Management LLC Rappaport Reiches Capital Management LLC decreased its stake in Apple Inc. (NASDAQ:AAPL – Free Report) by 0.3% during the 4th quarter, HoldingsChannel reports. The firm owned 105,045 shares of the iPhone maker’s stock after selling 313 shares during the perio… Rappaport Reiches Capital Management LLC decreased its stake in Apple Inc. (NASDAQ:AAPL – Free Report) by 0.3% during the 4th quarter, HoldingsChannel reports. The firm owned 105,045 shares of the iP… [+5527 chars]",556,0.9246,0.168,0.832,0,Positive,0,4,-1,Negative
NewsAPI,AAPL,Apple,6/3/2024 2:06:55,2024-06,"Gradient Investments LLC Has $96.56 Million Holdings in Apple Inc. (NASDAQ:AAPL) Gradient Investments LLC lowered its stake in Apple Inc. (NASDAQ:AAPL – Free Report) by 2.3% in the fourth quarter, according to its most recent disclosure with the Securities and Exchange Commission (SEC). The fund owned 385,597 shares of the iPhone maker’s … Gradient Investments LLC lowered its stake in Apple Inc. (NASDAQ:AAPL – Free Report) by 2.3% in the fourth quarter, according to its most recent disclosure with the Securities and Exchange Commission… [+5049 chars]",556,0.8807,0.143,0.824,0.033,Positive,0,0,0,Neutral
NewsAPI,AAPL,Apple,5/18/2024 1:26:52,2024-05,"Wedbush Reiterates Outperform Rating for Apple (NASDAQ:AAPL) Wedbush reissued their outperform rating on shares of Apple (NASDAQ:AAPL – Free Report) in a report released on Friday,Benzinga reports. Wedbush currently has a $325.00 price target on the iPhone maker’s stock. AAPL has been the subject of several other resea… Wedbush reissued their outperform rating on shares of Apple (NASDAQ:AAPL – Free Report) in a report released on Friday,Benzinga reports. Wedbush currently has a $325.00 price target on the iPhone mak… [+3835 chars]",536,0.875,0.134,0.866,0,Positive,3,0,1,Positive
NewsAPI,AAPL,Apple,7/19/2024 2:04:52,2024-07,"Apple Inc. (NASDAQ:AAPL) Stock Position Trimmed by Moody Lynn & Lieberson LLC Moody Lynn & Lieberson LLC cut its stake in shares of Apple Inc. (NASDAQ:AAPL – Free Report) by 0.1% in the 4th quarter, according to the company in its most recent disclosure with the Securities and Exchange Commission (SEC). The fund owned 305,264 shares of… Moody Lynn &amp; Lieberson LLC cut its stake in shares of Apple Inc. (NASDAQ:AAPL – Free Report) by 0.1% in the 4th quarter, according to the company in its most recent disclosure with the Securities… [+5131 chars]",553,0.5719,0.145,0.745,0.11,Positive,0,0,0,Neutral
NewsAPI,AAPL,Apple,12/12/2024 0:56:15,2024-12,Apple (NASDAQ:AAPL) Stock Price Down 2.5% on Analyst Downgrade Shares of Apple Inc. (NASDAQ:AAPL – Get Free Report) dropped 2.5% on Wednesday after Morgan Stanley lowered their price target on the stock from $275.00 to $252.00. Morgan Stanley currently has an overweight rating on the stock. Apple traded as low as $216.50… Shares of Apple Inc. (NASDAQ:AAPL – Get Free Report) dropped 2.5% on Wednesday after Morgan Stanley lowered their price target on the stock from $275.00 to $252.00. Morgan Stanley currently has an ov… [+4754 chars],538,0.6597,0.115,0.805,0.079,Positive,0,0,0,Neutral
NewsAPI,AAPL,Apple,1/21/2024 10:53:02,2024-01,"Stop Videos From Looping in the Photos App Have you noticed your iPhone videos keep playing on repeat in the Photos app? Since Apple's iOS 18.2 update, the stock Photos app automatically replays videos until you manually pause them – a feature that might be fine at first but can quickly become annoyin… Have you noticed your iPhone videos keep playing on repeat in the Photos app? Since Apple's iOS 18.2 update, the stock Photos app automatically replays videos until you manually pause them a feature … [+1169 chars]",518,0.4137,0.061,0.921,0.018,Positive,0,0,0,Neutral
NewsAPI,AAPL,Apple,8/22/2024 4:00:01,2024-08,"Apple is becoming a utility. That's hard for fanboys to take. Apple's utility-like evolution keeps iPhone sales steady, driving massive market value growth, even as AI delays leave fanboys disappointed. A member of the NYPD Pipes and Drums uses an iPhone to check bagpipe pitch ahead of a St. Patrick's Day Parade.Alexi Rosenfeld/Getty Images <ul><li>iPhone sales have flatlined for a decade, and Siri… [+8170 chars]",416,0.0772,0.075,0.84,0.085,Positive,1,1,0,Neutral
NewsAPI,AAPL,Apple,11/10/2023 6:00:04,2023-11,"The Atari Asteroids Watch Is So Beautiful, I Don’t Care How Poorly It Tells Time Nubeo’s limited edition Atari Asteroids watch respects the manic nature of high-stakes arcade gaming. The classic arcade game Asteroids is so accessible and timeless that every time I see a vector graphics triangle, it acts as a reminder of the retro gaming era. The original arcade cabinet hit the sc… [+4174 chars]",397,0.8849,0.17,0.804,0.026,Positive,0,0,0,Neutral
NewsAPI,AAPL,Apple,10/27/2024 13:41:36,2024-10,"Underwhelming performance of Apple Intelligence will hit iPhone sales, Kuo claims Analyst Ming-Chi Kuo called the performance of Apple Intelligence ""underwhelming,"" adding that it won't entice people to replace their older iPhones.The delays Apple Intelligence has faced might impact iPhone sales negatively.In a social media post on Thursda… Analyst Ming-Chi Kuo called the performance of Apple Intelligence ""underwhelming,"" adding that it won't entice people to replace their older iPhones. In a social media post on Thursday, Kuo reiterat… [+3262 chars]",556,0.9081,0.144,0.856,0,Positive,0,0,0,Neutral
NewsAPI,AAPL,Apple,6/2/2024 11:22:58,2024-06,"The Original ‘Something’s Rotten in Cupertino’ — Brent Schlender’s 1997 Story for Fortune (FORTUNE Magazine) – Here we go again. Apple Computer, Silicon Valley's paragon of dysfunctional management and fumbled techno-dreams, is back in crisis mode, scrambling lugubriously in slow motion t… [+22277 chars]",305,-0.7269,0.047,0.801,0.152,Negative,0,0,0,Neutral
NewsAPI,AAPL,Apple,2/26/2024 7:00:00,2024-02,"The Best Apple Watch for 2025 We’ve tested every Apple Watch and rounded up our picks for every need and every budget. If you're an iPhone user looking for a smartwatch, you'd be hard-pressed to find a better option than the Apple Watch. Thanks to its seamless iPhone integration and consistent software updates, the A… [+5952 chars]",333,0.875,0.161,0.839,0,Positive,2,0,1,Positive
NewsAPI,AAPL,Apple,6/3/2024 6:50:47,2024-06,"3 high-protein, high-fiber recipes that boost gut health and aren't ultra-processed — by a doctor who specializes in nutrition Instead of hitting his protein targets with ultra-processed shakes and bars or red meat, Dr. Rupy Aujla eats a 75% plant-based diet, which is high in fiber. Dr. Rupy Aujla's favorite recipe in his new book is the salmon tikka bowls.Andrew Burton <ul><li>Dr. Rupy Aujla eats a high-protein ""plant-focused"" diet, meaning it's about 70% plant-based.</li><li>… [+9142 chars]",497,0.6908,0.076,0.924,0,Positive,0,0,0,Neutral
NewsAPI,AAPL,Apple,12/23/2024 23:30:01,2024-12,"Meet Jensen Huang, Nvidia's founder and CEO Nvidia founder and CEO Jensen Huang rose from his first job at Denny's, where the idea for his company was born, to leading a chipmaking giant. Nvidia founder and CEO Jensen Huang is the face of the company supplying chips to many of the companies in the AI arms race.I-hwa Cheng/Getty <ul><li>If you've heard about AI, you're probably famili… [+4983 chars]",401,0,0,1,0,Neutral,2,0,1,Positive
NewsAPI,AAPL,Apple,2/5/2025 6:03:08,2025-02,"4 Best Cars To Buy During Trump’s 1-Month Tariff Break for Vehicles If you're in the market for a new car, the decision just got more difficult to fit into your budget. Or at least, more urgent, especially if you have your... If youre in the market for a new car, the decision just got more difficult to fit into your budget. Or at least, more urgent, especially if you have your heart set on one of the approximately 30 car … [+3637 chars]",440,0.8088,0.15,0.789,0.06,Positive,2,0,1,Positive
NewsAPI,AAPL,Apple,2/22/2025 6:32:32,2025-02,Android-iPhone texting is on track for a long overdue upgrade iPhone users will soon get RCS encryption for Android texts. A future iOS update will secure messages with end-to-end encryption. <ul><li>End-to-end encryption (E2EE) for RCS messaging between iPhone and Android users is coming soon via the new Universal Profile 3.0 specifications from GSMA.</li><li>The new standard supports th… [+3302 chars],406,0.5994,0.082,0.918,0,Positive,0,0,0,Neutral
NewsAPI,AAPL,Apple,6/6/2024 6:33:48,2024-06,"Unbeatable Deal: INSIGNIA 32″ F20 Series Fire TV Now Just $74.99 (42% Off!) Looking for an affordable smart TV for your bedroom, kitchen, or dorm? The INSIGNIA 32” Class F20 Series Fire TV delivers 720p HD resolution, built-in Alexa voice control, and seamless access to streaming apps—all for an incredibly low price. Now just $74.… Looking for an affordable smart TV for your bedroom, kitchen, or dorm? The INSIGNIA 32 Class F20 Series Fire TV delivers 720p HD resolution, built-in Alexa voice control, and seamless access to strea… [+2290 chars]",548,-0.592,0.054,0.843,0.103,Negative,0,0,0,Neutral
NewsAPI,AAPL,Apple,11/17/2024 7:00:31,2024-11,"Transcript: Stephanie Kelton on US Fiscal Policy and the ‘Deficit Myth’ The transcript from this week’s, MiB: Stephanie Kelton on US Fiscal Policy and the ‘Deficit Myth’, is below. You can stream and download our full conversation, including any podcast extras, on Apple Podcasts, Spotify, YouTube, and Bloomberg. All of our earlie… The transcript from this weeks, MiB: Stephanie Kelton on US Fiscal Policy and the Deficit Myth, is below. You can stream and download our full conversation, including any podcast extras, on Apple Po… [+89759 chars]",547,-0.4019,0,0.97,0.03,Negative,0,0,0,Neutral
NewsAPI,AAPL,Apple,1/2/2024 12:30:07,2024-01,How to shoot RAW or Apple ProRAW photos on your iPhone Learn how to take Apple ProRAW or standard RAW photos on your iPhone to get more control when editing these pictures. Learn how to enable RAW image capture and use the Camera app or third-party iOS apps to take Apple ProRAW or standard RAW photos on your iPhone. Difference between RAW and JPEG images When you take… [+6112 chars],385,-0.34,0,0.966,0.034,Negative,0,0,0,Neutral
NewsAPI,AAPL,Apple,1/20/2025 5:21:23,2025-01,"FBI Warning—Apple Confirms iPhone Update For All Users This is a game-changer on your iPhone. Thsi changes everything Getty Images When the FBI warned iPhone and Android users to stop texting each other, it quickly became one of the most viral stories of the year. With Chinese hackers marau… [+3381 chars]",306,-0.5106,0,0.918,0.082,Negative,0,0,0,Neutral
NewsAPI,AAPL,Apple,9/29/2024 8:42:41,2024-09,"Elon Musk And Tim Walz Exchange Barbs As Walz Celebrates Tesla Stock Slide The former vice presidential candidate Walz said he checks Tesla’s share price to give him a “little boost during the day,” nodding to Musk’s company’s more than 40% year-to-date loss. Former vice presidential candidate Gov. Tim Walz, D-Minn., and the worlds richest man Elon Musk traded disses over Tesla stocks brutal start to 2024, as Musks electric vehicle brand navigates challen… [+3167 chars]",474,0.6808,0.137,0.789,0.073,Positive,0,1,-1,Negative
NewsAPI,AAPL,Apple,9/9/2024 9:33:28,2024-09,"Should you get an Apple Card? Here’s what you need to know We’re coming up on the sixth anniversary of the Apple Card’s debut, and it’s proven to be a very popular credit card. If you’re considering applying for the Apple Card, here’s everything you need to know. more… We’re coming up on the sixth anniversary of the Apple Card’s debut, and its proven to be a very popular credit card. If you’re considering applying for the Apple Card, here’s everything you need to k… [+10055 chars]",485,0.8988,0.128,0.872,0,Positive,0,0,0,Neutral
NewsAPI,AAPL,Apple,12/12/2024 3:49:07,2024-12,"Another sign of a dealmaking comeback? Adtech firm Adform is exploring a sale. Deal momentum appears to be picking up in the adtech sector after a tepid couple of years. Adform offers products for advertisers and publishers. Time to call in the movers? Adtech firm Adform is looking for a new home.John Lamparski/Getty Images for Advertising Week New York <ul><li>Adform is exploring a sale, another sign of a rebound in th… [+3048 chars]",438,0,0,1,0,Neutral,0,0,0,Neutral
NewsAPI,AAPL,Apple,2/3/2025 6:36:53,2025-02,"Foxconn head predicts a surge in US manufacturing in the coming years The CEO of Apple partner Foxconn has broken silence on President Trump's tariffs, and is predicting disruption and perhaps an expansion of US manufacturing by big tech in the coming years.A Foxconn facilityThe remarks by Foxconn CEO Young Liu during an earnin… The CEO of Apple partner Foxconn has broken silence on President Trump's tariffs, and is predicting disruption and perhaps an expansion of US manufacturing by big tech in the coming years. The remar… [+2463 chars]",544,-0.8807,0,0.882,0.118,Negative,0,0,0,Neutral
NewsAPI,AAPL,Apple,12/5/2023 20:45:23,2023-12,"How To Make $20,800+ A Day With ALR Miner ALR Miner offers free XRP cloud mining with a $12 bonus. Start mining effortlessly with automated processes, secure withdrawals, and multiple investment plans. The post How To Make $20,800+ A Day With ALR Miner first appeared on Redmond Pie. According to SoSoValue data, Bitcoin spot ETFs experienced a total net outflow of $369 million yesterday (March 10, EST). Yesterday, the Grayscale ETF GBTC had a single-day net outflow of US$20.5956… [+1759 chars]",497,0.8481,0.112,0.888,0,Positive,0,0,0,Neutral
NewsAPI,AAPL,Apple,3/11/2024 1:21:11,2024-03,Nvidia-Supplier Hon Hai’s Profit Misses While AI Doubts Persist (Bloomberg) -- Hon Hai Precision Industry Co.’s quarterly earnings missed estimates as weak Chinese iPhone sales weighed and it invested more on AI server... (Bloomberg) -- Hon Hai Precision Industry Co.s quarterly earnings missed estimates as weak Chinese iPhone sales weighed and it invested more on AI server production. Most Read from Bloomberg The Ta… [+2324 chars],434,-0.8555,0.038,0.774,0.188,Negative,1,4,-0.6,Negative
NewsAPI,AAPL,Apple,5/5/2024 12:17:34,2024-05,"Apple (NasdaqGS:AAPL) Sees 10% Price Dip Despite Launch Of MacBook Air With M4 Chip Apple (NasdaqGS:AAPL) recently rolled out several innovative products, such as the MacBook Air with the M4 chip and the high-performance M3 Ultra chip... Apple recently rolled out several innovative products, such as the MacBook Air with the M4 chip and the high-performance M3 Ultra chip. Despite these advancements, Apple's stock saw a 10% decrease ov… [+3321 chars]",452,0.7003,0.079,0.921,0,Positive,2,1,0.3333333333,Positive
NewsAPI,AAPL,Apple,1/3/2025 7:00:00,2025-01,"Gwyneth Paltrow on Motherhood, MAHA, Meghan Markle, Making Out With Timothée Chalamet—and Much More With Apple and Moses having flown the nest, and Goop humming along, the star is making her big return to film as she seeks the answer to “Who am I now?” Her Oscar moment is a collective core memory: Paltrow, 26 and tearful in princess pink Ralph Lauren, accepting best actress over Meryl Streep and Cate Blanchett and Brazilian screen legend Fernanda M… [+5182 chars]",467,0.7783,0.083,0.917,0,Positive,1,0,1,Positive
NewsAPI,AAPL,Apple,2/6/2025 10:02:51,2025-02,"Evercore ups ‘tech staple’ Apple’s target price to $275 from $260 On Tuesday, Evercore ISI released its fifth annual ""Apple Primer,"" providing an in-depth analysis of Apple and raising its price target… The post Evercore ups ‘tech staple’ Apple’s target price to $275 from $260 appeared first on MacDailyNews. On Tuesday, Evercore ISI released its fifth annual “Apple Primer,” providing an in-depth analysis of Apple and raising its price target for the stock from $260 to $275 while maintaining an “Outperfor… [+3104 chars]",524,0,0,1,0,Neutral,0,0,0,Neutral
NewsAPI,AAPL,Apple,1/11/2024 4:27:18,2024-01,"Taiwan Tech Giant Foxconn's 2024 Profit Misses Forecasts Taiwanese tech giant Foxconn reported on Friday a lower-than-expected net profit for 2024 as consumer electronic gadgets underperformed, although demand for its artificial intelligence servers remained robust. Taiwanese tech giant Foxconn reported on Friday a lower-than-expected net profit for 2024 as consumer electronic gadgets underperformed, although demand for its artificial intelligence servers remain… [+3213 chars]",481,0.9246,0.233,0.701,0.066,Positive,3,0,1,Positive
NewsAPI,AAPL,Apple,10/26/2024 11:22:49,2024-10,"Apple Maps 2.0: Is Apple Intelligence Another Epic Failure in the Making? Last June, at WWDC 2024 Apple announced all of its new operating systems as it always does. And then it went into Apple Intelligence. The marketing name Last June, at WWDC 2024 Apple announced all of its new operating systems as it always does. And then it went into Apple Intelligence. The marketing name for their suite of Artificial Intelligence fea… [+7172 chars]",441,0.8442,0.145,0.817,0.039,Positive,0,1,-1,Negative
NewsAPI,AAPL,Apple,9/9/2024 4:30:00,2024-09,"Xiaomi CEO Lei Jun sees progress as firm lifts 2025 EV deliveries target by 16% Xiaomi has raised its full-year target for electric vehicle (EV) deliveries by 16 per cent on the back of strong demand after reporting solid financial... Xiaomi has raised its full-year target for electric vehicle (EV) deliveries by 16 per cent on the back of strong demand after reporting solid financial results for last year, underpinning confidence … [+5340 chars]",449,0.9169,0.19,0.775,0.036,Positive,2,0,1,Positive
NewsAPI,AAPL,Apple,5/17/2024 7:26:34,2024-05,"Markets Move Into Correction Territory As Trade Wars Continue Stocks plunged as trade war fears fueled a correction, with the S&P 500 down 4% for the week. Investors seek safe havens in gold, while volatility remains a key concern. Consumers are cutting back on spending and the number of people planning a vacation in the next 6 ... [+] months it the lowest in 15 years, not counting Covid. (Photo by AaronP/Bauer-Griffin/GC Image… [+5034 chars]",446,-0.8807,0.051,0.775,0.174,Negative,0,2,-1,Negative
NewsAPI,AAPL,Apple,10/17/2024 19:47:08,2024-10,Samsung CEO says company considering deals as it struggles for growth SEOUL :Samsung Electronics said on Wednesday it is looking to drive growth as it faced tough questions from shareholders after its failure to ride an artificial intelligence boom made it one of the worst-performing tech stocks last year.The South Korean firm … SEOUL :Samsung Electronics said on Wednesday it is looking to drive growth as it faced tough questions from shareholders after its failure to ride an artificial intelligence boom made it one of the w… [+2241 chars],545,0.4404,0.134,0.749,0.116,Positive,3,2,0.2,Positive
NewsAPI,AAPL,Apple,10/18/2024 16:34:24,2024-10,"Taiwan tech giant Foxconn's 2024 profit misses forecasts Taiwanese tech giant Foxconn reported on Friday a lower-than-expected net profit for 2024 as consumer electronic gadgets underperformed, although demand for its artificial intelligence servers remained robust. The world's largest contract electronics manufact… Taiwanese tech giant Foxconn reported on Friday a lower-than-expected net profit for 2024 as consumer electronic gadgets underperformed, although demand for its artificial intelligence servers remain… [+3229 chars]",532,0.9246,0.216,0.723,0.061,Positive,3,0,1,Positive
NewsAPI,AAPL,Apple,2/23/2025 12:25:08,2025-02,"Flau’Jae Johnson Drops Bars and Buckets in Powerade’s March Madness Ad Powerade is the official drink of the National Collegiate Athletic Association (NCAA), and ahead of March Madness, the brand wants to land a slam dunk as the fans' bottle of choice. The Coca-Cola-owned label has rolled out ""It Takes More to Get This Far,"" a t… Powerade is the official drink of the National Collegiate Athletic Association (NCAA), and ahead of March Madness, the brand wants to land a slam dunk as the fans bottle of choice. The Coca-Cola-own… [+3510 chars]",545,-0.9169,0,0.858,0.142,Negative,0,0,0,Neutral
