platform,stock_symbol,stock_name,date,year_month,full_content,content_length,sentiment_compound,sentiment_positive,sentiment_neutral,sentiment_negative,sentiment_category,positive_word_count,negative_word_count,word_sentiment_score,word_sentiment
Reddit,TSLA,Tesla,3/11/2025 1:05:11,2025-03,"Trump Says He’ll Buy a Tesla to Support Musk After Shares Plunge https://www.bloomberg.com/news/articles/2025-03-11/trump-says-he-ll-buy-a-tesla-to-support-musk-after-shares-plunge > US President Donald Trump said he’ll buy a “brand new” Tesla to support Elon Musk, after shares of the electric car maker had their worst day in four years amid a growing backlash over Musk’s political allegiances. > In a post just after midnight in Washington, Trump said he will buy a new Tesla “tomorrow morning” as a “show of confidence and support for Elon Musk, a truly great American. Why should he be punished for putting his tremendous skills to work in order to help MAKE AMERICA GREAT AGAIN???” Trump didn’t specify which Tesla model he would buy.",741,0.9735,0.249,0.696,0.054,Positive,7,1,0.75,Positive
Reddit,TSLA,Tesla,11/9/2024 10:22:39,2024-11,What's the argument for a Tesla valuation this high? It seems completely detached from any fundamentals.,104,-0.5095,0,0.752,0.248,Negative,0,0,0,Neutral
Reddit,TSLA,Tesla,10/14/2024 17:43:23,2024-10,"Tesla's $30,000 Robotaxi Hits Major Speed Bump: No Self-Driving Permits, No Profits in Sight",92,-0.128,0.158,0.601,0.24,Negative,1,0,1,Positive
Reddit,TSLA,Tesla,11/11/2024 11:55:15,2024-11,"Elon Musk’s Trump bet has paid off so well that Tesla is now worth more than most of the rest of the car industry combined [https://fortune.com/2024/11/11/elon-musk-donald-trump-election-tesla-auto-industry-carmakers-market-value/](https://fortune.com/2024/11/11/elon-musk-donald-trump-election-tesla-auto-industry-carmakers-market-value/) >Tesla CEO Elon Musk’s ‘all-in’ gamble to get Donald Trump elected president has proven so successful that a veritable chasm has opened up between his EV manufacturer and the rest of the auto industry. As conventional carmakers trade at rock-bottom prices amid a broad industry malaise brought on by China’s economic slowdown and growing fears of Trump tariffs, Tesla’s stock continues to soar, creating one of the biggest valuation gaps it’s ever seen. >On Friday, Tesla reclaimed its place in the elite club of companies worth more than $1 trillion after adding a full third in market capitalization since Election Day less than a week ago. The last time Tesla was worth this amount of money it was April 2022, Musk had just revealed his $44 billion plan to acquire Twitter. >Relative to its peers, Tesla is now worth more than the next 15 largest carmakers combined—from Toyota and General Motors all the way down to Jeep’s parent company Stellantis and Hyundai. Toss in lower ranked names like Kia and Renault, respectively worth $26.6 billion and $12.6 billion, and Tesla is still is still ahead, only drawing even once the $8.8 billion from Japan’s Nissan is thrown into the mix.",1525,0.9137,0.107,0.856,0.038,Positive,2,1,0.3333333333,Positive
Reddit,TSLA,Tesla,3/7/2025 15:21:11,2025-03,"Suspicious Tesla Sales Surge Triggers Canadian Government Investigation * **Tesla reported 8,600 sales in three days, triggering $43 million in government EV rebates.** * **A single Toronto Tesla location claimed over 1,200 sales, raising concerns about possible rebate misuse.** * **Transport Canada is investigating potential irregularities in Tesla’s sales amid the suspension of the rebate program.** [https://motorillustrated.com/suspicious-tesla-sales-surge-triggers-canadian-government-investigation/149947/](https://motorillustrated.com/suspicious-tesla-sales-surge-triggers-canadian-government-investigation/149947/)",625,-0.3612,0,0.955,0.045,Negative,1,1,0,Neutral
Reddit,TSLA,Tesla,11/15/2024 1:49:43,2024-11,"Those who think removing the EV tax credit will help Tesla are smoking some exotic copium. Here's my crystal ball. 1. Trump removes $7,500 EV tax credits and imposes import tariffs on all imported EVs. 2. The US EV manufacturers are starved out, and Tesla is the only surviving US EV maker - I quote ""Tesla does not depend on subsidies"". 3. Tesla increases its US EV market share, seemingly as the only car manufacturer without risk of discontinuity. 4. Nonetheless, Tesla delivery numbers remain stagnant despite increased US market share due to lowering overall EV sales. 5. Tesla now monopolises the US EV market, significantly diluting the need to compete. 6. US import tariffs are now in full effect. Imported parts are too expensive, and cost-cutting is prioritised. Tesla's costly R&D takes a backseat. 7. China, Korea and the Germans retaliate by imposing tariffs on Tesla imports, crippling Tesla's global market EV share. 8. Chinese, Korean and German EV makers continue to improve EV capabilities in a 3-cornered fight, widening the tech gap to Tesla. 9. The difference in EVs has now become more apparent. Tesla now lacks value for money and is no longer relevant to the global market. The US is dethroned as a major EV leader. 10. Tesla now struggles to sustain revenue growth without the global market. It now struggles to justify its colossal trillion-dollar valuation. Tesla needs to milk the already-drying US harder, somehow. 11. A new generation of Tesla bag holders is created. Edit: Hundreds of ya all only read point 7 and started refuting how Tesla has factories in China and Germany, so there aren't tariffs, clear skies, etc. Look, when this trade war starts, these countries will want blood. Tesla is not only the US hallmark of EVs, but its flamboyant boss is now part of the US administration that initiated the sanctions. The countries, especially the Chinese, will hit where it hurts the most.",1923,-0.5562,0.063,0.866,0.071,Negative,3,1,0.5,Positive
Reddit,TSLA,Tesla,12/11/2024 22:45:25,2024-12,What it feels like shorting Tesla now... My puts are deep in the red. Will we ever run out of regards buying up here?,117,0.3612,0.098,0.902,0,Positive,1,0,1,Positive
Reddit,TSLA,Tesla,1/22/2025 12:34:46,2025-01,"Tesla CEO Elon Musk bashes the $500 billion AI project Trump announced, claiming its backers don’t ‘have the money’ https://www.cnn.com/2025/01/22/tech/elon-musk-trump-stargate-openai/index.html > Shortly after President Donald Trump announced a new massive AI infrastructure investment from the White House, “First Buddy” Elon Musk tried to tear it down. “They don’t actually have the money,” Musk wrote on his social media platform X. “SoftBank has well under $10B secured. I have that on good authority.” > Trump said the investment will create a new company, called Stargate, to grow artificial intelligence infrastructure in the United States. The leaders of SoftBank, OpenAI and Oracle stood alongside Trump during the announcement. Their respective companies will invest $100 billion in total for the project to start, with plans to pour up to $500 billion into Stargate in the coming years. > Perhaps it should not be a surprise that Musk is going after an OpenAI initiative. Musk is in an ongoing lawsuit with OpenAI and its CEO Sam Altman, who was at the White House for the announcement. Musk, who has said he “doesn’t trust” Altman, claims in the lawsuit the ChatGPT has abandoned its original nonprofit mission by reserving some of its most advanced AI technology for private customers. The companies involved in Stargate have not publicly disclosed how they will contribute the funds, but they don’t necessarily need the money in the bank to support it — they could raise debt or sign on other equity investors.",1525,0.7929,0.079,0.883,0.038,Positive,2,0,1,Positive
Reddit,TSLA,Tesla,3/18/2025 10:19:40,2025-03,"Short sellers make $16bn profit from Tesla’s share price plunge https://www.ft.com/content/2f48ad1b-627d-4ab0-8358-fb45e642a9fe Tesla's stock has halved, costing Elon Musk over $100B, while short sellers gained $16.2B. Musk’s political stance and federal cuts hurt Tesla’s brand and sales. JPMorgan slashed its price target, and market fears over Trump’s tariffs worsened the decline.",384,-0.6705,0.122,0.668,0.21,Negative,1,3,-0.5,Negative
Reddit,TSLA,Tesla,3/9/2025 14:50:32,2025-03,"Up in Smoke: Tesla dealers, cars and owners under attack globally… And the stock is plummeting for it. In recent months, Tesla cars and dealerships have faced a surge of arson, protests, and vandalism, largely tied to backlash against CEO Elon Musk’s political actions and influence. Incidents include Molotov cocktails thrown at vehicles, graffiti like “Nazi cars” and “F--- Musk” spray-painted on dealerships, and fires set at charging stations across the U.S. and Europe. From Colorado to Oregon, and even France, these attacks have escalated since Musk’s alignment with President Trump and his role in the Department of Government Efficiency (DOGE), prompting federal investigations and highlighting growing public discontent.",730,-0.296,0.057,0.875,0.068,Negative,1,0,1,Positive
Reddit,TSLA,Tesla,12/2/2024 17:10:38,2024-12,"Tesla CEO Elon Musk loses bid to get $56 billion pay package reinstated A Delaware judge ruled on Monday that Tesla, CEO Elon Musk still is not entitled to receive a $56 billion compensation package despite shareholders of the electric vehicle company voting to reinstate it.The ruling by the judge, Chancellor Kathaleen McCormick of the Court of Chancery, follows her January decision that called the pay package excessive and rescinded it, surprising investors, and cast uncertainty over Musk's future at the world's most valuable carmaker. Tesla has said in court filings that the judge should recognize a subsequent June vote by its shareholders in favor of the pay package for Musk, the company's driving force who is responsible for many of its advances, and reinstate his compensation.McCormick also ordered Tesla to pay the attorneys who brought the case $345 million, well short of the billions they initially requested. Sources: [https://www.reuters.com/legal/delaware-judge-rejects-request-restore-elon-musks-56-billion-tesla-compensation-2024-12-02/](https://www.reuters.com/legal/delaware-judge-rejects-request-restore-elon-musks-56-billion-tesla-compensation-2024-12-02/) [https://www.cnbc.com/2024/12/02/tesla-ceo-elon-musk-loses-bid-to-get-56-billion-pay-package-reinstated.html](https://www.cnbc.com/2024/12/02/tesla-ceo-elon-musk-loses-bid-to-get-56-billion-pay-package-reinstated.html)",1404,0.5391,0.078,0.846,0.075,Positive,0,1,-1,Negative
Reddit,TSLA,Tesla,11/18/2024 5:44:04,2024-11,Tesla stock pops 8% in premarket after report Trump wants to relax U.S. self-driving rules,90,0.4404,0.172,0.828,0,Positive,0,0,0,Neutral
Reddit,TSLA,Tesla,3/11/2024 18:01:24,2024-03,US Billionaire Drowns in Tesla Model X. Attempts to break into the vehicle were not possible due to the reinforced glass PUTS ON TESLA,134,-0.4939,0,0.878,0.122,Negative,0,0,0,Neutral
Reddit,TSLA,Tesla,12/2/2024 16:57:20,2024-12,Musk Record Tesla Pay Package Rejected Again by Delaware Judge,62,-0.5719,0,0.63,0.37,Negative,1,0,1,Positive
Reddit,TSLA,Tesla,2/10/2025 11:51:10,2025-02,"Why is Tesla stocks not collapsing? (Genuine question) Hi everyone, I hope some of you can shed light on this question. I’m really curious why and how Tesla stock continues to hold its value, given that the company’s sales are relatively low right now and its growth seems slower than expected. It also appears that the Cybertruck launch didn’t go as planned, and Elon’s increasingly controversial presence might not be the best for the company, since he’s such a key part of its marketing. Am I missing something here? Is there something I’m overlooking? (Just to clarify, this isn’t coming from a political standpoint, I’m genuinely curious.)",644,0.5351,0.111,0.808,0.081,Positive,2,1,0.3333333333,Positive
Reddit,TSLA,Tesla,3/19/2025 23:16:14,2025-03,"Financial Times: "" $1.4bn is a lot to fall through the cracks, even for Tesla""",78,0,0,1,0,Neutral,0,1,-1,Negative
NewsAPI,GOOGL,Alphabet,9/3/2024 12:54:00,2024-09,"D-WAVE QUANTUM Stock Rises 62% Post Q4 Results: To Buy or Not to Buy? QBTS stock benefits from an expanding clientele and its growing influence in the quantum computing space despite stiff competition. D-WAVE QUANTUM QBTS shares have surged 62% since the company reported fourth-quarter 2024 results on March 13. The outperformance can be attributed to strong growth in bookings, which surged 502% on … [+5660 chars]",416,0.886,0.169,0.831,0,Positive,5,0,1,Positive
NewsAPI,GOOGL,Alphabet,4/19/2024 7:18:00,2024-04,"Nvidia, Google, Tesla, BYD, Tencent Music, Xpeng: Stocks to watch today Stock futures edged down ahead of a slew of economic numbers set for release later Tuesday morning. Futures tied to the S&P 500, the Nasdaq 100 and the Dow Jones Industrial Average pointed to a slightly lower open.Read more... In This Story Stock futures edged down ahead of a slew of economic numbers set for release later Tuesday morning. Futures tied to the S&amp;P 500, the Nasdaq 100 and the Dow Jones Industrial Average… [+2179 chars]",512,-0.228,0,0.978,0.022,Negative,0,1,-1,Negative
NewsAPI,GOOGL,Alphabet,7/15/2024 18:54:18,2024-07,"Is Alphabet Inc. (GOOGL) the Most Profitable Large Cap Stock to Buy Now? If you click 'Accept all', we and our partners, including 238 who are part of the IAB Transparency &amp; Consent Framework, will also store and/or access information on a device (in other words, use … [+702 chars]",286,0.7713,0.146,0.854,0,Positive,2,0,1,Positive
NewsAPI,GOOGL,Alphabet,3/29/2024 17:20:05,2024-03,"Is Alphabet Inc. (GOOGL) the Top Stock to Buy According to Marshall Wace LLP? If you click 'Accept all', we and our partners, including 238 who are part of the IAB Transparency &amp; Consent Framework, will also store and/or access information on a device (in other words, use … [+702 chars]",291,0.6486,0.12,0.88,0,Positive,2,0,1,Positive
NewsAPI,GOOGL,Alphabet,1/27/2024 6:00:00,2024-01,"Facts About The Stock Corrections, Tariffs, And Consumer Confidence Stocks entered into a correction with a decline of 10%. What can history teach us about stocks after a correction in a time of tariffs and plunging consumer confidence? Last week, the S&amp;P 500 hit correction territory, which is defined as a 10% decline from a previous ... [+] high. The pressure on stocks seems to come from an economic growth scare, which includes… [+9356 chars]",451,0.5859,0.117,0.814,0.069,Positive,1,2,-0.3333333333,Negative
NewsAPI,GOOGL,Alphabet,11/1/2024 14:03:35,2024-11,"The 'Magnificent 7' stocks are having their worst quarter in more than 2 years The Magnificent Seven stocks are having their worst quarter in more than two years — and are dragging down the S&P 500 with them. Tuesday's stock market sell-off had a familiar flavor to the market action seen so far this year. Six of the ""Magnificent Seven"" stocks shares of Nvidia (NVDA), Tesla (TSLA), Alphabet (GOOG, GOOGL),… [+3780 chars]",422,0.6908,0.163,0.74,0.096,Positive,0,2,-1,Negative
NewsAPI,GOOGL,Alphabet,2/19/2025 6:42:18,2025-02,"A Fed meeting and retail sales data greet a flailing stock market: What to know this week With the stock market on its worst stretch of 2025, investors will be looking for clues on when, or if, the Federal Reserve will cut interest rates further... The stock market has sunk near a six-month low as concerns over slowing economic growth and fear of how tariffs could impact the outlook have shaken investor confidence. Last week, the S&amp;P 500 (… [+6297 chars]",462,-0.1531,0.12,0.742,0.138,Negative,1,2,-0.3333333333,Negative
NewsAPI,GOOGL,Alphabet,2/17/2025 15:11:07,2025-02,Meta Stock Slides To Approach 3-Month Low Despite This AI Milestone Meta stock slumped further despite news the Facebook parent's AI models had reached more than one billion downloads. Meta Platforms (META) stock tumbled further in Tuesday trading amid another rough day for major tech stocks. News that the Facebook parent's AI models had reached 1 billion downloads was not enough t… [+3287 chars],399,-0.0772,0.043,0.924,0.032,Negative,0,0,0,Neutral
NewsAPI,GOOGL,Alphabet,4/1/2024 10:59:41,2024-04,5 Things to Know Before the Stock Market Opens U.S. stock futures are edging lower as indexes come off two straight winning sessions; the Federal Reserve begins its two-day meeting on interest rates and the economy; Google parent Alphabet (GOOGL) reportedly is in talks to acquire cybersecurity software pr… U.S. stock futures are edging lower as indexes come off two straight winning sessions; the Federal Reserve begins its two-day meeting on interest rates and the economy; Google parent Alphabet (GOOGL)… [+153 chars],521,0.9042,0.177,0.777,0.047,Positive,0,2,-1,Negative
NewsAPI,GOOGL,Alphabet,6/16/2024 11:55:35,2024-06,"Stock Market Corrections: How To Sell Stocks, Manage Risk And Prepare For Next Uptrend In stock market corrections like the current one, rules for when to sell stocks take center stage. Highlighting the troubles, the market indexes — as well as bellwether names like Nvidia (NVDA), Alphabet (GOOGL) Apple (AAPL) and others — have sunk below key m… Youve Read the News - Now Find the ExpertClick to discover leading experts on 50,000+ topics for media, events &amp; more. Discover Experts on 50,000+ TopicsConnect for media, speaking, expert witne… [+95 chars]",559,0.25,0.075,0.872,0.054,Positive,1,3,-0.5,Negative
NewsAPI,GOOGL,Alphabet,3/4/2024 10:15:04,2024-03,"Stock Market Today: Dow Jones, S&P 500 Fall As Fed Meeting Gets Underway; Nvidia, Tesla Sink (Live Coverage) The Dow Jones Industrial Average and other major indexes tumbled in the wake of a two-day winning streak as investors awaited signals from the Federal Reserve on rate cuts Tuesday. Big Tech names in focus included Nvidia (NVDA), Tesla (TSLA) and Alphabet (GOO… The Dow Jones Industrial Average and other major indexes tumbled in the wake of a two-day winning streak as investors awaited signals from the Federal Reserve on rate cuts Tuesday. Big Tech names in … [+142 chars]",583,0.4939,0.066,0.869,0.064,Positive,0,1,-1,Negative
NewsAPI,GOOGL,Alphabet,12/31/2024 14:18:13,2024-12,"Google expands Reddit partnership after concerns about vulnerability to search engine’s algorithm Alphabet’s Google GOOGL-Q on Monday expanded its partnership with Reddit RDDT-N amid concerns that the social media platform’s user growth relies heavily on traffic from Google Search. Redburn Atlantic analyst James Cordwell initiated coverage on Reddit’s sto… Youve Read the News - Now Find the ExpertClick to discover leading experts on 50,000+ topics for media, events &amp; more. Discover Experts on 50,000+ TopicsConnect for media, speaking, expert witne… [+95 chars]",570,0.2732,0.048,0.93,0.023,Positive,2,2,0,Neutral
NewsAPI,GOOGL,Alphabet,2/19/2024 7:16:04,2024-02,"Google Restarts Acquisition Talks With Cybersecurity Firm Wiz Google-parent Alphabet (GOOGL) has restarted acquisition talks with fast growing, privately held cybersecurity firm Wiz, according to a report. Google stock dipped a fraction in early trading on Tuesday amid the news. Google has upped its offer to $30 billion… Google-parent Alphabet (GOOGL) has restarted acquisition talks with fast growing, privately held cybersecurity firm Wiz, according to a report. Google stock dipped a fraction in early trading on Tues… [+142 chars]",536,0.34,0.045,0.955,0,Positive,2,0,1,Positive
NewsAPI,GOOGL,Alphabet,10/11/2024 4:07:09,2024-10,"NBW Capital LLC Has $22.25 Million Stock Position in Alphabet Inc. (NASDAQ:GOOGL) NBW Capital LLC increased its holdings in shares of Alphabet Inc. (NASDAQ:GOOGL – Free Report) by 2.7% during the 4th quarter, according to the company in its most recent disclosure with the Securities & Exchange Commission. The firm owned 117,533 shares of t… NBW Capital LLC increased its holdings in shares of Alphabet Inc. (NASDAQ:GOOGL – Free Report) by 2.7% during the 4th quarter, according to the company in its most recent disclosure with the Securiti… [+6055 chars]",557,0.9485,0.199,0.801,0,Positive,2,0,1,Positive
NewsAPI,GOOGL,Alphabet,12/11/2023 3:48:48,2023-12,"CORDA Investment Management LLC. Sells 1,656 Shares of Alphabet Inc. (NASDAQ:GOOGL) CORDA Investment Management LLC. reduced its position in shares of Alphabet Inc. (NASDAQ:GOOGL – Free Report) by 0.8% in the fourth quarter, HoldingsChannel reports. The institutional investor owned 214,968 shares of the information services provider’s stock … CORDA Investment Management LLC. reduced its position in shares of Alphabet Inc. (NASDAQ:GOOGL – Free Report) by 0.8% in the fourth quarter, HoldingsChannel reports. The institutional investor owned … [+5963 chars]",559,0.9246,0.182,0.818,0,Positive,0,0,0,Neutral
NewsAPI,GOOGL,Alphabet,2/3/2024 3:48:48,2024-02,"Alphabet Inc. (NASDAQ:GOOGL) Shares Acquired by Motiv8 Investments LLC Motiv8 Investments LLC boosted its holdings in Alphabet Inc. (NASDAQ:GOOGL – Free Report) by 40.6% during the 4th quarter, HoldingsChannel.com reports. The institutional investor owned 7,638 shares of the information services provider’s stock after purchasing… Motiv8 Investments LLC boosted its holdings in Alphabet Inc. (NASDAQ:GOOGL – Free Report) by 40.6% during the 4th quarter, HoldingsChannel.com reports. The institutional investor owned 7,638 shares o… [+6209 chars]",546,0.9451,0.219,0.781,0,Positive,0,0,0,Neutral
NewsAPI,GOOGL,Alphabet,2/24/2025 3:50:49,2025-02,"Cantillon Capital Management LLC Buys 23,790 Shares of Alphabet Inc. (NASDAQ:GOOGL) Cantillon Capital Management LLC grew its stake in Alphabet Inc. (NASDAQ:GOOGL – Free Report) by 0.5% during the fourth quarter, HoldingsChannel reports. The firm owned 4,487,038 shares of the information services provider’s stock after purchasing an addition… Cantillon Capital Management LLC grew its stake in Alphabet Inc. (NASDAQ:GOOGL – Free Report) by 0.5% during the fourth quarter, HoldingsChannel reports. The firm owned 4,487,038 shares of the inform… [+6384 chars]",559,0.9042,0.153,0.847,0,Positive,0,0,0,Neutral
NewsAPI,GOOGL,Alphabet,7/30/2024 12:36:57,2024-07,"Google is testing Trump's new antitrust cops with $32 billion Wiz deal Google's new attempt to buy Israeli cloud cybersecurity startup Wiz may be on more solid footing than it was when first contemplated during the Biden... Google's (GOOG, GOOGL) new attempt to buy Israeli cloud cybersecurity startup Wiz is a fresh test for how aggressively President Trump's antitrust watchdogs will respond to moves by Big Tech. While … [+4849 chars]",437,0.2247,0.058,0.91,0.032,Positive,2,0,1,Positive
NewsAPI,GOOGL,Alphabet,11/26/2024 2:59:08,2024-11,"Vantage Financial Partners LLC Has $612,000 Stock Holdings in Alphabet Inc. (NASDAQ:GOOGL) Vantage Financial Partners LLC trimmed its holdings in shares of Alphabet Inc. (NASDAQ:GOOGL – Free Report) by 21.3% during the fourth quarter, Holdings Channel.com reports. The fund owned 3,232 shares of the information services provider’s stock after sellin… Vantage Financial Partners LLC trimmed its holdings in shares of Alphabet Inc. (NASDAQ:GOOGL – Free Report) by 21.3% during the fourth quarter, Holdings Channel.com reports. The fund owned 3,232 shar… [+6143 chars]",566,0.9042,0.15,0.85,0,Positive,0,0,0,Neutral
NewsAPI,GOOGL,Alphabet,3/12/2024 2:22:44,2024-03,"Academy Capital Management Trims Stock Position in Alphabet Inc. (NASDAQ:GOOGL) Academy Capital Management lessened its holdings in Alphabet Inc. (NASDAQ:GOOGL – Free Report) by 0.5% during the 4th quarter, according to its most recent filing with the Securities and Exchange Commission. The fund owned 179,071 shares of the information se… Academy Capital Management lessened its holdings in Alphabet Inc. (NASDAQ:GOOGL – Free Report) by 0.5% during the 4th quarter, according to its most recent filing with the Securities and Exchange Com… [+6001 chars]",555,0.9042,0.148,0.852,0,Positive,0,0,0,Neutral
NewsAPI,GOOGL,Alphabet,11/20/2023 3:36:50,2023-11,"Alphabet Inc. (NASDAQ:GOOGL) Shares Purchased by Cape Investment Advisory Inc. Cape Investment Advisory Inc. boosted its stake in Alphabet Inc. (NASDAQ:GOOGL – Free Report) by 0.6% during the fourth quarter, according to its most recent 13F filing with the SEC. The firm owned 19,619 shares of the information services provider’s stock af… Cape Investment Advisory Inc. boosted its stake in Alphabet Inc. (NASDAQ:GOOGL – Free Report) by 0.6% during the fourth quarter, according to its most recent 13F filing with the SEC. The firm owned 1… [+6023 chars]",554,0.9325,0.167,0.833,0,Positive,0,0,0,Neutral
NewsAPI,GOOGL,Alphabet,6/25/2024 2:14:47,2024-06,"Bank OZK Has $3.30 Million Position in Alphabet Inc. (NASDAQ:GOOGL) Bank OZK reduced its position in shares of Alphabet Inc. (NASDAQ:GOOGL – Free Report) by 6.9% during the 4th quarter, according to the company in its most recent 13F filing with the Securities & Exchange Commission. The firm owned 17,454 shares of the informa… Bank OZK reduced its position in shares of Alphabet Inc. (NASDAQ:GOOGL – Free Report) by 6.9% during the 4th quarter, according to the company in its most recent 13F filing with the Securities &amp; … [+6035 chars]",543,0.9393,0.18,0.82,0,Positive,0,0,0,Neutral
