platform,stock_symbol,stock_name,title,full_text,source,author,url,published_at,search_query,collection_time
NewsAPI,GOOGL,Alphabet,D-WAVE QUANTUM Stock Rises 62% Post Q4 Results: To Buy or Not to Buy?,"QBTS stock benefits from an expanding clientele and its growing influence in the quantum computing space despite stiff competition. D-WAVE QUANTUM QBTS shares have surged 62% since the company reported fourth-quarter 2024 results on March 13. The outperformance can be attributed to strong growth in bookings, which surged 502% on … [+5660 chars]",Yahoo Entertainment,Nilanshi Mukherjee,https://finance.yahoo.com/news/d-wave-quantum-stock-rises-175400014.html,2025-03-18T17:54:00Z,GOOGL stock,2025-03-20 10:31:46.614812
NewsAPI,GOOGL,Alphabet,"Nvidia, Google, Tesla, BYD, Tencent Music, Xpeng: Stocks to watch today","Stock futures edged down ahead of a slew of economic numbers set for release later Tuesday morning. Futures tied to the S&P 500, the Nasdaq 100 and the Dow Jones Industrial Average pointed to a slightly lower open.Read more... In This Story Stock futures edged down ahead of a slew of economic numbers set for release later Tuesday morning. Futures tied to the S&amp;P 500, the Nasdaq 100 and the Dow Jones Industrial Average… [+2179 chars]",Quartz India,Josh Fellman,https://qz.com/nvidia-google-byd-tesla-xpeng-tencent-stocks-markets-1851770529,2025-03-18T12:18:00Z,GOOGL stock,2025-03-20 10:31:46.614812
NewsAPI,GOOGL,Alphabet,Is Alphabet Inc. (GOOGL) the Most Profitable Large Cap Stock to Buy Now?,"If you click 'Accept all', we and our partners, including 238 who are part of the IAB Transparency &amp; Consent Framework, will also store and/or access information on a device (in other words, use … [+702 chars]",Yahoo Entertainment,,https://consent.yahoo.com/v2/collectConsent?sessionId=1_cc-session_182ef1e7-9dcb-418c-8d6f-2427154fa86f,2025-03-13T23:54:18Z,GOOGL stock,2025-03-20 10:31:46.614812
NewsAPI,GOOGL,Alphabet,Is Alphabet Inc. (GOOGL) the Top Stock to Buy According to Marshall Wace LLP?,"If you click 'Accept all', we and our partners, including 238 who are part of the IAB Transparency &amp; Consent Framework, will also store and/or access information on a device (in other words, use … [+702 chars]",Yahoo Entertainment,,https://consent.yahoo.com/v2/collectConsent?sessionId=1_cc-session_e0c2cf60-5c2f-44d3-8932-d4811e09dc0d,2025-03-18T22:20:05Z,GOOGL stock,2025-03-20 10:31:46.614812
NewsAPI,GOOGL,Alphabet,"Facts About The Stock Corrections, Tariffs, And Consumer Confidence","Stocks entered into a correction with a decline of 10%. What can history teach us about stocks after a correction in a time of tariffs and plunging consumer confidence? Last week, the S&amp;P 500 hit correction territory, which is defined as a 10% decline from a previous ... [+] high. The pressure on stocks seems to come from an economic growth scare, which includes… [+9356 chars]",Forbes,"Bill Stone, Contributor, 
 Bill Stone, Contributor
 https://www.forbes.com/sites/bill_stone/",https://www.forbes.com/sites/bill_stone/2025/03/16/facts-about-the-stock--corrections-tariffs-and-consumer-confidence/,2025-03-16T11:00:00Z,GOOGL stock,2025-03-20 10:31:46.614812
NewsAPI,GOOGL,Alphabet,The 'Magnificent 7' stocks are having their worst quarter in more than 2 years,"The Magnificent Seven stocks are having their worst quarter in more than two years — and are dragging down the S&P 500 with them. Tuesday's stock market sell-off had a familiar flavor to the market action seen so far this year. Six of the ""Magnificent Seven"" stocks shares of Nvidia (NVDA), Tesla (TSLA), Alphabet (GOOG, GOOGL),… [+3780 chars]",Yahoo Entertainment,Josh Schafer,https://finance.yahoo.com/news/the-magnificent-7-stocks-are-having-their-worst-quarter-in-more-than-2-years-190335944.html,2025-03-18T19:03:35Z,GOOGL stock,2025-03-20 10:31:46.614812
NewsAPI,GOOGL,Alphabet,A Fed meeting and retail sales data greet a flailing stock market: What to know this week,"With the stock market on its worst stretch of 2025, investors will be looking for clues on when, or if, the Federal Reserve will cut interest rates further... The stock market has sunk near a six-month low as concerns over slowing economic growth and fear of how tariffs could impact the outlook have shaken investor confidence. Last week, the S&amp;P 500 (… [+6297 chars]",Yahoo Entertainment,Josh Schafer,https://finance.yahoo.com/news/a-fed-meeting-and-retail-sales-data-greet-a-flailing-stock-market-what-to-know-this-week-114218621.html,2025-03-16T11:42:18Z,GOOGL stock,2025-03-20 10:31:46.614812
NewsAPI,GOOGL,Alphabet,Meta Stock Slides To Approach 3-Month Low Despite This AI Milestone,Meta stock slumped further despite news the Facebook parent's AI models had reached more than one billion downloads. Meta Platforms (META) stock tumbled further in Tuesday trading amid another rough day for major tech stocks. News that the Facebook parent's AI models had reached 1 billion downloads was not enough t… [+3287 chars],Investor's Business Daily,"RYAN DEFFENBAUGH, Investor's Business Daily",https://www.investors.com/news/technology/meta-stock-slides-to-approach-3-month-low-despite-this-ai-milestone/,2025-03-18T20:11:07Z,GOOGL stock,2025-03-20 10:31:46.614812
NewsAPI,GOOGL,Alphabet,5 Things to Know Before the Stock Market Opens,U.S. stock futures are edging lower as indexes come off two straight winning sessions; the Federal Reserve begins its two-day meeting on interest rates and the economy; Google parent Alphabet (GOOGL) reportedly is in talks to acquire cybersecurity software pr… U.S. stock futures are edging lower as indexes come off two straight winning sessions; the Federal Reserve begins its two-day meeting on interest rates and the economy; Google parent Alphabet (GOOGL)… [+153 chars],Biztoc.com,investopedia.com,https://biztoc.com/x/1898d68e1292f2b7,2025-03-18T15:59:41Z,GOOGL stock,2025-03-20 10:31:46.614812
NewsAPI,GOOGL,Alphabet,"Stock Market Corrections: How To Sell Stocks, Manage Risk And Prepare For Next Uptrend","In stock market corrections like the current one, rules for when to sell stocks take center stage. Highlighting the troubles, the market indexes — as well as bellwether names like Nvidia (NVDA), Alphabet (GOOGL) Apple (AAPL) and others — have sunk below key m… Youve Read the News - Now Find the ExpertClick to discover leading experts on 50,000+ topics for media, events &amp; more. Discover Experts on 50,000+ TopicsConnect for media, speaking, expert witne… [+95 chars]",Biztoc.com,investors.com,https://biztoc.com/x/079bead0c4481706,2025-03-14T16:55:35Z,GOOGL stock,2025-03-20 10:31:46.614812
NewsAPI,GOOGL,Alphabet,"Stock Market Today: Dow Jones, S&P 500 Fall As Fed Meeting Gets Underway; Nvidia, Tesla Sink (Live Coverage)","The Dow Jones Industrial Average and other major indexes tumbled in the wake of a two-day winning streak as investors awaited signals from the Federal Reserve on rate cuts Tuesday. Big Tech names in focus included Nvidia (NVDA), Tesla (TSLA) and Alphabet (GOO… The Dow Jones Industrial Average and other major indexes tumbled in the wake of a two-day winning streak as investors awaited signals from the Federal Reserve on rate cuts Tuesday. Big Tech names in … [+142 chars]",Biztoc.com,investors.com,https://biztoc.com/x/2b9304bf81fb0ac2,2025-03-18T15:15:04Z,GOOGL stock,2025-03-20 10:31:46.615904
NewsAPI,GOOGL,Alphabet,Google expands Reddit partnership after concerns about vulnerability to search engine’s algorithm,"Alphabet’s Google GOOGL-Q on Monday expanded its partnership with Reddit RDDT-N amid concerns that the social media platform’s user growth relies heavily on traffic from Google Search. Redburn Atlantic analyst James Cordwell initiated coverage on Reddit’s sto… Youve Read the News - Now Find the ExpertClick to discover leading experts on 50,000+ topics for media, events &amp; more. Discover Experts on 50,000+ TopicsConnect for media, speaking, expert witne… [+95 chars]",Biztoc.com,theglobeandmail.com,https://biztoc.com/x/ca1cddeadc9ed845,2025-03-17T19:18:13Z,GOOGL stock,2025-03-20 10:31:46.615904
NewsAPI,GOOGL,Alphabet,Google Restarts Acquisition Talks With Cybersecurity Firm Wiz,"Google-parent Alphabet (GOOGL) has restarted acquisition talks with fast growing, privately held cybersecurity firm Wiz, according to a report. Google stock dipped a fraction in early trading on Tuesday amid the news. Google has upped its offer to $30 billion… Google-parent Alphabet (GOOGL) has restarted acquisition talks with fast growing, privately held cybersecurity firm Wiz, according to a report. Google stock dipped a fraction in early trading on Tues… [+142 chars]",Biztoc.com,investors.com,https://biztoc.com/x/a9751c7735dfc57a,2025-03-18T12:16:04Z,GOOGL stock,2025-03-20 10:31:46.615904
NewsAPI,GOOGL,Alphabet,NBW Capital LLC Has $22.25 Million Stock Position in Alphabet Inc. (NASDAQ:GOOGL),"NBW Capital LLC increased its holdings in shares of Alphabet Inc. (NASDAQ:GOOGL – Free Report) by 2.7% during the 4th quarter, according to the company in its most recent disclosure with the Securities & Exchange Commission. The firm owned 117,533 shares of t… NBW Capital LLC increased its holdings in shares of Alphabet Inc. (NASDAQ:GOOGL – Free Report) by 2.7% during the 4th quarter, according to the company in its most recent disclosure with the Securiti… [+6055 chars]",ETF Daily News,MarketBeat News,https://www.etfdailynews.com/2025/03/17/nbw-capital-llc-has-22-25-million-stock-position-in-alphabet-inc-nasdaqgoogl/,2025-03-17T09:07:09Z,GOOGL stock,2025-03-20 10:31:46.615904
NewsAPI,GOOGL,Alphabet,"CORDA Investment Management LLC. Sells 1,656 Shares of Alphabet Inc. (NASDAQ:GOOGL)","CORDA Investment Management LLC. reduced its position in shares of Alphabet Inc. (NASDAQ:GOOGL – Free Report) by 0.8% in the fourth quarter, HoldingsChannel reports. The institutional investor owned 214,968 shares of the information services provider’s stock … CORDA Investment Management LLC. reduced its position in shares of Alphabet Inc. (NASDAQ:GOOGL – Free Report) by 0.8% in the fourth quarter, HoldingsChannel reports. The institutional investor owned … [+5963 chars]",ETF Daily News,MarketBeat News,https://www.etfdailynews.com/2025/03/13/corda-investment-management-llc-sells-1656-shares-of-alphabet-inc-nasdaqgoogl/,2025-03-13T08:48:48Z,GOOGL stock,2025-03-20 10:31:46.615904
NewsAPI,GOOGL,Alphabet,Alphabet Inc. (NASDAQ:GOOGL) Shares Acquired by Motiv8 Investments LLC,"Motiv8 Investments LLC boosted its holdings in Alphabet Inc. (NASDAQ:GOOGL – Free Report) by 40.6% during the 4th quarter, HoldingsChannel.com reports. The institutional investor owned 7,638 shares of the information services provider’s stock after purchasing… Motiv8 Investments LLC boosted its holdings in Alphabet Inc. (NASDAQ:GOOGL – Free Report) by 40.6% during the 4th quarter, HoldingsChannel.com reports. The institutional investor owned 7,638 shares o… [+6209 chars]",ETF Daily News,MarketBeat News,https://www.etfdailynews.com/2025/03/13/alphabet-inc-nasdaqgoogl-shares-acquired-by-motiv8-investments-llc/,2025-03-13T08:48:48Z,GOOGL stock,2025-03-20 10:31:46.615904
NewsAPI,GOOGL,Alphabet,"Cantillon Capital Management LLC Buys 23,790 Shares of Alphabet Inc. (NASDAQ:GOOGL)","Cantillon Capital Management LLC grew its stake in Alphabet Inc. (NASDAQ:GOOGL – Free Report) by 0.5% during the fourth quarter, HoldingsChannel reports. The firm owned 4,487,038 shares of the information services provider’s stock after purchasing an addition… Cantillon Capital Management LLC grew its stake in Alphabet Inc. (NASDAQ:GOOGL – Free Report) by 0.5% during the fourth quarter, HoldingsChannel reports. The firm owned 4,487,038 shares of the inform… [+6384 chars]",ETF Daily News,MarketBeat News,https://www.etfdailynews.com/2025/03/15/cantillon-capital-management-llc-buys-23790-shares-of-alphabet-inc-nasdaqgoogl/,2025-03-15T08:50:49Z,GOOGL stock,2025-03-20 10:31:46.615904
NewsAPI,GOOGL,Alphabet,Google is testing Trump's new antitrust cops with $32 billion Wiz deal,"Google's new attempt to buy Israeli cloud cybersecurity startup Wiz may be on more solid footing than it was when first contemplated during the Biden... Google's (GOOG, GOOGL) new attempt to buy Israeli cloud cybersecurity startup Wiz is a fresh test for how aggressively President Trump's antitrust watchdogs will respond to moves by Big Tech. While … [+4849 chars]",Yahoo Entertainment,Alexis Keenan,https://finance.yahoo.com/news/google-is-testing-trumps-new-antitrust-cops-with-32-billion-wiz-deal-173657154.html,2025-03-18T17:36:57Z,GOOGL stock,2025-03-20 10:31:46.615904
NewsAPI,GOOGL,Alphabet,"Vantage Financial Partners LLC Has $612,000 Stock Holdings in Alphabet Inc. (NASDAQ:GOOGL)","Vantage Financial Partners LLC trimmed its holdings in shares of Alphabet Inc. (NASDAQ:GOOGL – Free Report) by 21.3% during the fourth quarter, Holdings Channel.com reports. The fund owned 3,232 shares of the information services provider’s stock after sellin… Vantage Financial Partners LLC trimmed its holdings in shares of Alphabet Inc. (NASDAQ:GOOGL – Free Report) by 21.3% during the fourth quarter, Holdings Channel.com reports. The fund owned 3,232 shar… [+6143 chars]",ETF Daily News,MarketBeat News,https://www.etfdailynews.com/2025/03/19/vantage-financial-partners-llc-has-612000-stock-holdings-in-alphabet-inc-nasdaqgoogl/,2025-03-19T07:59:08Z,GOOGL stock,2025-03-20 10:31:46.615904
NewsAPI,GOOGL,Alphabet,Academy Capital Management Trims Stock Position in Alphabet Inc. (NASDAQ:GOOGL),"Academy Capital Management lessened its holdings in Alphabet Inc. (NASDAQ:GOOGL – Free Report) by 0.5% during the 4th quarter, according to its most recent filing with the Securities and Exchange Commission. The fund owned 179,071 shares of the information se… Academy Capital Management lessened its holdings in Alphabet Inc. (NASDAQ:GOOGL – Free Report) by 0.5% during the 4th quarter, according to its most recent filing with the Securities and Exchange Com… [+6001 chars]",ETF Daily News,MarketBeat News,https://www.etfdailynews.com/2025/03/19/academy-capital-management-trims-stock-position-in-alphabet-inc-nasdaqgoogl/,2025-03-19T07:22:44Z,GOOGL stock,2025-03-20 10:31:46.615904
NewsAPI,GOOGL,Alphabet,Alphabet Inc. (NASDAQ:GOOGL) Shares Purchased by Cape Investment Advisory Inc.,"Cape Investment Advisory Inc. boosted its stake in Alphabet Inc. (NASDAQ:GOOGL – Free Report) by 0.6% during the fourth quarter, according to its most recent 13F filing with the SEC. The firm owned 19,619 shares of the information services provider’s stock af… Cape Investment Advisory Inc. boosted its stake in Alphabet Inc. (NASDAQ:GOOGL – Free Report) by 0.6% during the fourth quarter, according to its most recent 13F filing with the SEC. The firm owned 1… [+6023 chars]",ETF Daily News,MarketBeat News,https://www.etfdailynews.com/2025/03/16/alphabet-inc-nasdaqgoogl-shares-purchased-by-cape-investment-advisory-inc/,2025-03-16T08:36:50Z,GOOGL stock,2025-03-20 10:31:46.615904
NewsAPI,GOOGL,Alphabet,Bank OZK Has $3.30 Million Position in Alphabet Inc. (NASDAQ:GOOGL),"Bank OZK reduced its position in shares of Alphabet Inc. (NASDAQ:GOOGL – Free Report) by 6.9% during the 4th quarter, according to the company in its most recent 13F filing with the Securities & Exchange Commission. The firm owned 17,454 shares of the informa… Bank OZK reduced its position in shares of Alphabet Inc. (NASDAQ:GOOGL – Free Report) by 6.9% during the 4th quarter, according to the company in its most recent 13F filing with the Securities &amp; … [+6035 chars]",ETF Daily News,MarketBeat News,https://www.etfdailynews.com/2025/03/15/bank-ozk-has-3-30-million-position-in-alphabet-inc-nasdaqgoogl/,2025-03-15T07:14:47Z,GOOGL stock,2025-03-20 10:31:46.615904
NewsAPI,GOOGL,Alphabet,Illumine Investment Management LLC Makes New Investment in Alphabet Inc. (NASDAQ:GOOGL),"Illumine Investment Management LLC acquired a new position in Alphabet Inc. (NASDAQ:GOOGL – Free Report) in the fourth quarter, HoldingsChannel.com reports. The institutional investor acquired 5,070 shares of the information services provider’s stock, valued … Illumine Investment Management LLC acquired a new position in Alphabet Inc. (NASDAQ:GOOGL – Free Report) in the fourth quarter, HoldingsChannel.com reports. The institutional investor acquired 5,070 … [+6213 chars]",ETF Daily News,MarketBeat News,https://www.etfdailynews.com/2025/03/14/illumine-investment-management-llc-makes-new-investment-in-alphabet-inc-nasdaqgoogl/,2025-03-14T08:24:51Z,GOOGL stock,2025-03-20 10:31:46.615904
NewsAPI,GOOGL,Alphabet,Alphabet Inc. (NASDAQ:GOOGL) is FJ Investments LLC’s 2nd Largest Position,"FJ Investments LLC grew its stake in shares of Alphabet Inc. (NASDAQ:GOOGL – Free Report) by 0.1% in the fourth quarter, according to its most recent filing with the Securities & Exchange Commission. The firm owned 505,472 shares of the information services p… FJ Investments LLC grew its stake in shares of Alphabet Inc. (NASDAQ:GOOGL – Free Report) by 0.1% in the fourth quarter, according to its most recent filing with the Securities &amp; Exchange Commiss… [+5918 chars]",ETF Daily News,MarketBeat News,https://www.etfdailynews.com/2025/03/16/alphabet-inc-nasdaqgoogl-is-fj-investments-llcs-2nd-largest-position/,2025-03-16T08:36:52Z,GOOGL stock,2025-03-20 10:31:46.615904
NewsAPI,GOOGL,Alphabet,"Yelin Lapidot Holdings Management Ltd. Sells 28,061 Shares of Alphabet Inc. (NASDAQ:GOOGL)","Yelin Lapidot Holdings Management Ltd. lessened its stake in shares of Alphabet Inc. (NASDAQ:GOOGL – Free Report) by 22.0% during the 4th quarter, according to the company in its most recent filing with the Securities & Exchange Commission. The firm owned 99,… Yelin Lapidot Holdings Management Ltd. lessened its stake in shares of Alphabet Inc. (NASDAQ:GOOGL – Free Report) by 22.0% during the 4th quarter, according to the company in its most recent filing w… [+6026 chars]",ETF Daily News,MarketBeat News,https://www.etfdailynews.com/2025/03/14/yelin-lapidot-holdings-management-ltd-sells-28061-shares-of-alphabet-inc-nasdaqgoogl/,2025-03-14T07:16:56Z,GOOGL stock,2025-03-20 10:31:46.615904
NewsAPI,GOOGL,Alphabet,Top Cybersecurity Stocks To Follow Now – March 15th,"Alphabet, CrowdStrike, and Palo Alto Networks are the three Cybersecurity stocks to watch today, according to MarketBeat’s stock screener tool. Cybersecurity stocks refer to shares of companies that provide products and services designed to protect computer s… Alphabet, CrowdStrike, and Palo Alto Networks are the three Cybersecurity stocks to watch today, according to MarketBeat’s stock screener tool. Cybersecurity stocks refer to shares of companies that … [+3940 chars]",ETF Daily News,MarketBeat News,https://www.etfdailynews.com/2025/03/17/top-cybersecurity-stocks-to-follow-now-march-15th/,2025-03-17T06:08:48Z,GOOGL stock,2025-03-20 10:31:46.615904
NewsAPI,GOOGL,Alphabet,Healthcare Stocks To Keep An Eye On – March 13th,"Alphabet, Salesforce, and Oracle are the three Healthcare stocks to watch today, according to MarketBeat’s stock screener tool. Healthcare stocks are shares issued by companies operating in the healthcare sector, including pharmaceutical firms, biotechnology … Alphabet, Salesforce, and Oracle are the three Healthcare stocks to watch today, according to MarketBeat’s stock screener tool. Healthcare stocks are shares issued by companies operating in the healt… [+3955 chars]",ETF Daily News,MarketBeat News,https://www.etfdailynews.com/2025/03/15/healthcare-stocks-to-keep-an-eye-on-march-13th/,2025-03-15T06:02:54Z,GOOGL stock,2025-03-20 10:31:46.615904
NewsAPI,GOOGL,Alphabet,Alphabet Inc. (NASDAQ:GOOGL) is Abbot Financial Management Inc.’s 6th Largest Position,"Abbot Financial Management Inc. trimmed its position in shares of Alphabet Inc. (NASDAQ:GOOGL – Free Report) by 0.5% during the fourth quarter, according to the company in its most recent filing with the Securities and Exchange Commission. The institutional i… Abbot Financial Management Inc. trimmed its position in shares of Alphabet Inc. (NASDAQ:GOOGL – Free Report) by 0.5% during the fourth quarter, according to the company in its most recent filing with… [+5924 chars]",ETF Daily News,MarketBeat News,https://www.etfdailynews.com/2025/03/19/alphabet-inc-nasdaqgoogl-is-abbot-financial-management-inc-s-6th-largest-position/,2025-03-19T07:22:43Z,GOOGL stock,2025-03-20 10:31:46.615904
NewsAPI,GOOGL,Alphabet,"Verus Capital Partners LLC Buys 3,905 Shares of Alphabet Inc. (NASDAQ:GOOGL)","Verus Capital Partners LLC increased its position in shares of Alphabet Inc. (NASDAQ:GOOGL – Free Report) by 3.5% in the fourth quarter, HoldingsChannel reports. The firm owned 116,141 shares of the information services provider’s stock after purchasing an ad… Verus Capital Partners LLC increased its position in shares of Alphabet Inc. (NASDAQ:GOOGL – Free Report) by 3.5% in the fourth quarter, HoldingsChannel reports. The firm owned 116,141 shares of the … [+5953 chars]",ETF Daily News,MarketBeat News,https://www.etfdailynews.com/2025/03/14/verus-capital-partners-llc-buys-3905-shares-of-alphabet-inc-nasdaqgoogl/,2025-03-14T07:16:54Z,GOOGL stock,2025-03-20 10:31:46.615904
NewsAPI,GOOGL,Alphabet,Promising Space Stocks To Add to Your Watchlist – March 17th,"Alphabet, Berkshire Hathaway, and Boeing are the three Space stocks to watch today, according to MarketBeat’s stock screener tool. Space stocks are shares of companies that specialize in space-related industries such as satellite technology, launch services, … Alphabet, Berkshire Hathaway, and Boeing are the three Space stocks to watch today, according to MarketBeat’s stock screener tool. Space stocks are shares of companies that specialize in space-relate… [+3539 chars]",ETF Daily News,MarketBeat News,https://www.etfdailynews.com/2025/03/19/promising-space-stocks-to-add-to-your-watchlist-march-17th/,2025-03-19T06:05:05Z,GOOGL stock,2025-03-20 10:31:46.617044
NewsAPI,GOOGL,Alphabet,Pressure is ramping up in Big Tech. Employees told BI how they feel about it.,"""Do more with less."" That's the new mantra in Silicon Valley. Gone are the days of perks and pampering. Brendan Smialowski/AFP/Getty <ul><li>This post originally appeared in the Business Insider Today newsletter.</li><li>You can sign up for Business Insider's daily newsletter here.</li></ul>Good morni… [+7029 chars]",Business Insider,Hallam Bullock,https://www.businessinsider.com/pressure-is-ramping-up-in-big-tech-employees-told-bi-how-they-feel-about-it-2025-3,2025-03-19T13:27:23Z,Alphabet stock,2025-03-20 10:31:47.783847
NewsAPI,GOOGL,Alphabet,Microsoft's 1986 IPO,"Its market cap hit $777 million and Bill Gates' net worth reached $350 million On March 13, 1986, Microsoft shook up the financial world, and to some degree, we are still feeling the reverberations from that 40 years later. That was the day of Microsoft’s very successful IPO. T… [+5928 chars]",Homeip.net,Dave Farquhar,https://dfarq.homeip.net/microsofts-1986-ipo/,2025-03-16T18:41:30Z,Alphabet stock,2025-03-20 10:31:47.783847
NewsAPI,GOOGL,Alphabet,"Can This Unstoppable Stock Join Apple, Microsoft, Nvidia, Amazon, Alphabet, and Meta Platforms in the $1 Trillion Club by 2035?","If you click 'Accept all', we and our partners, including 238 who are part of the IAB Transparency &amp; Consent Framework, will also store and/or access information on a device (in other words, use … [+702 chars]",Yahoo Entertainment,,https://consent.yahoo.com/v2/collectConsent?sessionId=1_cc-session_a4f8af21-40b9-4637-8b73-27f00a963bd5,2025-03-16T22:30:00Z,Alphabet stock,2025-03-20 10:31:47.783847
NewsAPI,GOOGL,Alphabet,Here’s How Much American Billionaires Have Lost Since Trump’s Inauguration,"Expectations were that billionaires would be the big winners in a Trump America 2.0. Instead their fortunes have plummeted in the first eight weeks. Here are the biggest losers. Tech billionaires at Trump's inauguration, including Mark Zuckerberg, Jeff Bezos and Elon Musk, got prime placement. But stocks have tumbled under Trump 2.0 so far. SHAWN THEW POOL/AFP/Getty mages … [+5985 chars]",Forbes,"Grace Thomas, Contributor, 
 Grace Thomas, Contributor
 https://www.forbes.com/sites/gracethomas/",https://www.forbes.com/sites/gracethomas/2025/03/14/heres-how-much-american-billionaires-have-lost-since-trumps-inauguration/,2025-03-14T16:42:03Z,Alphabet stock,2025-03-20 10:31:47.784928
NewsAPI,GOOGL,Alphabet,Alphabet Stock Has Lost Over $500 Billion in Market Cap. Is the Google Parent a Top AI Stock to Buy Now?,"If you click 'Accept all', we and our partners, including 238 who are part of the IAB Transparency &amp; Consent Framework, will also store and/or access information on a device (in other words, use … [+702 chars]",Yahoo Entertainment,,https://consent.yahoo.com/v2/collectConsent?sessionId=1_cc-session_00392476-1e7a-4a46-8376-f207586429da,2025-03-17T11:15:00Z,Alphabet stock,2025-03-20 10:31:47.784928
NewsAPI,GOOGL,Alphabet,Redburn launches Reddit stock coverage at Sell amid ‘material downside’ risk,"Investing.com -- Redburn Atlantic has begun coverage on Reddit Inc (NYSE:RDDT) stock with a Sell rating, setting a price target of $75 per share, which... Redburn launches Reddit stock coverage at Sell amid material downside risk Investing.com -- Redburn Atlantic has begun coverage on Reddit Inc (NYSE:RDDT) stock with a Sell rating, setting a price ta… [+2457 chars]",Yahoo Entertainment,Investing.com,https://finance.yahoo.com/news/redburn-launches-reddit-stock-coverage-143915580.html,2025-03-17T14:39:15Z,Alphabet stock,2025-03-20 10:31:47.784928
