platform,stock_symbol,stock_name,title,full_text,source,author,url,published_at,search_query,collection_time
NewsAPI,AAPL,Apple,4 Best Cars To Buy During Trump’s 1-Month Tariff Break for Vehicles,"If you're in the market for a new car, the decision just got more difficult to fit into your budget. Or at least, more urgent, especially if you have your... If youre in the market for a new car, the decision just got more difficult to fit into your budget. Or at least, more urgent, especially if you have your heart set on one of the approximately 30 car … [+3637 chars]",Yahoo Entertainment,Terence Loose,https://autos.yahoo.com/4-best-cars-buy-during-110308167.html,2025-03-18T11:03:08Z,Apple stock,2025-03-20 10:31:57.427843
NewsAPI,AAPL,Apple,Android-iPhone texting is on track for a long overdue upgrade,iPhone users will soon get RCS encryption for Android texts. A future iOS update will secure messages with end-to-end encryption. <ul><li>End-to-end encryption (E2EE) for RCS messaging between iPhone and Android users is coming soon via the new Universal Profile 3.0 specifications from GSMA.</li><li>The new standard supports th… [+3302 chars],Android Authority,Aamir Siddiqui,https://www.androidauthority.com/android-iphone-texting-e2ee-mls-security-level-up-3535143/,2025-03-14T11:32:32Z,Apple stock,2025-03-20 10:31:57.427843
NewsAPI,AAPL,Apple,Unbeatable Deal: INSIGNIA 32″ F20 Series Fire TV Now Just $74.99 (42% Off!),"Looking for an affordable smart TV for your bedroom, kitchen, or dorm? The INSIGNIA 32” Class F20 Series Fire TV delivers 720p HD resolution, built-in Alexa voice control, and seamless access to streaming apps—all for an incredibly low price. Now just $74.… Looking for an affordable smart TV for your bedroom, kitchen, or dorm? The INSIGNIA 32 Class F20 Series Fire TV delivers 720p HD resolution, built-in Alexa voice control, and seamless access to strea… [+2290 chars]",Phandroid - News for Android,Tyler Lee,https://phandroid.com/2025/03/18/unbeatable-deal-insignia-32-f20-series-fire-tv-now-just-74-99-42-off/,2025-03-18T11:33:48Z,Apple stock,2025-03-20 10:31:57.427843
NewsAPI,AAPL,Apple,Transcript: Stephanie Kelton on US Fiscal Policy and the ‘Deficit Myth’,"The transcript from this week’s, MiB: Stephanie Kelton on US Fiscal Policy and the ‘Deficit Myth’, is below. You can stream and download our full conversation, including any podcast extras, on Apple Podcasts, Spotify, YouTube, and Bloomberg. All of our earlie… The transcript from this weeks, MiB: Stephanie Kelton on US Fiscal Policy and the Deficit Myth, is below. You can stream and download our full conversation, including any podcast extras, on Apple Po… [+89759 chars]",Ritholtz.com,Barry Ritholtz,https://ritholtz.com/2025/03/transcript-stephanie-kelton/,2025-03-17T12:00:31Z,Apple stock,2025-03-20 10:31:57.427843
NewsAPI,AAPL,Apple,How to shoot RAW or Apple ProRAW photos on your iPhone,Learn how to take Apple ProRAW or standard RAW photos on your iPhone to get more control when editing these pictures. Learn how to enable RAW image capture and use the Camera app or third-party iOS apps to take Apple ProRAW or standard RAW photos on your iPhone. Difference between RAW and JPEG images When you take… [+6112 chars],Idownloadblog.com,Ankur Thakur,https://www.idownloadblog.com/2025/03/14/how-to-take-raw-photos-iphone/,2025-03-14T17:30:07Z,Apple stock,2025-03-20 10:31:57.427843
NewsAPI,AAPL,Apple,FBI Warning—Apple Confirms iPhone Update For All Users,"This is a game-changer on your iPhone. Thsi changes everything Getty Images When the FBI warned iPhone and Android users to stop texting each other, it quickly became one of the most viral stories of the year. With Chinese hackers marau… [+3381 chars]",Forbes,"Zak Doffman, Contributor, 
 Zak Doffman, Contributor
 https://www.forbes.com/sites/zakdoffman/",https://www.forbes.com/sites/zakdoffman/2025/03/14/fbi-warning-apple-confirms-iphone-update-for-all-users/,2025-03-14T10:21:23Z,Apple stock,2025-03-20 10:31:57.428450
NewsAPI,AAPL,Apple,Elon Musk And Tim Walz Exchange Barbs As Walz Celebrates Tesla Stock Slide,"The former vice presidential candidate Walz said he checks Tesla’s share price to give him a “little boost during the day,” nodding to Musk’s company’s more than 40% year-to-date loss. Former vice presidential candidate Gov. Tim Walz, D-Minn., and the worlds richest man Elon Musk traded disses over Tesla stocks brutal start to 2024, as Musks electric vehicle brand navigates challen… [+3167 chars]",Forbes,"Derek Saul, Forbes Staff, 
 Derek Saul, Forbes Staff
 https://www.forbes.com/sites/dereksaul/",https://www.forbes.com/sites/dereksaul/2025/03/19/elon-musk-and-tim-walz-exchange-barbs-as-walz-celebrates-tesla-stock-slide/,2025-03-19T13:42:41Z,Apple stock,2025-03-20 10:31:57.428450
NewsAPI,AAPL,Apple,Should you get an Apple Card? Here’s what you need to know,"We’re coming up on the sixth anniversary of the Apple Card’s debut, and it’s proven to be a very popular credit card. If you’re considering applying for the Apple Card, here’s everything you need to know. more… We’re coming up on the sixth anniversary of the Apple Card’s debut, and its proven to be a very popular credit card. If you’re considering applying for the Apple Card, here’s everything you need to k… [+10055 chars]",9to5Mac,Chance Miller,https://9to5mac.com/2025/03/17/should-you-get-apple-card/,2025-03-17T14:33:28Z,Apple earnings,2025-03-20 10:31:58.659145
NewsAPI,AAPL,Apple,Another sign of a dealmaking comeback? Adtech firm Adform is exploring a sale.,"Deal momentum appears to be picking up in the adtech sector after a tepid couple of years. Adform offers products for advertisers and publishers. Time to call in the movers? Adtech firm Adform is looking for a new home.John Lamparski/Getty Images for Advertising Week New York <ul><li>Adform is exploring a sale, another sign of a rebound in th… [+3048 chars]",Business Insider,Lara O'Reilly,https://www.businessinsider.com/adform-sale-carnegie-adtech-dealmaking-bounceback-2025-3,2025-03-19T08:49:07Z,Apple earnings,2025-03-20 10:31:58.660258
NewsAPI,AAPL,Apple,Foxconn head predicts a surge in US manufacturing in the coming years,"The CEO of Apple partner Foxconn has broken silence on President Trump's tariffs, and is predicting disruption and perhaps an expansion of US manufacturing by big tech in the coming years.A Foxconn facilityThe remarks by Foxconn CEO Young Liu during an earnin… The CEO of Apple partner Foxconn has broken silence on President Trump's tariffs, and is predicting disruption and perhaps an expansion of US manufacturing by big tech in the coming years. The remar… [+2463 chars]",AppleInsider,news@appleinsider.com (Mike Wuerthele),https://appleinsider.com/articles/25/03/14/foxconn-head-predicts-a-surge-in-us-manufacturing-in-the-coming-years,2025-03-14T11:36:53Z,Apple earnings,2025-03-20 10:31:58.660258
NewsAPI,AAPL,Apple,"How To Make $20,800+ A Day With ALR Miner","ALR Miner offers free XRP cloud mining with a $12 bonus. Start mining effortlessly with automated processes, secure withdrawals, and multiple investment plans. The post How To Make $20,800+ A Day With ALR Miner first appeared on Redmond Pie. According to SoSoValue data, Bitcoin spot ETFs experienced a total net outflow of $369 million yesterday (March 10, EST). Yesterday, the Grayscale ETF GBTC had a single-day net outflow of US$20.5956… [+1759 chars]",redmondpie.com,RP Staff,https://www.redmondpie.com/how-to-make-20800-a-day-with-alr-miner/,2025-03-15T01:45:23Z,Apple earnings,2025-03-20 10:31:58.660258
NewsAPI,AAPL,Apple,Nvidia-Supplier Hon Hai’s Profit Misses While AI Doubts Persist,(Bloomberg) -- Hon Hai Precision Industry Co.’s quarterly earnings missed estimates as weak Chinese iPhone sales weighed and it invested more on AI server... (Bloomberg) -- Hon Hai Precision Industry Co.s quarterly earnings missed estimates as weak Chinese iPhone sales weighed and it invested more on AI server production. Most Read from Bloomberg The Ta… [+2324 chars],Yahoo Entertainment,Jane Lanhee Lee,https://finance.yahoo.com/news/nvidia-supplier-hon-hai-profit-062111708.html,2025-03-14T06:21:11Z,Apple earnings,2025-03-20 10:31:58.660258
NewsAPI,AAPL,Apple,Apple (NasdaqGS:AAPL) Sees 10% Price Dip Despite Launch Of MacBook Air With M4 Chip,"Apple (NasdaqGS:AAPL) recently rolled out several innovative products, such as the MacBook Air with the M4 chip and the high-performance M3 Ultra chip... Apple recently rolled out several innovative products, such as the MacBook Air with the M4 chip and the high-performance M3 Ultra chip. Despite these advancements, Apple's stock saw a 10% decrease ov… [+3321 chars]",Yahoo Entertainment,editorial-team@simplywallst.com (Simply Wall St),https://finance.yahoo.com/news/apple-nasdaqgs-aapl-sees-10-171734482.html,2025-03-15T17:17:34Z,Apple earnings,2025-03-20 10:31:58.660258
NewsAPI,AAPL,Apple,"Gwyneth Paltrow on Motherhood, MAHA, Meghan Markle, Making Out With Timothée Chalamet—and Much More","With Apple and Moses having flown the nest, and Goop humming along, the star is making her big return to film as she seeks the answer to “Who am I now?” Her Oscar moment is a collective core memory: Paltrow, 26 and tearful in princess pink Ralph Lauren, accepting best actress over Meryl Streep and Cate Blanchett and Brazilian screen legend Fernanda M… [+5182 chars]",Vanity Fair,Michelle Ruiz,https://www.vanityfair.com/hollywood/story/gwyneth-paltrow-2025-interview,2025-03-18T12:00:00Z,Apple earnings,2025-03-20 10:31:58.660258
NewsAPI,AAPL,Apple,Evercore ups ‘tech staple’ Apple’s target price to $275 from $260,"On Tuesday, Evercore ISI released its fifth annual ""Apple Primer,"" providing an in-depth analysis of Apple and raising its price target… The post Evercore ups ‘tech staple’ Apple’s target price to $275 from $260 appeared first on MacDailyNews. On Tuesday, Evercore ISI released its fifth annual “Apple Primer,” providing an in-depth analysis of Apple and raising its price target for the stock from $260 to $275 while maintaining an “Outperfor… [+3104 chars]",Macdailynews.com,MacDailyNews,https://macdailynews.com/2025/03/18/evercore-ups-tech-staple-apples-target-price-to-275-from-260/,2025-03-18T15:02:51Z,Apple earnings,2025-03-20 10:31:58.660258
NewsAPI,AAPL,Apple,Taiwan Tech Giant Foxconn's 2024 Profit Misses Forecasts,"Taiwanese tech giant Foxconn reported on Friday a lower-than-expected net profit for 2024 as consumer electronic gadgets underperformed, although demand for its artificial intelligence servers remained robust. Taiwanese tech giant Foxconn reported on Friday a lower-than-expected net profit for 2024 as consumer electronic gadgets underperformed, although demand for its artificial intelligence servers remain… [+3213 chars]",International Business Times,Amber WANG,https://www.ibtimes.com/taiwan-tech-giant-foxconns-2024-profit-misses-forecasts-3766287,2025-03-14T09:27:18Z,Apple earnings,2025-03-20 10:31:58.660258
NewsAPI,AAPL,Apple,Apple Maps 2.0: Is Apple Intelligence Another Epic Failure in the Making?,"Last June, at WWDC 2024 Apple announced all of its new operating systems as it always does. And then it went into Apple Intelligence. The marketing name Last June, at WWDC 2024 Apple announced all of its new operating systems as it always does. And then it went into Apple Intelligence. The marketing name for their suite of Artificial Intelligence fea… [+7172 chars]",Android Headlines,Alexander Maxham,https://www.androidheadlines.com/2025/03/apple-maps-2-0-is-apple-intelligence-another-epic-failure-in-the-making.html,2025-03-14T16:22:49Z,Apple earnings,2025-03-20 10:31:58.660258
NewsAPI,AAPL,Apple,Xiaomi CEO Lei Jun sees progress as firm lifts 2025 EV deliveries target by 16%,"Xiaomi has raised its full-year target for electric vehicle (EV) deliveries by 16 per cent on the back of strong demand after reporting solid financial... Xiaomi has raised its full-year target for electric vehicle (EV) deliveries by 16 per cent on the back of strong demand after reporting solid financial results for last year, underpinning confidence … [+5340 chars]",Yahoo Entertainment,South China Morning Post,https://finance.yahoo.com/news/xiaomi-ceo-lei-jun-sees-093000440.html,2025-03-18T09:30:00Z,Apple earnings,2025-03-20 10:31:58.660258
NewsAPI,AAPL,Apple,Markets Move Into Correction Territory As Trade Wars Continue,"Stocks plunged as trade war fears fueled a correction, with the S&P 500 down 4% for the week. Investors seek safe havens in gold, while volatility remains a key concern. Consumers are cutting back on spending and the number of people planning a vacation in the next 6 ... [+] months it the lowest in 15 years, not counting Covid. (Photo by AaronP/Bauer-Griffin/GC Image… [+5034 chars]",Forbes,"JJ Kinahan, Senior Contributor, 
 JJ Kinahan, Senior Contributor
 https://www.forbes.com/sites/jjkinahan/",https://www.forbes.com/sites/jjkinahan/2025/03/14/markets-move-into-correction-territory-as-trade-wars-continue/,2025-03-14T12:26:34Z,Apple earnings,2025-03-20 10:31:58.660258
NewsAPI,AAPL,Apple,Samsung CEO says company considering deals as it struggles for growth,SEOUL :Samsung Electronics said on Wednesday it is looking to drive growth as it faced tough questions from shareholders after its failure to ride an artificial intelligence boom made it one of the worst-performing tech stocks last year.The South Korean firm … SEOUL :Samsung Electronics said on Wednesday it is looking to drive growth as it faced tough questions from shareholders after its failure to ride an artificial intelligence boom made it one of the w… [+2241 chars],CNA,,https://www.channelnewsasia.com/business/samsung-ceo-says-company-will-pursue-deals-it-struggles-growth-5009556,2025-03-19T00:47:08Z,Apple earnings,2025-03-20 10:31:58.661527
NewsAPI,AAPL,Apple,Taiwan tech giant Foxconn's 2024 profit misses forecasts,"Taiwanese tech giant Foxconn reported on Friday a lower-than-expected net profit for 2024 as consumer electronic gadgets underperformed, although demand for its artificial intelligence servers remained robust. The world's largest contract electronics manufact… Taiwanese tech giant Foxconn reported on Friday a lower-than-expected net profit for 2024 as consumer electronic gadgets underperformed, although demand for its artificial intelligence servers remain… [+3229 chars]",Japan Today,,https://japantoday.com/category/tech/taiwan-tech-giant-foxconn%27s-2024-profit-misses-forecasts1,2025-03-14T21:34:24Z,Apple earnings,2025-03-20 10:31:58.661527
NewsAPI,AAPL,Apple,Flau’Jae Johnson Drops Bars and Buckets in Powerade’s March Madness Ad,"Powerade is the official drink of the National Collegiate Athletic Association (NCAA), and ahead of March Madness, the brand wants to land a slam dunk as the fans' bottle of choice. The Coca-Cola-owned label has rolled out ""It Takes More to Get This Far,"" a t… Powerade is the official drink of the National Collegiate Athletic Association (NCAA), and ahead of March Madness, the brand wants to land a slam dunk as the fans bottle of choice. The Coca-Cola-own… [+3510 chars]",Adweek,Cydney Lee,https://www.adweek.com/brand-marketing/flaujae-johnson-drops-bars-and-buckets-in-powerades-march-madness-ad/,2025-03-14T17:25:08Z,Apple earnings,2025-03-20 10:31:58.661527
NewsAPI,AAPL,Apple,Activist Groups Challenge UK Demand for Apple Encryption Backdoor,"Two human rights groups have filed a legal complaint with the UK's Investigatory Powers Tribunal (IPT) in an attempt to quash the UK government's demand for Apple to allow backdoor access to its encrypted data (via Financial Times). Earlier this year, th… Two human rights groups have filed a legal complaint with the UK's Investigatory Powers Tribunal (IPT) in an attempt to quash the UK government's demand for Apple to allow backdoor access to its encr… [+2890 chars]",MacRumors,Tim Hardwick,https://www.macrumors.com/2025/03/14/activist-groups-challenge-uk-apple-backdoor/,2025-03-14T11:38:22Z,Apple financial,2025-03-20 10:31:59.837638
NewsAPI,AAPL,Apple,UK Regulator Blames Apple for Stifling Mobile Browser Competition,"The UK's Competition and Markets Authority (CMA) has issued its final verdict on the state of the country's mobile browser market, concluding that Apple's policies are largely responsible for hampering competition and innovation. The CMA's independent in… The UK's Competition and Markets Authority (CMA) has issued its final verdict on the state of the country's mobile browser market, concluding that Apple's policies are largely responsible for hamperi… [+2782 chars]",MacRumors,Tim Hardwick,https://www.macrumors.com/2025/03/13/uk-watchdog-apple-poor-competition-mobile-browsers/,2025-03-13T10:56:15Z,Apple financial,2025-03-20 10:31:59.837638
NewsAPI,AAPL,Apple,iPhone 17 Air might lead the way for port-less Apple smartphones,"Apple was reportedly planning a truly portless iPhone 17 Air. Those plans were ditched, but if the upcoming phone succeeds, Apple might go back to the idea. The iPhone 17 Air is going to be the next big smartphone experiment at Apple. With a rumored thickness of just 5.5 millimeters and a high-density battery, it’s going to be the showcase of multiple in… [+2562 chars]",Digital Trends,Nadeem Sarwar,https://www.digitaltrends.com/mobile/apple-iphone-17-air-portless-idea-report/,2025-03-16T12:54:03Z,Apple financial,2025-03-20 10:31:59.837638
NewsAPI,AAPL,Apple,Secret court hearing on iCloud encryption underway amid demands to make it public,"A secret court hearing on iCloud encryption began on Friday, amid calls in both the UK and US to make the proceedings public. The British government is demanding that Apple create backdoor access, not just for the personal data of British citizens, but for… A secret court hearing on iCloud encryption began on Friday, amid calls in both the UK and US to make the proceedings public. The British government is demanding that Apple create backdoor access, n… [+3696 chars]",9to5Mac,Ben Lovejoy,https://9to5mac.com/2025/03/17/secret-court-hearing-on-icloud-encryption-underway-amid-demands-to-make-it-public/,2025-03-17T11:19:01Z,Apple financial,2025-03-20 10:31:59.838783
NewsAPI,AAPL,Apple,John Gruber Says 'Something is Rotten' at Apple,"Daring Fireball's John Gruber today shared some strongly-worded comments about Apple's delayed personalized Siri features. In a blog post titled ""Something Is Rotten in the State of Cupertino,"" Gruber said Apple's credibility has been ""damaged"" by the de… Daring Fireball's John Gruber today shared some strongly-worded comments about Apple's delayed personalized Siri features. Gruber is a well-known Apple pundit who has been writing about the company f… [+3089 chars]",MacRumors,Joe Rossignol,https://www.macrumors.com/2025/03/12/gruber-says-something-is-rotten-at-apple/,2025-03-13T02:39:31Z,Apple financial,2025-03-20 10:31:59.838783
NewsAPI,AAPL,Apple,Ctrl-Alt-Speech: The TAKE IT DOWN Takedown,"Ctrl-Alt-Speech is a weekly podcast about the latest news in online speech, from Mike Masnick and Everything in Moderation‘s Ben Whitelaw. Subscribe now on Apple Podcasts, Overcast, Spotify, Pocket Casts, YouTube, or your podcast app of choice — or go straigh… from the ctrl-alt-speech dept Ctrl-Alt-Speech is a weekly podcast about the latest news in online speech, from Mike Masnick and Everything in Moderation‘s Ben Whitelaw. Subscribe now on Apple Podc… [+1081 chars]",Techdirt,Mike Masnick,https://www.techdirt.com/2025/03/13/ctrl-alt-speech-the-take-it-down-takedown/,2025-03-13T22:30:08Z,Apple financial,2025-03-20 10:31:59.838783
NewsAPI,AAPL,Apple,JPMorgan Chase To Crack Down On Zelle Social Media Scams,"JPMorgan Chase's new Zelle policy aims to block social media scams. Here's everything you should know. If you're a JPMorgan Chase customer and you use Zelle to transfer funds, there's a big policy change coming your way. In one week, beginning March 23, 2025, Chase will enforce a restriction on Zelle … [+2055 chars]",CNET,Emma Woodward,https://www.cnet.com/personal-finance/banking/the-one-zelle-charge-that-chase-will-be-cracking-down-on/,2025-03-16T07:00:00Z,Apple financial,2025-03-20 10:31:59.838783
NewsAPI,AAPL,Apple,MiB: Stephanie Kelton on US Fiscal Policy and the ‘Deficit Myth’,"This week, I speak with Stephanie Kelton, Professor of Economics and Public Policy at Stony Brook University and Senior Fellow at the Schwartz Center for Economic Policy Analysis. We discuss US fiscal policy, recession risks, and her New York Times bestseller… This week, I speak with Stephanie Kelton, Professor of Economics and Public Policy at Stony Brook University and Senior Fellow at the Schwartz Center for Economic Policy Analysis. We discuss US fisca… [+1741 chars]",Ritholtz.com,Barry Ritholtz,https://ritholtz.com/2025/03/mib-stephanie-kelton/,2025-03-14T18:00:34Z,Apple financial,2025-03-20 10:31:59.838783
NewsAPI,AAPL,Apple,How Lanco Medical Group Fosters Workforce Happiness to Motivate Employees and Grow Fast,"A case study on balancing incentives and fairness amid international expansion. BRIAN KENNY: The saying, “Find a job you love and you’ll never work a day in your life,” was probably coined by somebody who was really happy at work. According to Pew Research, the number of people … [+25841 chars]",Harvard Business Review,,https://hbr.org/podcast/2025/03/how-lanco-medical-group-fosters-workforce-happiness-to-motivate-employees-and-grow-fast,2025-03-18T13:21:00Z,Apple financial,2025-03-20 10:31:59.839805
NewsAPI,AAPL,Apple,Apple Supplier’s Chairman Leads New List Of China’s Top Businesswomen,"Luxshare Precision's Wang Laichun has topped the annual ranking since 2022. Luxshare Chairman Wang Laichun, also known as Grace Wang, topped Forbes China's latest ranking of ... [+] the country's top businesswomen. Forbes China Forbes China, the licensed Chinese-language e… [+2490 chars]",Forbes,"Russell Flannery, Senior Contributor, 
 Russell Flannery, Senior Contributor
 https://www.forbes.com/sites/russellflannery/",https://www.forbes.com/sites/forbeschina/2025/03/16/apple-suppliers-chairman-leads-new-list-of-chinas-top-businesswomen/,2025-03-16T17:19:19Z,Apple financial,2025-03-20 10:31:59.839805
NewsAPI,AAPL,Apple,"⚡ THN Weekly Recap: Router Hacks, PyPI Attacks, New Ransomware Decryptor, and More","From sophisticated nation-state campaigns to stealthy malware lurking in unexpected places, this week’s cybersecurity landscape is a reminder that attackers are always evolving. Advanced threat groups are exploiting outdated hardware, abusing legitimate tools… From sophisticated nation-state campaigns to stealthy malware lurking in unexpected places, this week's cybersecurity landscape is a reminder that attackers are always evolving. Advanced threat group… [+25145 chars]",Internet,info@thehackernews.com (The Hacker News),https://thehackernews.com/2025/03/thn-weekly-recap-router-hacks-pypi.html,2025-03-17T11:25:00Z,Apple financial,2025-03-20 10:31:59.839805
NewsAPI,AAPL,Apple,Today in Apple history: Power Mac 7100 lands Apple in hot water with Carl Sagan,"On March 14, 1994, Apple introduced the Power Macintosh 7100, a midrange Mac that landed the company in court against astronomer Carl Sagan. (via Cult of Mac - Apple news, rumors, reviews and how-tos) March 14, 1994: Apple introduces the Power Macintosh 7100, a midrange Mac that will become memorable for two reasons. The first is that it is among the first Macs to use new PowerPC processors. The … [+3654 chars]",Cult of Mac,Luke Dormehl,https://www.cultofmac.com/apple-history/power-mac-7100-carl-sagan,2025-03-14T12:55:21Z,Apple financial,2025-03-20 10:31:59.839805
NewsAPI,AAPL,Apple,Dr. Oz Won’t Commit To Protecting Medicaid,"During his confirmation hearing, the celebrity doctor dodged questions about his plans for public services that provide healthcare to millions The Department of Health and Human Services is already headed by a vaccine skeptic, and the Trump administration would like to install a TV doctor to run the nation’s most vital health care systems. … [+3542 chars]",Rolling Stone,Nikkimccannramirez,http://www.rollingstone.com/politics/politics-news/dr-oz-protecting-medicaid-senate-hearing-1235296719/,2025-03-14T18:54:16Z,Apple financial,2025-03-20 10:31:59.839805
NewsAPI,AAPL,Apple,Commodore Invented the Mass Market Computer,"The untold story of Jack Tramiel, Holocaust survivor and home computing's first king I have vivid memories of my family's first computer: a blocky Commodore 64 parked in a corner of our basement, its cursor blinking on a royal blue screen. It was just one of the more than 12 million … [+68213 chars]",Every.to,Gareth Edwards,https://every.to/the-crazy-ones/the-first-king-of-home-computing,2025-03-17T19:31:22Z,Apple financial,2025-03-20 10:31:59.839805
NewsAPI,AAPL,Apple,"Trump’s new attack on the climate, briefly explained","This story appeared in The Logoff, a daily newsletter that helps you stay informed about the Trump administration without letting political news take over your life. Subscribe here. Welcome to the Logoff: Today I’m focusing on the Trump administration’s effor… A coal-fired power plant in West Virginia. | Visions of America/Joseph Sohm/Universal Images Group via Getty Images This story appeared in The Logoff, a daily newsletter that helps you stay inform… [+2777 chars]",Vox,Patrick Reis,https://www.vox.com/the-logoff-newsletter-trump/403928/trumps-new-attack-on-the-climate-briefly-explained,2025-03-13T21:52:25Z,Apple financial,2025-03-20 10:31:59.839805
