platform,stock_symbol,stock_name,title,full_text,source,author,url,published_at,search_query,collection_time
NewsAPI,MSFT,Microsoft,"Medusa ransomware targets Gmail and Outlook users, warns CISA & FBI",Cybersecurity and Infrastructure Security Agency (CISA) and the Federal Bureau of Investigation (FBI) have issued an alert for Gmail and Microsoft Outlook users from a new and very sophisticated ransomware known as Medusa. The ransomware-as-a-service has been… Cybersecurity and Infrastructure Security Agency (CISA) and the Federal Bureau of Investigation (FBI) have issued an alert for Gmail and Microsoft Outlook users from a new and very sophisticated rans… [+2301 chars],MSPoweruser,Claudiu Andone,https://mspoweruser.com/medusa-ransomware-targets-gmail-and-outlook-users-warns-cisa-fbi/,2025-03-17T13:11:03Z,Microsoft financial,2025-03-20 10:32:09.698835
NewsAPI,MSFT,Microsoft,‘ClickFix’ Phishing Scam Impersonates Booking.com to Target Hospitality,"Microsoft said the ongoing phishing campaign is designed to infect hospitality firms with multiple credential-stealing malware A sophisticated ‘ClickFix’ phishing campaign is impersonating Booking.com to target hospitality firms with multiple infostealing malware, enabling financial fraud and theft. The ongoing campaign, wh… [+3106 chars]",Infosecurity Magazine,James Coker,https://www.infosecurity-magazine.com/news/clickfix-phishing-scam-booking/,2025-03-13T15:00:00Z,Microsoft financial,2025-03-20 10:32:09.698835
NewsAPI,MSFT,Microsoft,An unpatched Windows zero-day flaw has been exploited by 11 nation-state attackers,"North Korea, Russia, China, and others are abusing an ancient flaw in .LNK files to attack Windows. <ul><li>Trend Micro warns of an old Windows zero-day still in use today</li><li>Many nation-states are abusing the bug to run espionage campaigns</li><li>Microsoft doesn't deem it critical</li></ul> … [+2493 chars]",TechRadar,Sead Fadilpašić,https://www.techradar.com/pro/security/an-unpatched-windows-zero-day-threat-has-been-exploited-by-11-nation-state-attackers,2025-03-19T14:02:00Z,Microsoft financial,2025-03-20 10:32:09.698835
NewsAPI,MSFT,Microsoft,Future-Proofing Business Continuity: BCDR Trends and Challenges for 2025,"As IT environments grow more complex, IT professionals are facing unprecedented pressure to secure business-critical data. With hybrid work the new standard and cloud adoption on the rise, data is increasingly distributed across different environments, provid… As IT environments grow more complex, IT professionals are facing unprecedented pressure to secure business-critical data. With hybrid work the new standard and cloud adoption on the rise, data is in… [+10892 chars]",Internet,info@thehackernews.com (The Hacker News),https://thehackernews.com/2025/03/bcdr-2025-trends-and-challenges-for-msps-and-it-teams.html,2025-03-13T11:00:00Z,Microsoft financial,2025-03-20 10:32:09.698835
NewsAPI,MSFT,Microsoft,Archival Storage,I gave a talk at the Berkeley I-school's Information Access Seminar entitled Archival Storage . Below the fold is the text of the talk with... I gave a talk at the Berkeley I-school's Information Access Seminar entitled Archival Storage. Below the fold is the text of the talk with links to the sources and the slides (with yellow background)… [+27347 chars],Dshr.org,David.,https://blog.dshr.org/2025/03/archival-storage.html,2025-03-17T18:36:21Z,Microsoft financial,2025-03-20 10:32:09.698835
NewsAPI,MSFT,Microsoft,"Phishing campaign impersonates Booking .com, delivers a suite of credential-stealing malware","Starting in December 2024, leading up to some of the busiest travel days, Microsoft Threat Intelligence identified a phishing campaign that impersonates online travel agency Booking.com and targets organizations in the hospitality industry. The campaign uses … Starting in December 2024, leading up to some of the busiest travel days, Microsoft Threat Intelligence identified a phishing campaign that impersonates online travel agency Booking.com and targets o… [+16540 chars]",Microsoft.com,Microsoft Threat Intelligence and Microsoft Security Experts,https://www.microsoft.com/en-us/security/blog/2025/03/13/phishing-campaign-impersonates-booking-com-delivers-a-suite-of-credential-stealing-malware/,2025-03-13T15:00:00Z,Microsoft financial,2025-03-20 10:32:09.698835
NewsAPI,MSFT,Microsoft,Booking.com CAPTCHA Attack Impacts Customers—But Systems Not Breached,"Booking.com accommodation partners and customers impacted by fake CAPTCHA attack, but systems not breached, a spokesperson has said. Booking.com confirms phsihing attack against customers. AFP via Getty Images An infostealer malware campaign has been identified by Microsoft Threat Intelligence that targets victims with fake CAPT… [+3753 chars]",Forbes,"Davey Winder, Senior Contributor, 
 Davey Winder, Senior Contributor
 https://www.forbes.com/sites/daveywinder/",https://www.forbes.com/sites/daveywinder/2025/03/14/bookingcom-captcha-attack-impacts-customers-but-systems-not-breached/,2025-03-14T13:47:57Z,Microsoft financial,2025-03-20 10:32:09.698835
NewsAPI,MSFT,Microsoft,Chatbots are replacing therapists faster than anyone expected,"While we're not short of divisive topics in 2025, there are valid reasons as to why we're turning to chatbots for emotional support – and why people are also very much against it. So how willing are you to embrace this new form of therapy?Continue ReadingCate… While we're not short of divisive topics in 2025, there are valid reasons as to why we're turning to chatbots for emotional support and why people are also very much against it. So how willing are yo… [+10276 chars]",New Atlas,Bronwyn Thompson,https://newatlas.com/ai-humanoids/chatbot-therapist/,2025-03-16T10:03:00Z,Microsoft financial,2025-03-20 10:32:09.698835
NewsAPI,MSFT,Microsoft,10 High-Income Skills That Pay Six Figures In Any Economy,"Master these 10 high-income skills to earn $100K+ per year. From AI to sales, these in-demand skills offer financial security regardless of economic cycles. High-income skills are valuable during periods of economic uncertainty. getty The difference between earning $60,000 and $260,000 annually no longer hinges on your job title or years of experience.… [+7692 chars]",Forbes,"Caroline Castrillon, Senior Contributor, 
 Caroline Castrillon, Senior Contributor
 https://www.forbes.com/sites/carolinecastrillon/",https://www.forbes.com/sites/carolinecastrillon/2025/03/17/10-high-income-skills-that-pay-six-figures-in-any-economy/,2025-03-17T19:09:30Z,Microsoft financial,2025-03-20 10:32:09.698835
NewsAPI,MSFT,Microsoft,Business Tech News: The Best Cheap Windows Laptops For Your Small Business,"Also: cheap Excel and Office training available, an AI startup challenges Intuit and Xero and reasons why Manus is over-hyped. A Lenovo IdeaPad laptop PC (Photo by Kevin Nixon/What Laptop Magazine via Getty Images) Future via Getty Images Here are five things in business tech news that happened this week and how they affec… [+6461 chars]",Forbes,"Gene Marks, Contributor, 
 Gene Marks, Contributor
 https://www.forbes.com/sites/quickerbettertech/",https://www.forbes.com/sites/quickerbettertech/2025/03/16/business-tech-news-the-best-cheap-windows-laptops-for-your-small-business/,2025-03-16T11:00:00Z,Microsoft financial,2025-03-20 10:32:09.698835
NewsAPI,MSFT,Microsoft,Elon Musk and OpenAI to fast-track trial to December — Musk looks to stop OpenAI's change to a for-profit company,"OpenAI and Elon Musk are set for a December trial over OpenAI's shift to a for-profit model, but they disagree whether the case will be resolved by a judge or jury. OpenAI and Elon Musk have agreed to accelerate their legal dispute regarding OpenAI's transition to a for-profit model, according to Reuters. The trial is set for December. A recent court decision de… [+2227 chars]",Tom's Hardware UK,ashilov@gmail.com (Anton Shilov),https://www.tomshardware.com/tech-industry/elon-musk-and-openai-to-fast-track-trial-to-december-musk-looks-to-stop-openais-change-to-a-for-profit-company,2025-03-16T13:36:12Z,Microsoft financial,2025-03-20 10:32:09.698835
NewsAPI,NVDA,Nvidia,Nvidia's stock slips ahead of Jensen Huang's GTC keynote,Nvidia’s (NVDA) stock was down by 1.76% at the market close on Monday ahead of chief executive Jensen Huang’s keynote at the GPU Technology Conference.Read more... In This Story Nvidias (NVDA-1.27% ) stock was down by 1.76% at the market close on Monday ahead of chief executive Jensen Huangs keynote at the GPU Technology Conference. The chipmakers shares clo… [+1977 chars],Quartz India,Britney Nguyen,https://qz.com/nvidia-stock-fall-gtc-blackwell-rubin-quantum-ai-chips-1851770522,2025-03-17T20:36:00Z,NVDA stock,2025-03-20 10:32:10.858171
NewsAPI,NVDA,Nvidia,Live updates: Nvidia CEO Jensen Huang addresses the GTC conference,"All eyes will be on Nvidia (NVDA) chief executive Jensen Huang today as he shares more about the chipmaker’s next artificial intelligence chips.Read more... In This Story All eyes will be on Nvidia (NVDA-1.84% ) chief executive Jensen Huang today as he shares more about the chipmakers next artificial intelligence chips. In February, Huang said he woul… [+1867 chars]",Quartz India,Britney Nguyen,https://qz.com/nvidia-jensen-huang-gtc-ai-chips-blackwell-rubin-robots-1851770757,2025-03-18T17:02:00Z,NVDA stock,2025-03-20 10:32:10.859196
NewsAPI,NVDA,Nvidia,Intel rockets 8% on talk of new CEO's AI chip strategy,"Intel’s (INTC) next chief executive isn’t formally due for work until Tuesday, but there’s already talk of an artificial intelligence-strategy revamp under Lip-Bu Tan.Read more... In This Story Intels (INTC+8.17% ) next chief executive isnt formally due for work until Tuesday, but theres already talk of an artificial intelligence-strategy revamp under Lip-Bu Tan. Investors … [+1125 chars]",Quartz India,Harri Weber,https://qz.com/intel-stock-new-ceo-ai-strategy-layoffs-1851770442,2025-03-17T17:30:00Z,NVDA stock,2025-03-20 10:32:10.859196
NewsAPI,NVDA,Nvidia,"Nvidia, Tesla, BYD, General Mills: Stocks to watch today","Stocks may be little changed on Wednesday ahead of the Federal Reserve’s interest rate announcement at 2 p.m., which will be followed by Fed Chair Jerome Powell’s news conference at 2:30 p.m. Futures tied to the S&P 500, Nasdaq 100 and Dow Jones indexes rose … In This Story Stocks may be little changed on Wednesday ahead of the Federal Reserves interest rate announcement at 2 p.m., which will be followed by Fed Chair Jerome Powells news conference at 2:30… [+1919 chars]",Quartz India,Josh Fellman,https://qz.com/nvidia-tesla-byd-general-mills-stocks-to-watch-toda-1851770848,2025-03-19T11:31:00Z,NVDA stock,2025-03-20 10:32:10.859196
NewsAPI,NVDA,Nvidia,"Nvidia, Berkshire Hathaway, Baidu, Lockheed Martin, Incyte: Stocks to watch today","Stocks may not extend Friday’s rebound. Futures tied to the S&P 500, the Nasdaq 100, and the Dow Jones Industrial Average were pointing to a lower open Monday after Treasury Secretary Scott Bessent said Sunday on NBC’s “Meet the Press” that he he was “not at … In This Story Stocks may not extend Fridays rebound. Futures tied to the S&amp;P 500, the Nasdaq 100, and the Dow Jones Industrial Average were pointing to a lower open Monday after Treasury Secreta… [+2951 chars]",Quartz India,Josh Fellman,https://qz.com/nvidia-berkshire-hathaway-baidu-lockheed-martin-stocks-1851770313,2025-03-17T12:17:00Z,NVDA stock,2025-03-20 10:32:10.859196
NewsAPI,NVDA,Nvidia,Nvidia GTC: Here's what Wall Street is saying about Jensen Huang's performance,"In This Article: Did Nvidia (NVDA) do enough to reawaken the bull narrative on the chipmaker's stock at its annual developer event? Wall Street is weighing in on that. First, consider the optics: CEO Jensen Huang wore his trademark black leather motorcycle ja… In This Article:Did Nvidia (NVDA) do enough to reawaken the bull narrative on the chipmaker's stock at its annual developer event? Wall Street is weighing in on that.First, consider the optics: CEO J… [+145 chars]",Biztoc.com,finance.yahoo.com,https://biztoc.com/x/ed8688c12c1c6a01,2025-03-19T10:53:23Z,NVDA stock,2025-03-20 10:32:10.859196
NewsAPI,NVDA,Nvidia,Is NVIDIA (NVDA) the Best Reddit Stock to Invest In?,"If you click 'Accept all', we and our partners, including 238 who are part of the IAB Transparency &amp; Consent Framework, will also store and/or access information on a device (in other words, use … [+702 chars]",Yahoo Entertainment,,https://consent.yahoo.com/v2/collectConsent?sessionId=1_cc-session_139156f3-66a4-44d7-a9e2-9bfeb00db89a,2025-03-18T11:15:18Z,NVDA stock,2025-03-20 10:32:10.859196
NewsAPI,NVDA,Nvidia,"Nvidia, Ulta, DocuSign, CK Hutchison: Stocks to watch today","Stocks rose premarket — after entering a correction yesterday — as Senate MinorityLeader Chuck Schumer opted not to block an emergency funding bill last night. That made it likely that the U.S. government won’t shut down this Saturday, easing some of the unce… In This Story Stocks rose premarket after entering a correction yesterday as Senate Minority Leader Chuck Schumer opted not to block an emergency funding bill last night. That made it likely that th… [+1909 chars]",Quartz India,Josh Fellman,https://qz.com/nvidia-ulta-docusign-ck-hutchison-li-auto-stock-watch-1851769942,2025-03-14T12:58:00Z,NVDA stock,2025-03-20 10:32:10.859196
NewsAPI,NVDA,Nvidia,"Stock market today: Dow, S&P 500, Nasdaq futures slip after tough week as Bessent dismisses sell-off","US stock futures fell after a choppy week for the major gauges. The Federal Reserve is in high focus, though the bank is expected to hold rates steady. US stock futures faltered on Monday as comments from Treasury Secretary Scott Bessent added to investor worries ahead of this week's Federal Reserve policy meeting. S&amp;P 500 futures (ES=F) droppe… [+1936 chars]",Yahoo Entertainment,Rian Howlett,https://finance.yahoo.com/news/live/stock-market-today-dow-sp-500-nasdaq-futures-slip-after-tough-week-as-bessent-dismisses-sell-off-233621781.html,2025-03-16T23:36:21Z,NVDA stock,2025-03-20 10:32:10.859196
NewsAPI,NVDA,Nvidia,Is NVIDIA Corporation (NVDA) the Best Growth Stock to Invest in for the Next 10 Years?,"If you click 'Accept all', we and our partners, including 238 who are part of the IAB Transparency &amp; Consent Framework, will also store and/or access information on a device (in other words, use … [+702 chars]",Yahoo Entertainment,,https://consent.yahoo.com/v2/collectConsent?sessionId=1_cc-session_01ec1f7d-1563-4916-bdb4-195acde7cd48,2025-03-16T17:09:52Z,NVDA stock,2025-03-20 10:32:10.859196
NewsAPI,NVDA,Nvidia,"A Stock to Own, Not to Trade – Jim Cramer on Nvidia Corp. (NVDA)’s AI Power","If you click 'Accept all', we and our partners, including 238 who are part of the IAB Transparency &amp; Consent Framework, will also store and/or access information on a device (in other words, use … [+702 chars]",Yahoo Entertainment,,https://consent.yahoo.com/v2/collectConsent?sessionId=1_cc-session_ee9d835e-8856-4e0a-ac87-ced841f07111,2025-03-14T14:23:28Z,NVDA stock,2025-03-20 10:32:10.859196
NewsAPI,NVDA,Nvidia,NVIDIA Corporation (NVDA): Among Top Stock Picks From Ken Fisher’s Portfolio,"If you click 'Accept all', we and our partners, including 238 who are part of the IAB Transparency &amp; Consent Framework, will also store and/or access information on a device (in other words, use … [+702 chars]",Yahoo Entertainment,,https://consent.yahoo.com/v2/collectConsent?sessionId=1_cc-session_c348510b-ccd3-448d-9a65-e4439f38b446,2025-03-17T02:21:45Z,NVDA stock,2025-03-20 10:32:10.859196
NewsAPI,NVDA,Nvidia,Nvidia's GTC conference could be a 'wake-up moment' for investors as the AI trade falters,Nvidia CEO Jensen Huang is set to kick off the AI chipmaker’s annual GTC conference in California on Tuesday with a keynote previewing what’s ahead for the... Nvidia (NVDA) stock slid about 3% Tuesday morning ahead of the AI chipmakers annual GTC conference in California on Tuesday. CEO Jensen Huang was expected to kick off a keynote previewing whats ahea… [+3696 chars],Yahoo Entertainment,Laura Bratton,https://finance.yahoo.com/news/nvidias-gtc-conference-could-be-a-wake-up-moment-for-investors-as-the-ai-trade-falters-134709308.html,2025-03-18T13:47:09Z,NVDA stock,2025-03-20 10:32:10.859196
NewsAPI,NVDA,Nvidia,Hca Healthcare (HCA): Among Michael Burry’s Top Holdings,"We recently published a list of Michael Burry’s Top Holdings Were Gaining While NVDA Was Crashing. In this article, we are going to take a look at where Hca ... We recently published a list of Michael Burrys Top Holdings Were Gaining While NVDA Was Crashing. In this article, we are going to take a look at where Hca Healthcare, Inc. (NYSE:HCA) stands against … [+5905 chars]",Yahoo Entertainment,Jelena Martinovic,https://finance.yahoo.com/news/hca-healthcare-hca-among-michael-134454588.html,2025-03-18T13:44:54Z,NVDA stock,2025-03-20 10:32:10.859196
NewsAPI,NVDA,Nvidia,"Stock market today: Dow, S&P 500, Nasdaq futures tumble after another week of sharp losses","US stock futures fell after a choppy week for the major gauges. The Federal Reserve is in high focus, though the bank is expected to hold rates steady. US stock futures fell Sunday night, as March's struggles looked set to continue after Wall Street's latest week of big losses. S&amp;P 500 futures (ES=F) dropped 0.5%, while Dow Jones Industrial Ave… [+1591 chars]",Yahoo Entertainment,Rian Howlett,https://finance.yahoo.com/news/live/stock-market-today-dow-sp-500-nasdaq-futures-tumble-after-another-week-of-sharp-losses-233621800.html,2025-03-16T23:36:21Z,NVDA stock,2025-03-20 10:32:10.859196
NewsAPI,NVDA,Nvidia,Nvidia (NVDA) Analyst Calls It ‘The Accelerated Computing Leader’ with Healthcare Potential,"We recently published a list of 12 AI Stocks Poised for Massive Growth. In this article, we are going to take a look at where NVIDIA Corporation (NASDAQ:NVDA... We recently published a list of 12 AI Stocks Poised for Massive Growth. In this article, we are going to take a look at where NVIDIA Corporation (NASDAQ:NVDA) stands against other AI stocks poised fo… [+4365 chars]",Yahoo Entertainment,Ghazal Ahmed,https://finance.yahoo.com/news/nvidia-nvda-analyst-calls-accelerated-202530609.html,2025-03-15T20:25:30Z,NVDA stock,2025-03-20 10:32:10.859196
NewsAPI,NVDA,Nvidia,Will Nvidia Stock Get Lift From AI Conference?,"Wall Street analysts are hoping that Nvidia's upcoming GTC conference will provide a boost for Nvidia stock. The last time Nvidia (NVDA) Chief Executive Jensen Huang gave a major speech his company's stock was trading in record high territory. Ahead of his next big speech on Tuesday, Nvidia stock is in a sl… [+3168 chars]",Investor's Business Daily,"PATRICK SEITZ, Investor's Business Daily",https://www.investors.com/news/technology/nvidia-stock-gtc-ai-conference-could-provide-lift/,2025-03-14T15:46:30Z,NVDA stock,2025-03-20 10:32:10.860213
NewsAPI,NVDA,Nvidia,"Stock market today: Dow, S&P 500, Nasdaq slip with latest tariff threats, inflation data in focus","The risk of government shutdown adds more worry for markets already grappling with Trump's tariff onslaught. US stocks were set for a pullback on Thursday as economic concerns grew amid President Trump's trade offensive and a looming US government shutdown, while a new inflation report provided fresh eviden… [+4231 chars]",Yahoo Entertainment,Amalya Dubrovsky,https://finance.yahoo.com/news/live/stock-market-today-dow-sp-500-nasdaq-slip-with-latest-tariff-threats-inflation-data-in-focus-133017946.html,2025-03-13T13:30:17Z,NVDA stock,2025-03-20 10:32:10.860213
NewsAPI,NVDA,Nvidia,"Stock market today: Dow, S&P 500, Nasdaq fall with latest tariff threats, inflation data in focus","The risk of government shutdown adds more worry for markets already grappling with Trump's tariff onslaught. US stocks fell on Thursday as economic concerns grew and investors digested the latest inflation data, President Trump's trade offensive, and a looming US government shutdown. The S&amp;P 500 (^GSPC… [+8258 chars]",Yahoo Entertainment,Amalya Dubrovsky,https://finance.yahoo.com/news/live/stock-market-today-dow-sp-500-nasdaq-fall-with-latest-tariff-threats-inflation-data-in-focus-133017223.html,2025-03-13T13:30:17Z,NVDA stock,2025-03-20 10:32:10.860213
NewsAPI,NVDA,Nvidia,This 15.6% Dividend Is A Smart ‘Buy The Dip’ Play,"There are two things I need to bring to your attention right now, especially if you’re an income investor (Hint: 1 is a monster dividend yield!) Buy on the dip getty There are two things I need to bring to your attention right now, especially if youre an income investor. One is my outlook for the market, as volatility really hits home. The… [+5954 chars]",Forbes,"Michael Foster, Contributor, 
 Michael Foster, Contributor
 https://www.forbes.com/sites/michaelfoster/",https://www.forbes.com/sites/michaelfoster/2025/03/15/this-156-dividend-is-a-smart-buy-the-dip-play/,2025-03-15T14:02:00Z,NVDA stock,2025-03-20 10:32:10.860213
NewsAPI,NVDA,Nvidia,Broadcom (AVGO) Poised for AI Growth as Analysts Call Recent Dip a Buying Opportunity,"We recently published a list of 12 AI Stocks on Wall Street’s Radar Today. In this article, we are going to take a look at where Broadcom Inc. (NASDAQ:AVGO) ... We recently published a list of 12 AI Stocks on Wall Streets Radar Today. In this article, we are going to take a look at where Broadcom Inc. (NASDAQ:AVGO) stands against other AI stocks that are on … [+4412 chars]",Yahoo Entertainment,Ghazal Ahmed,https://finance.yahoo.com/news/broadcom-avgo-poised-ai-growth-161722333.html,2025-03-16T16:17:22Z,NVDA stock,2025-03-20 10:32:10.860213
NewsAPI,NVDA,Nvidia,Nvidia stock rises ahead of 2025 GTC,"If you click 'Accept all', we and our partners, including 238 who are part of the IAB Transparency &amp; Consent Framework, will also store and/or access information on a device (in other words, use … [+702 chars]",Yahoo Entertainment,,https://consent.yahoo.com/v2/collectConsent?sessionId=1_cc-session_c0ab8cf3-211c-4dcf-ae08-656b062eebd1,2025-03-14T20:17:57Z,Nvidia stock,2025-03-20 10:32:12.047950
NewsAPI,NVDA,Nvidia,Nvidia debuts Llama Nemotron open reasoning models in a bid to advance agentic AI,"At GTC, Nvidia is rolling out an open source reasoning model family to help advance agentic AI for enterprise deployments. Join our daily and weekly newsletters for the latest updates and exclusive content on industry-leading AI coverage. Learn More Nvidia is getting into the open source reasoning model market. At the … [+5241 chars]",VentureBeat,Sean Michael Kerner,https://venturebeat.com/ai/nvidia-debuts-llama-nemotron-open-reasoning-models-in-a-bid-to-advance-agentic-ai/,2025-03-18T19:42:36Z,Nvidia stock,2025-03-20 10:32:12.047950
NewsAPI,NVDA,Nvidia,"Nvidia’s GTC 2025 keynote: 40x AI performance leap, open-source ‘Dynamo’, and a walking Star Wars-inspired ‘Blue’ robot","Nvidia CEO Jensen Huang unveils 40x faster Blackwell platform, Vera Rubin roadmap through 2027, open-source Dynamo software, humanoid robotics AI, and GM partnership at GTC 2025, positioning the company to counter DeepSeek's efficiency challenge. Join our daily and weekly newsletters for the latest updates and exclusive content on industry-leading AI coverage. Learn More SAN JOSE, Calif. Nvidia CEO Jensen Huang took to the stage at the SAP C… [+11887 chars]",VentureBeat,Michael Nuñez,https://venturebeat.com/ai/nvidias-gtc-2025-keynote-40x-ai-performance-leap-open-source-dynamo-and-a-walking-star-wars-inspired-blue-robot/,2025-03-19T03:56:25Z,Nvidia stock,2025-03-20 10:32:12.047950
NewsAPI,NVDA,Nvidia,Even AMD is surprised by how fast it’s gaining on Nvidia,"AMD's most recent GPU launch was widely successful, pushing the company to new heights in terms of market share in Japan. AMD’s RX 9000 series quickly joined the ranks of the best graphics cards, and it appears that its success came as a surprise to everyone — yes, even AMD itself. At a recent roundtable in Japan, the c… [+2124 chars]",Digital Trends,Monica J. White,https://www.digitaltrends.com/computing/amd-gpu-market-share-update/,2025-03-17T11:47:37Z,Nvidia stock,2025-03-20 10:32:12.047950
NewsAPI,NVDA,Nvidia,Rigetti Computing (NasdaqCM:RGTI) Soars 57% Following US$35M Private Placement Announcement,"Rigetti Computing (NasdaqCM:RGTI) announced a sharp 57% quarterly price surge despite financial challenges, including a marked decline in sales and a... Rigetti Computing announced a sharp 57% quarterly price surge despite financial challenges, including a marked decline in sales and a significant net loss across 2024. Key events include a strategic … [+3220 chars]",Yahoo Entertainment,editorial-team@simplywallst.com (Simply Wall St),https://finance.yahoo.com/news/rigetti-computing-nasdaqcm-rgti-soars-172901647.html,2025-03-15T17:29:01Z,Nvidia stock,2025-03-20 10:32:12.047950
NewsAPI,NVDA,Nvidia,NVIDIA's RTX Remix update is a dream for classic video game enthusiasts and it could be the best reason to invest in 50-Series hardware,"Some of my favorite old games look awful in 2025, but RTX Remix can change that. If you're a lifelong PC gamer, this might be the reason to buy an RTX 5000 GPU. NVIDIA is making its presence known at GDC 2025, kicking things off with some updates to its RTX Remix tech. While RTX Remix has been available in open beta form since January 2024, part of today's … [+5426 chars]",Windows Central,c.cale.hunt@gmail.com (Cale Hunt),https://www.windowscentral.com/hardware/cpu-gpu-components/nvidia-rtx-remix-full-release,2025-03-14T10:18:20Z,Nvidia stock,2025-03-20 10:32:12.049141
