platform,stock_symbol,stock_name,title,full_text,source,author,url,published_at,search_query,collection_time
NewsAPI,AMZN,Amazon,"D.A. Davidson & CO. Buys 15,914 Shares of Amazon.com, Inc. (NASDAQ:AMZN)","D.A. Davidson & CO. raised its position in Amazon.com, Inc. (NASDAQ:AMZN) by 2.4% in the 4th quarter, according to its most recent Form 13F filing with the Securities and Exchange Commission. The fund owned 667,557 shares of the e-commerce giant’s stock after… D.A. Davidson &amp; CO. raised its position in Amazon.com, Inc. (NASDAQ:AMZN) by 2.4% in the 4th quarter, according to its most recent Form 13F filing with the Securities and Exchange Commission. The… [+5917 chars]",ETF Daily News,MarketBeat News,https://www.etfdailynews.com/2025/03/18/d-a-davidson-co-buys-15914-shares-of-amazon-com-inc-nasdaqamzn/,2025-03-18T07:06:48Z,AMZN stock,2025-03-20 10:31:51.347702
NewsAPI,AMZN,Amazon,"Amazon Is Selling Off Its AirTag Stock, Not Quite Free, But Close","Save 29% on a 4-pack of Apple's ultra-accurate little trackers, or save 17% and get just one for $24. Losing important items can be a nightmare. Think about ityour wallet packed with credit cards and cash, your luggage when traveling, your keys, or even your car in a massive parking lot. (Come on, we… [+2849 chars]",Gizmodo.com,Mike Fazioli,https://gizmodo.com/amazon-is-selling-off-its-airtag-stock-not-quite-free-but-close-2000577889,2025-03-19T13:10:51Z,Amazon stock,2025-03-20 10:31:52.509589
NewsAPI,AMZN,Amazon,Don't call it a recession — but bad vibes are back in a big way,"Tariffs, stock market dips, and job cuts are driving a new vibecession. It's impacting retirees' 401(k)s, consumer spending, and job market outlooks. Getty Images; Jenny Chang-Rodriguez/BI <ul><li>Both employees and employers are worried about their finances under Trump 2.0.</li><li>Consumer sentiment has dropped sharply because of economic uncer… [+8091 chars]",Business Insider,Allie Kelly,https://www.businessinsider.com/tariffs-inflation-recession-fears-consumer-sentiment-doge-layoffs-economy-2025-3,2025-03-19T08:02:01Z,Amazon stock,2025-03-20 10:31:52.509589
NewsAPI,AMZN,Amazon,AMD Ryzen 7 9800X3D is back in stock for $479 and I desperately want one,"I don’t usually get this excited about a CPU, but the AMD Ryzen 7 9800X3D is something special. It has been impossible to find for weeks, and now it’s back for $479 at Amazon (and at Amazon UK). That’s the official launch price, which is great because I refus… I don’t usually get this excited about a CPU, but the AMD Ryzen 7 9800X3D is something special. It has been impossible to find for weeks, and now it’s back for $479 at Amazon (and at Amazon UK). That… [+2271 chars]",Rock Paper Shotgun,Christian Wait,https://www.rockpapershotgun.com/amd-ryzen-7-9800x3d-back-in-stock-amazon-2025,2025-03-18T18:30:00Z,Amazon stock,2025-03-20 10:31:52.509589
NewsAPI,AMZN,Amazon,Life after RTO: 11 Amazon employees reflect on the highs and lows of returning to the office full time,"Amazon's 5-day return-to-office mandate took effect earlier this year. Some workers applaud the RTO policy, while others say it's ruined their jobs. Demoralized, stressed out, and struggling to take care of family members. Energized, efficient, and connected to their coworkers. These are some of the feelings Amazon employees described in intervi… [+22263 chars]",Business Insider,Jane Zhang,https://www.businessinsider.com/amazon-5-day-rto-mandate-policy-employees-experiences-2025-3,2025-03-14T09:05:01Z,Amazon stock,2025-03-20 10:31:52.509589
NewsAPI,AMZN,Amazon,"On the anniversary of the dot-com bubble bursting, is history repeating itself?","In this Sunday edition of BI Today, we're talking about the current market's similarities to the dot-com bubble burst almost exactly 25 years ago. Buckner Hightower, left, and his son Chris Hightower examine the plunging stock market indices at the Nasdaq MarketSite, December 20, 2000 in New York City''s Times Square. The Nasdaq composite index… [+6355 chars]",Business Insider,Steve Russolillo,https://www.businessinsider.com/bi-today-dot-com-bubble-bursting-anniversary-history-repeating-2025-3,2025-03-16T10:40:01Z,Amazon stock,2025-03-20 10:31:52.509589
NewsAPI,AMZN,Amazon,Lowest Price Ever! Amazon Fire TV 55” 4K Now $319.97 (Save $200!),"Amazon Fire TV 55-inch deal! Save $200 (38% off) on this 4K smart TV with Alexa voice control—limited stock, grab yours now! The post Lowest Price Ever! Amazon Fire TV 55” 4K Now $319.97 (Save $200!) appeared first on Phandroid. A 55-inch 4K Smart TV with Alexa for just $319.97? Yes, really. The Amazon Fire TV 4-Series delivers crystal-clear 4K Ultra HD visuals, built-in Fire TV streaming, and Alexa voice controlwithout the … [+2600 chars]",Phandroid - News for Android,Tyler Lee,https://phandroid.com/2025/03/19/lowest-price-ever-amazon-fire-tv-55-4k-now-319-97-save-200/,2025-03-19T05:59:25Z,Amazon stock,2025-03-20 10:31:52.509589
NewsAPI,AMZN,Amazon,Visible and Mint Mobile are both carving $400 OFF the Google Pixel 9 — but which carrier deal is better?,"Both Visible and Mint Mobile are currently dropping 50% off the Pixel 9 when you pay for a year of wireless in advance, but which deal should you choose? The reveal of the Google Pixel 9a appears to be just days away (if you believe the latest rumors), but retailers are already prepping for the occasion by dropping some of the best Pixel 9 deals this … [+2480 chars]",Android Central,patrick.farmer@futurenet.com (Patrick Farmer),https://www.androidcentral.com/phones/visible-and-mint-mobile-are-both-carving-usd400-off-the-google-pixel-9-but-which-carrier-deal-is-better,2025-03-14T17:34:07Z,Amazon stock,2025-03-20 10:31:52.509589
NewsAPI,AMZN,Amazon,Tech employees are getting the message: Play time's over,"The tables have turned for tech employees as performance pressure and proclamations of ""efficiency"" and ""intensity"" replace perks and pampering. Saul Loeb/AFP via Getty; Getty; Rebecca Zisser/BI <ul><li>A trifecta of economics, post-pandemic realities, and political pressure is changing tech culture.</li><li>From Big Tech to Silicon Valley s… [+11774 chars]",Business Insider,"Ashley Stewart,Hugh Langley,Melia Russell,Dan Whateley,Madeline Stone,Ben Bergman,Rebecca Torrence",https://www.businessinsider.com/tech-industry-amazon-microsoft-meta-google-companies-intensity-hardcore-2025-3,2025-03-19T09:00:01Z,Amazon stock,2025-03-20 10:31:52.509589
NewsAPI,AMZN,Amazon,The Last Of Us Limited-Edition PS5 Controller Preorders Restocked At Major Retailers,"The Last Of Us Limited Edition DualSense Controller $85 | Releases April 10 Preorder at Target Preorder at Best Buy Preorder at PS Direct Preorder at Amazon See at Walmart Preorder at GameStop After selling out almost instantly when preorders opened on… After selling out almost instantly when preorders opened on March 14, The Last of Us Limited Edition DualSense Controller is back in stock at two major retailers. As of March 17 at 2 PM PT, Target an… [+2452 chars]",GameSpot,Steven Petite,https://www.gamespot.com/articles/the-last-of-us-limited-edition-ps5-controller-preorders-restocked-at-major-retailers/1100-6529950/,2025-03-17T21:59:00Z,Amazon stock,2025-03-20 10:31:52.510253
NewsAPI,AMZN,Amazon,"Deals: iPad mini 7 $100 off, new lows on M3 iPad Air, Apple Studio Display $300 off, Alpine Loop, more","Alongside the ongoing straight up cash deals on the new M4 MacBook Air lineup, today we are turning our attention over to the iPads. Amazon has now dropped the prices even lower across most of the new M3 iPad Air configurations while marking the return of all… Alongside the ongoing straight up cash deals on the new M4 MacBook Air lineup, today we are turning our attention over to the iPads. Amazon has now dropped the prices even lower across most of the ne… [+5699 chars]",9to5Mac,Justin Kahn,https://9to5mac.com/2025/03/17/deals-ipad-mini-ipad-air-apple-studio-display/,2025-03-17T15:46:08Z,Amazon stock,2025-03-20 10:31:52.510253
NewsAPI,AMZN,Amazon,Limited-Time Deal: Amazon Fire HD 10 Tablet – Now $94.99 (Was $139.99)!,"The Amazon Fire HD 10 (Newest Model) is currently on sale for just $94.99, down from its regular price of $139.99—that’s 32% off! If you’re looking for an affordable, high-performance tablet for entertainment, reading, or even light work, this deal is too goo… The Amazon Fire HD 10 (Newest Model) is currently on sale for just $94.99, down from its regular price of $139.99thats 32% off! If youre looking for an affordable, high-performance tablet for enterta… [+2948 chars]",Phandroid - News for Android,Tyler Lee,https://phandroid.com/2025/03/17/limited-time-deal-amazon-fire-hd-10-tablet-now-94-99-was-139-99/,2025-03-17T11:55:23Z,Amazon stock,2025-03-20 10:31:52.510253
NewsAPI,AMZN,Amazon,BI spoke with federal workers who voted for Trump — some have come to regret it,"""I feel betrayed. This is not what I wanted, to let everybody lose their job."" Donald Trump's tariffs have put dealmaking on holdWin McNamee/Getty Images <ul><li>This post originally appeared in the Business Insider Today newsletter.</li><li>You can sign up for Business Inside… [+6818 chars]",Business Insider,Hallam Bullock,https://www.businessinsider.com/federal-workers-regret-voting-trump-doge-layoffs-elon-musk-2025-3,2025-03-17T11:07:57Z,Amazon stock,2025-03-20 10:31:52.510253
NewsAPI,AMZN,Amazon,"Deals: 24GB/1TB M4 Pro MacBook Pro $270 off, M3 iPad Air $549 low, Apple Pencil Pro, Find My tumbler, more","Now sitting alongside the ongoing $100 price drops on the latest M4 Mac mini as well as the iPad mini 7, Amazon has dropped the prices again on the most affordable new M3 iPad Air models – you’ll now find straight up cash deals from $549. All of that joins th… Now sitting alongside the ongoing $100 price drops on the latest M4 Mac mini as well as the iPad mini 7, Amazon has dropped the prices again on the most affordable new M3 iPad Air models youll now fi… [+6824 chars]",9to5Mac,Justin Kahn,https://9to5mac.com/2025/03/18/deals-m4-pro-macbook-pro-m3-ipad-air-apple-pencil-pro/,2025-03-18T15:45:46Z,Amazon stock,2025-03-20 10:31:52.510253
NewsAPI,AMZN,Amazon,"Deals: New M4 MacBook Air $949 low, iPhone 15 Pro Max $426 off orig. price, 1TB M4 iPad Pro $250 off, more",We are ready to cap the work week off in Apple deals with ongoing price drops on both AirPods 4 from $100 and the lauded AirPods Pro 2 at $170. But we have some fresh new deals including all four colors of Apple’s most affordable new M4 MacBook Air at all-tim… We are ready to cap the work week off in Apple deals with ongoing price drops on both AirPods 4 from $100 and the lauded AirPods Pro 2 at $170. But we have some fresh new deals including all four col… [+6564 chars],9to5Mac,Justin Kahn,https://9to5mac.com/2025/03/14/deals-m4-macbook-air-iphone-15-pro-max-m4-ipad-pro/,2025-03-14T15:45:23Z,Amazon stock,2025-03-20 10:31:52.510253
NewsAPI,AMZN,Amazon,Astro Bot PS5 Slim Bundles Are Available Now - $50 Cheaper Than PS5 On Its Own,"PS5 Slim Astro Bot Console Bundle $450 See at Amazon See at PS Direct See at Best Buy PS5 Slim Digital Astro Bot Console Bundle $400 See at Amazon See at PS Direct See at Best Buy Following a leak last month, PlayStation has confirmed the existe… Following a leak last month, PlayStation has confirmed the existence of PS5 Slim Astro Bot bundles. The console bundles are available now at Amazon, PlayStation Direct, and other major retailers. and… [+1447 chars]",GameSpot,Steven Petite,https://www.gamespot.com/articles/astro-bot-ps5-slim-bundles-are-available-now-50-cheaper-than-ps5-on-its-own/1100-6529417/,2025-03-13T14:25:00Z,Amazon stock,2025-03-20 10:31:52.510253
NewsAPI,AMZN,Amazon,Quantum stocks rebound from dip after new 'supremacy' announcement,"Quantum stocks spiked after D-Wave said its quantum machines can outperform classical tech, helping the industry rebound after recent skepticism. D-Wave on March 12 announced it had achieved quantum supremacy with its annealing chip.D-Wave <ul><li>D-Wave on Wednesday announced it had achieved quantum supremacy with its annealing chip.</li><li… [+4711 chars]",Business Insider,Katherine Tangalakis-Lippert,https://www.businessinsider.com/quantum-stocks-rally-supremacy-advantage-announcement-dwave-2025-3,2025-03-13T02:07:32Z,Amazon stock,2025-03-20 10:31:52.510253
NewsAPI,AMZN,Amazon,6.6-Oz Goldfish Crackers (various) 2 for $4 or Less & More,Amazon has select *6.6-Oz Goldfish Crackers* on sale at *2 for $4 or less* (discount shown at checkout). *Shipping is free* with Amazon Prime or on orders $35+. *Available* (you may mix & match;... Amazon has select 6.6-Oz Goldfish Crackers on sale at 2 for $4 or less (discount shown at checkout). Shipping is free with Amazon Prime or on orders $35+.Available (you may mix &amp; match; price may… [+890 chars],Slickdeals.net,tunabreath,https://slickdeals.net/f/18177667-6-6-oz-goldfish-crackers-various-2-for-4-or-less-more?utm_source=rss&utm_content=fp&utm_medium=RSS2,2025-03-15T04:40:12Z,Amazon stock,2025-03-20 10:31:52.510253
NewsAPI,AMZN,Amazon,Logitech G305 Lightspeed Wireless Gaming Mouse (Black) $26.30,Amazon has *Logitech G305 Lightspeed Wireless Gaming Mouse* (Black) for *$**26.33*. *Shipping is free* w/ Prime or on $35+ orders. Walmart also has *Logitech G305 Lightspeed Wireless Gaming Mouse*... Amazon has Logitech G305 Lightspeed Wireless Gaming Mouse (Black) for $26.33. Shipping is free w/ Prime or on $35+ orders.Walmart also has Logitech G305 Lightspeed Wireless Gaming Mouse (Black) for $… [+1527 chars],Slickdeals.net,Eragorn,https://slickdeals.net/f/18180322-logitech-g305-lightspeed-wireless-gaming-mouse-black-26-30,2025-03-15T23:56:57Z,Amazon stock,2025-03-20 10:31:52.510838
NewsAPI,AMZN,Amazon,Logitech G305 Lightspeed Wireless Gaming Mouse (Black) $26.30,Amazon has *Logitech G305 Lightspeed Wireless Gaming Mouse* (Black) for *$**26.33*. *Shipping is free* w/ Prime or on $35+ orders. Walmart also has *Logitech G305 Lightspeed Wireless Gaming Mouse*... Amazon has Logitech G305 Lightspeed Wireless Gaming Mouse (Black) for $26.33. Shipping is free w/ Prime or on $35+ orders.Walmart also has Logitech G305 Lightspeed Wireless Gaming Mouse (Black) for $… [+1527 chars],Slickdeals.net,Eragorn,https://slickdeals.net/f/18180322-logitech-g305-lightspeed-wireless-gaming-mouse-black-26-33-free-shipping-w-prime-or-on-35?utm_source=rss&utm_content=fp&utm_medium=RSS2,2025-03-15T23:56:57Z,Amazon stock,2025-03-20 10:31:52.510838
NewsAPI,AMZN,Amazon,Apple Overpromised on AI Siri and Its Staff Is Not Happy About it,"Siri chief reportedly called the delay in features ""ugly."" Last week, in a classic Friday news dump, Apple made the deeply embarrassing announcement that it would be delaying plans to infuse its voice assistant Siri with artificial intelligence-powered capab… [+2586 chars]",Gizmodo.com,AJ Dellinger,https://gizmodo.com/apple-overpromised-on-ai-siri-and-its-staff-is-not-happy-about-it-2000576368,2025-03-15T14:40:47Z,Amazon stock,2025-03-20 10:31:52.510838
NewsAPI,AMZN,Amazon,AU Deals: The Hottest Bargains From Amazon Prime Big Smile and the Steam Spring Sale Both!,"Great gaming bargain seasons don't come around very often, so now’s the perfect time to stock up on some absolute gems. Great gaming bargain seasons don't come around very often, so nows the perfect time to stock up on some absolute gems. Ive been deals trawling like a fiend and todays list nets in the very best catch… [+2817 chars]",IGN,Adam Mathew,https://www.ign.com/articles/au-deals-the-hottest-bargains-from-amazon-prime-big-smile-and-the-steam-spring-sale-both,2025-03-17T23:52:41Z,Amazon stock,2025-03-20 10:31:52.510838
NewsAPI,AMZN,Amazon,How Did This Company With Just 1% Profits Outperform Google Stock?,"Its profit margins are literally around 1%. But its stock has grown 4x in 5 years, way outpacing Google and Amazon. GOOG Stock Trefis MCK Stock Trefis Trefis Google is a tech highflyer. McKesson is no Google. Its profit margins are literally around 1%. But its stock has grown 4x in 5 years, way outpacing Goog… [+5172 chars]",Forbes,"Trefis Team, Contributor, 
 Trefis Team, Contributor
 https://www.forbes.com/sites/greatspeculations/people/trefis/",https://www.forbes.com/sites/greatspeculations/2025/03/18/how-did-this-company-with-just-1-profits-outperform-google-stock/,2025-03-18T09:00:08Z,Amazon stock,2025-03-20 10:31:52.510838
NewsAPI,AMZN,Amazon,AMD Ryzen 5 5500 CPU + ASRock B450M/AC AM4 mATX Motherboard + Thermal Paste $129.60 + Free Shipping,Newegg [newegg.com] has the *AMD Ryzen 5 5500 CPU + ASRock B450M/AC R2.0 AM4 M-ATX Motherboard + Cooler Master CryoFuze Thermal Paste *on sale for *$129.59. Shipping is free. * *Specs*:[LIST][*]CPU... Two factors help this match in price but potentially beat in value anything you can build at a local Micro Center:MC sells the AMD Ryzen 5 4500 at $60(pricing the AMD Ryzen 5 5500 at $80)MC hasn't ca… [+586 chars],Slickdeals.net,Meowssi,https://slickdeals.net/f/18180313-amd-ryzen-5-5500-cpu-asrock-b450m-ac-am4-m-atx-motherboard-cooler-master-cryofuze-thermal-paste-129-59-free-shipping?utm_source=rss&utm_content=fp&utm_medium=RSS2,2025-03-16T00:38:55Z,Amazon stock,2025-03-20 10:31:52.510838
NewsAPI,AMZN,Amazon,4-Pack 60W Sylvania Wi-Fi LED Smart Light Bulbs (Full Color A19) $11.35,"https://www.amazon.com/dp/B088G2B48D Appears to be their lowest price ever. *SYLVANIA Wifi LED Smart Light Bulb, 60W Equivalent Full Color and Tunable White A19, Dimmable, Compatible with Alexa... I been using them for a few Five months due to an even cheaper price at a brick and motor ""overstock"" retailer, I will link below for it is still active$7.99 for Four if they have them in stock at … [+1265 chars]",Slickdeals.net,JerseyJay,https://slickdeals.net/f/18185893-4-pack-60w-sylvania-wi-fi-led-smart-light-bulbs-full-color-a19-11-35?utm_source=rss&utm_content=fp&utm_medium=RSS2,2025-03-18T22:50:41Z,Amazon stock,2025-03-20 10:31:52.510838
NewsAPI,AMZN,Amazon,When the Dotcom Bubble Burst,"The hunt for the next Microsoft created an era of excess that wasn't sustainable 25 years ago, on March 10, 2000, the dotcom bubble reached its peak. The tech-heavy NASDAQ reached its peak that day at 5,048.62, before the bubble burst and stocks went tumbling. Pinpointing when th… [+5967 chars]",Homeip.net,Dave Farquhar,https://dfarq.homeip.net/when-the-dotcom-bubble-burst/,2025-03-16T17:02:34Z,Amazon stock,2025-03-20 10:31:52.510838
NewsAPI,AMZN,Amazon,The Nikon Nikkor Z 35mm f/1.2 lens is now in stock in the US and Canada,"The Nikon Nikkor Z 35mm f/1.2 lens is now in stock in the US and Canada: US: Amazon | B&H Photo | Paul’s Photo | Service Photo CA: Camera Canada Comparing the Nikon NIKKOR Z 35mm f/1.8 and 35mm f/1.4 to the new 35mm f/1.2 lens An updated list of where Nikon Z… FCC disclosure statement: this post may contain affiliate links or promotions that do not cost readers anything but help keep this website alive. As an Amazon Associate, I earn from qualifying purcha… [+253 chars]",Nikonrumors.com,[NR] admin,https://nikonrumors.com/2025/03/18/the-nikon-nikkor-z-35mm-f-1-2-lens-is-now-in-stock-in-the-us-and-canada.aspx/,2025-03-19T01:15:03Z,Amazon stock,2025-03-20 10:31:52.510838
NewsAPI,AMZN,Amazon,I saw Google’s Gemini AI erase image watermarks. I am deeply worried,"Gemini Flash AI model is removing watermarks from copyright-protected images. I witnessed it in action, and I am worried about the future of fair usage ethics. Table of Contents Table of Contents How are the results? What is the policy? A bit of interesting history The road ahead The rise of generative AI has been a fairly messy process, especially fr… [+7327 chars]",Digital Trends,Nadeem Sarwar,https://www.digitaltrends.com/computing/google-gemini-ai-remove-watermark-images-copyright-flaw/,2025-03-17T08:12:01Z,Amazon stock,2025-03-20 10:31:52.510838
NewsAPI,AMZN,Amazon,"Eufy FamiLock S3 Max review: Lock, stock, and onboard video","At a glanceExpert's Rating Pros <ul> <li>Integrated display shows you who’s on the other side of the door</li> <li>Robust build quality, with mostly solid operation</li> <li>Scads of features</li> <li>No subscriptions needed (unless 16GB of loca… Skip to contentType your search and hit enter When you purchase through links in our articles, we may earn a small commission. This doesn't affect our editorial independence . At a glance<ul><li>I… [+11271 chars]",PCWorld,Author: Christopher Null,https://www.pcworld.com/article/2634003/eufy-familock-s3-max-review.html,2025-03-13T17:00:00Z,Amazon stock,2025-03-20 10:31:52.511367
NewsAPI,AMZN,Amazon,The CEO of a packaging automation company says there's no replacing human workers,"Ranpak CEO Omar Asali emphasizes the importance of human labor in warehouses, saying that automation should complement workers, not replace them. Ranpak CEO Omar Asali.Ranpak <ul><li>Ranpak makes sustainable packaging and automated packing systems.</li><li>CEO Omar Asali says a ""dark warehouse"" devoid of workers is not the goal.</li><li>He sa… [+3751 chars]",Business Insider,Madeline Stone,https://www.businessinsider.com/how-ranpak-uses-ai-automation-enhance-amazon-warehouse-operations-2025-3,2025-03-14T09:00:02Z,Amazon earnings,2025-03-20 10:31:53.773137
NewsAPI,AMZN,Amazon,The streaming wars are over. The rich won.,"Streaming apps like Netflix, Spotify, and YouTube are adding more tiers, pushing people to upgrade, and increasingly focusing on rich customers. I recently opened Netflix and was prompted to watch an episode of ""Saturday Night Live."" When I clicked, I was told I actually wouldn't be tuning in for the cold open because I pay Netflix the leas… [+9001 chars]",Business Insider,Amanda Hoover,https://www.businessinsider.com/streaming-tv-movies-music-expensive-unequal-spotify-netflix-taylor-swift-2025-3,2025-03-13T08:16:01Z,Amazon earnings,2025-03-20 10:31:53.773137
NewsAPI,AMZN,Amazon,The most innovative companies in retail for 2025,"As generative AI advanced at warp speed over the past year, innovative retail companies continued to find practical ways to incorporate the technology, helping shoppers to efficiently find what they want—even when they don’t know what they’re looking for. Ama… As generative AI advanced at warp speed over the past year, innovative retail companies continued to find practical ways to incorporate the technology, helping shoppers to efficiently find what they … [+15037 chars]",Fast Company,Yasmin Gagne,https://www.fastcompany.com/91269908/retail-most-innovative-companies-2025,2025-03-18T11:00:00Z,Amazon earnings,2025-03-20 10:31:53.773729
NewsAPI,AMZN,Amazon,"Google Co-Founder Says Employees Should Be In The Office ""At Least"" Every Weekday As Competition In The AI Arms Race Intensifies","Cancel your weekends! That seemed to be the message Google (NASDAQ:GOOG, GOOGL)) co-founder Sergey Brin told employees when urging them to be in the office “... Google Co-Founder Says Employees Should Be In The Office ""At Least"" Every Weekday As Competition In The AI Arms Race Intensifies Benzinga and Yahoo Finance LLC may earn commission or revenue on some… [+3740 chars]",Yahoo Entertainment,Jeff Vasishta,https://finance.yahoo.com/news/google-co-founder-says-employees-141539761.html,2025-03-18T14:15:39Z,Amazon earnings,2025-03-20 10:31:53.773729
NewsAPI,AMZN,Amazon,Tech giants call Trump tariffs 'big headache',"Foxconn CEO Young Liu claims major tech partners consider navigating Trump's tariff plays a ""big headache"" in an earnings call this week. Chairman Young Liu claims Foxconn's largest tech partners are getting a ""big headache"" from the Trump administration's tariff strategy. Foxconn held its latest earnings call on Friday, during which L… [+3124 chars]",Tom's Hardware UK,Dallin Grimm,https://www.tomshardware.com/tech-industry/tech-giants-call-trump-tariffs-big-headache,2025-03-15T14:42:54Z,Amazon earnings,2025-03-20 10:31:53.773729
NewsAPI,AMZN,Amazon,The most innovative companies in social media for 2025,"This past year has been one of revivals. Low-rise jeans are back in style, digital cameras are the new favorite way to filter photos, and several cellphone companies even pushed us to buy flip phones again. The trend has been true for social media, too. Parti… This past year has been one of revivals. Low-rise jeans are back in style, digital cameras are the new favorite way to filter photos, and several cellphone companies even pushed us to buy flip phones… [+16290 chars]",Fast Company,Veronica Irwin,https://www.fastcompany.com/91270177/social-media-most-innovative-companies-2025-duolingo-bluesky-boston-celtics-pinterest-partiful-planoly-sesame-workshop-feeld-strava-yelp,2025-03-18T11:00:00Z,Amazon earnings,2025-03-20 10:31:53.773729
NewsAPI,AMZN,Amazon,"Target’s ad business had a good year, but can it become a retail media powerhouse?","Target's ad business continues to grow, but can it compete with retail media network titans like Walmart and Amazon? By the looks of Targets latest earnings call, its ad business continues to be a bright spot for the retailer. Last year, Targets ad business raked in $649 million in revenue, up 25% from the $522 mil… [+8420 chars]",Digiday,Kimeko McCoy,http://digiday.com/marketing/targets-ad-business-had-a-good-year-but-can-it-become-a-retail-media-powerhouse/,2025-03-17T04:01:00Z,Amazon earnings,2025-03-20 10:31:53.773729
